China warns Wuhan virus could mutate and spread as death toll rises,https://www.channelnewsasia.com/news/asia/wuhan-virus-pneumonia-china-warns-could-mutate-spread-death-12300192?cid=FBcna&fbclid=IwAR1YkHssjeJ1T5aialWQJWwSc7JOGaIQAEZmQtpDzYOpbkQmbYKSTRnf_UE,22 Jan 2020 11:20 AM,Channel NewsAsia
Wuhan virus: Infectious diseases centre Singapore's first line of defence,https://www.channelnewsasia.com/news/singapore/wuhan-virus-pneumonia-national-centre-infectious-diseases-12297584?cid=fbcna&fbclid=IwAR1WvgoOQlp8emWtTJoaxnL6xgeIL_9NEVI-iX61eBxVPBPzuvz4cyMMNh0,21 Jan 2020 10:51 PM,Channel NewsAsia
Wuhan virus: Death toll rises to 6 as number of cases climbs past 300 in China,https://www.channelnewsasia.com/news/asia/wuhan-virus-pneumonia-china-300-cases-6-dead-coronavirus-12297438?cid=fbcna&fbclid=IwAR08MrB2B8MP9xikpfgNQmy08C1nW-1J1BbSSpC-nuav9Q2x-vjc9vtaUFY,21 Jan 2020 10:22 PM,Channel NewsAsia
"Hong Kong scientists warn of 'super spreader' Wuhan virus, say more than 1,300 likely infected",https://www.channelnewsasia.com/news/asia/wuhan-virus-hong-kong-scientists-warn-super-spreader-12295972,21 Jan 2020 5:44 PM,Channel NewsAsia
"Wuhan virus outbreak: Thai man possibly infected, authorities investigating",https://www.channelnewsasia.com/news/asia/wuhan-virus-outbreak-thai-man-possibly-infected-12295788,21 Jan 2020 4:33 PM,Channel NewsAsia
Philippines probes possible case of virus from China,https://www.channelnewsasia.com/news/asia/wuhan-pneumonia-philippines-probing-possible-case-virus-china-12295636?cid=FBcna&fbclid=IwAR0BbFKmAYc9fqmiddM0PiattjbZtDzq2Wmx4ixtNjRjno6LeCD903W3oKY,21 Jan 2020 3:40 PM,Channel NewsAsia
Wuhan pneumonia outbreak: A timeline of how the new coronavirus spread,https://www.channelnewsasia.com/news/asia/wuhan-pneumonia-china-virus-coronavirus-timeline-spread-12294320,21 Jan 2020 10:48 AM,Channel NewsAsia
China confirms human-to-human transmission of Wuhan virus as WHO announces emergency meet,https://www.channelnewsasia.com/news/asia/wuhan-pneumonia-coronavirus-china-confirms-human-transmission-12293414,21 Jan 2020 2:27 AM,Channel NewsAsia
"Wuhan virus outbreak: 15 medical workers infected, 1 in critical condition",https://www.channelnewsasia.com/news/asia/wuhan-pneumonia-outbreak-health-workers-coronavirus-12294212,21 Jan 2020 9:47 AM,Channel NewsAsia
Wuhan virus: All travellers arriving in Singapore from China to undergo temperature screening,https://www.channelnewsasia.com/news/singapore/wuhan-pneumonia-coronavirus-outbreak-china-travellers-singapore-12291456,20 Jan 2020 7:42 PM,Channel NewsAsia
Chinese travellers unfazed as SARS-like virus spreads,https://www.channelnewsasia.com/news/asia/china-wuhan-pneumonia-coronavirus-spread-chinese-new-year-12290728,20 Jan 2020 5:46 PM,Channel NewsAsia
China reports 17 new cases in Wuhan virus outbreak,https://www.channelnewsasia.com/news/asia/china-reports-17-new-cases-in-wuhan-virus-outbreak-12282400?cid=fbcna&fbclid=IwAR3CO7nxmw4Pqc1h1rqzy9PVijYfmhO7CGyWMkdq7DHVRGwyaJ_U-TprcRg,19 Jan 2020 10:30 AM,Channel NewsAsia
Wuhan pneumonia virus casts shadow over Chinese New Year festival,https://www.channelnewsasia.com/news/asia/wuhan-pneumonia-virus-shadow-chinese-new-year-12278808?cid=FBcna&fbclid=IwAR14dJNHfd9xOBkuyYYAQmWJUBuVyLSkfZ94O9LwFCp2JnTen5sgm7QY4Z4,18 Jan 2020 5:17 PM,Channel NewsAsia
China reports four more cases in Wuhan virus outbreak,https://www.channelnewsasia.com/news/asia/china-reports-four-more-cases-in-wuhan-virus-outbreak-12278384?cid=FBcna&fbclid=IwAR1JZ3tVBfRHd5RgoqVxgs7p_jK1Ur27nBIIVNmZkegOBTSJZGRQTbIu0HI,18 Jan 2020 10:33 AM,Channel NewsAsia
"Australia to screen some China flights, warns new virus difficult to stop",https://www.channelnewsasia.com/news/world/wuhan-pneumonia-coronavirus-outbreak-australia-screening-12294170,21 Jan 2020 8:46 AM,Channel NewsAsia
Hundreds likely affected by China virus: Researchers,https://www.channelnewsasia.com/news/asia/wuhan-hundreds-likely-affected-by-china-virus-researchers-12278290?cid=FBcna&fbclid=IwAR3wAfsX8EjMGHvKVZYr95EiezLdhNINVm_6JtGR8lEMMDTBk7AEM0zjgoA,18 Jan 2020 10:14 AM,Channel NewsAsia
Wuhan pneumonia virus casts shadow over Chinese New Year festival,https://www.channelnewsasia.com/news/asia/wuhan-pneumonia-virus-shadow-chinese-new-year-12278808,18 Jan 2020 5:17 PM,Channel NewsAsia
"Thailand finds second case of new Wuhan virus, says no outbreak",https://www.channelnewsasia.com/news/asia/wuhan-pneumonia-outbreak-thailand-second-case-coronavirus-12272486,17 Jan 2020 1:58 PM,Channel NewsAsia
Second person dies in Wuhan pneumonia outbreak,https://www.channelnewsasia.com/news/asia/wuhan-pneumonia-outbreak-china-second-dead-sars-12270432,17 Jan 2020 8:58 AM,Channel NewsAsia
"Singaporean man with pneumonia warded, isolated after travel to Wuhan: MOH",https://www.channelnewsasia.com/news/singapore/wuhan-pneumonia-outbreak-possible-case-reported-singapore-moh-12268870,16 Jan 2020 8:06 PM,Channel NewsAsia
"Japan confirms case of new Chinese virus, spread is 'concerning'",https://www.channelnewsasia.com/news/world/wuhan-pneumonia-coronavirus-outbreak-japan-first-case-12267106,16 Jan 2020 10:36 AM,Channel NewsAsia
Mystery China virus patients could have infected family members: Officials,https://www.channelnewsasia.com/news/asia/wuhan-pneumonia-virus-china-infected-family-members-12265616,15 Jan 2020 6:24 PM,Channel NewsAsia
Spread of new China virus 'possible': WHO,https://www.channelnewsasia.com/news/world/who-wuhan-pneumonia-virus-china-spread-warning-hospitals-12262254,14 Jan 2020 6:51 PM,Channel NewsAsia
Residents 'not worried' in China's pneumonia-stricken Wuhan,https://www.channelnewsasia.com/news/asia/china-wuhan-virus-pneumonia-outbreak-residents-not-worried-12256282,12 Jan 2020 5:47 PM,Channel NewsAsia
China reports first death from Wuhan pneumonia outbreak,https://www.channelnewsasia.com/news/asia/china-wuhan-first-death-pneumonia-12253512,11 Jan 2020 9:46 AM,Channel NewsAsia
Chinese man warded with pneumonia after travel to Wuhan not linked to outbreak in China: MOH,https://www.channelnewsasia.com/news/singapore/chinese-man-tests-pneumonia-wuhan-moh-outbreak-12254738,11 Jan 2020 9:19 PM,Channel NewsAsia
China pneumonia outbreak may be linked to new type of virus: WHO,https://www.channelnewsasia.com/news/asia/china-pneumonia-outbreak-may-be-linked-to-new-type-of-virus--who-12245550,09 Jan 2020 7:05 AM,Channel NewsAsia
8 Chinese patients diagnosed with unidentified virus released from hospital: Report,https://www.channelnewsasia.com/news/asia/8-chinese-patients-diagnosed-with-unidentified-virus-released-12244450,08 Jan 2020 10:19 PM,Channel NewsAsia
US to screen passengers for new China coronavirus at three airports,https://www.channelnewsasia.com/news/world/us-screen-passengers-new-china-coronavirus-wuhan-airports-12277780,18 Jan 2020 3:30 AM,Channel NewsAsia
US warns citizens in China against pneumonia outbreak,https://www.channelnewsasia.com/news/asia/wuhan-pneumonia-mystery-virus-outbreak-cdc-12264974,15 Jan 2020 3:32 PM,Channel NewsAsia
Chinese woman with mystery virus quarantined in Thailand,https://www.channelnewsasia.com/news/asia/chinese-woman-mystery-virus-quarantined-thailand-wuhan-pneumonia-12259128,13 Jan 2020 7:45 PM,Channel NewsAsia
Commentary: China's Wuhan pneumonia outbreak stirs debate over costly virus hunting,https://www.channelnewsasia.com/news/commentary/china-wuhan-pneumonia-outbreak-virus-cure-immune-shot-12250762,11 Jan 2020 6:18 AM,Channel NewsAsia
"Chinese man with pneumonia warded, isolated after travel to Wuhan: MOH",https://www.channelnewsasia.com/news/singapore/chinese-man-warded-isolated-suspected-pneumonia-wuhan-12250874,10 Jan 2020 7:15 PM,Channel NewsAsia
"Tests show Chinese girl warded with pneumonia, Wuhan travel history not linked to outbreak in China: MOH",https://www.channelnewsasia.com/news/singapore/chinese-girl-pneumonia-travel-wuhan-common-illness-no-link-12235280,05 Jan 2020 8:39 PM,Channel NewsAsia
"Chinese girl with pneumonia warded, isolated after travel to Wuhan: MOH",https://www.channelnewsasia.com/news/singapore/wuhan-pneumonia-outbreak-china-girl-warded-isolated-singapore-12233644,04 Jan 2020 9:00 PM,Channel NewsAsia
"MOH monitoring China pneumonia outbreak, will implement temperature screening at Changi Airport",https://www.channelnewsasia.com/news/singapore/china-wuhan-pneumonia-moh-changi-airport-temperature-monitoring-12228094,02 Jan 2020 9:33 PM,Channel NewsAsia