Index,Title,URL,Date,Time,Channel
226,More than 80% of COVID-19 patients have mild disease and recover: WHO chief,https://www.channelnewsasia.com/news/world/covid-19-coronavirus-who-china-patients-have-mild-disease-12445010,18-02-2020,03:37:35,Channel NewsAsia
227,Woman in China uses laundry pole to feed pet dog as its owner stuck in Wuhan lockdown,https://mothership.sg/2020/02/china-woman-feed-dog-window/,20-02-2020,10:48:08,Mothership
228,"China Covid-19 death toll hits 2,118",https://mothership.sg/2020/02/wuhan-virus-death-feb-20/,20-02-2020,09:40:26,Mothership
229,Employee at One Raffles Quay South Tower confirmed with Covid-19,https://mothership.sg/2020/02/one-raffles-quay-covid-19/,20-02-2020,09:24:15,Mothership
230,"South Korea reports first death from Covid-19, 104 total confirmed cases",https://mothership.sg/2020/02/south-korea-first-death-covid-19/,20-02-2020,09:21:15,Mothership
231,A Bangladeshi infected with coronavirus is now in ‘very critical condition’,https://www.theonlinecitizen.com/2020/02/20/a-bangladeshi-infected-with-coronavirus-is-now-in-very-critical-condition/,20-02-2020,10:03:57,The Online Citizen
232,"Government says there is sufficient supply of masks, but Minister Chan says there is 'limited stock'",https://www.theonlinecitizen.com/2020/02/20/government-says-there-is-sufficient-supply-of-masks-but-minister-chan-says-there-is-limited-stock/,20-02-2020,07:03:13,The Online Citizen
233,Raffles House Preschool confirms mother of two children infected with Covid-19,https://www.theonlinecitizen.com/2020/02/20/raffles-house-preschool-confirms-mother-of-two-children-infected-with-covid-19/,20-02-2020,05:36:02,The Online Citizen
234,Three additional cases of COVID-19 infection confirmed by MOH; One case was admitted as dengue patient before diagnosed,https://www.theonlinecitizen.com/2020/02/20/three-additional-cases-of-covid-19-infection-confirmed-by-moh-two-cases-are-traceable/,19-02-2020,16:00:36,The Online Citizen
235,Govt seeking to develop local manufacturing capabilities for face masks: MND,https://www.theonlinecitizen.com/2020/02/19/govt-seeking-to-develop-local-manufacturing-capabilities-for-face-masks-mnd/,19-02-2020,11:27:17,The Online Citizen
236,Singapore construction firms seeking advice on force majeure amidst Covid-19,https://www.theonlinecitizen.com/2020/02/19/singapore-construction-firms-seeking-advice-on-force-majeure-amidst-covid-19/,19-02-2020,09:05:47,The Online Citizen
237,Manpower Ministry cautions employers to not send healthy workers to hospitals for COVID-19 testing,https://www.theonlinecitizen.com/2020/02/19/manpower-ministry-cautions-employers-to-not-send-healthy-workers-to-hospitals-for-covid-19-testing/,19-02-2020,07:06:24,The Online Citizen
238,Hong Kong reports second coronavirus fatality,https://www.theonlinecitizen.com/2020/02/19/hong-kong-reports-second-coronavirus-fatality/,19-02-2020,04:07:22,The Online Citizen
239,"Malaysian police chief tells Jho Low, reportedly in Wuhan, to come home if he’s infected with Covid-19",http://theindependent.sg/malaysian-police-chief-tells-jho-low-reportedly-in-wuhan-to-come-home-if-hes-infected-with-covid-19/,20-02-2020,08:20:13,The Independent Singapore
240,Did novelists predict Wuhan coronavirus in 1981 and 2008?,http://theindependent.sg/did-novelists-predict-wuhan-coronavirus-in-1981-and-2008/,20-02-2020,08:00:36,The Independent Singapore
241,"Morning brief: COVID-19 update for Feb 20, 2020",http://theindependent.sg/morning-brief-covid-19-update-for-feb-20-2020/,20-02-2020,03:31:41,The Independent Singapore
242,S’pore to develop local manufacturing capabilities to produce face masks,http://theindependent.sg/spore-to-develop-local-manufacturing-capabilities-to-produce-face-masks/,20-02-2020,01:10:52,The Independent Singapore
243,"World is approaching coronavirus tipping point, experts say",https://www.theguardian.com/world/2020/feb/23/world-is-approaching-coronavirus-tipping-point-experts-say,23-02-2020,17:13:08,The Guardian
244,Italy imposes draconian rules to stop spread of coronavirus,https://www.theguardian.com/world/2020/feb/23/italy-draconian-measures-effort-halt-coronavirus-outbreak-spread,23-02-2020,18:58:15,The Guardian
245,Coronavirus outbreak: four cruise ship passengers test positive in UK  – live news,https://www.theguardian.com/world/live/2020/feb/23/coronavirus-outbreak-woman-tests-positive-after-disembarking-diamond-princess-live-news,23-02-2020,18:18:13,The Guardian
246,Italy hit by largest coronavirus outbreak outside Asia – video,https://www.theguardian.com/world/video/2020/feb/23/italy-largest-coronavirus-outbreak-outside-asia-video,23-02-2020,13:50:57,The Guardian
247,Coronavirus: couples in Philippines marry wearing masks  – video,https://www.theguardian.com/world/video/2020/feb/22/coronavirus-couples-in-philippines-marry-wearing-masks-video,22-02-2020,14:00:22,The Guardian
248,"Coronavirus: 'Window of opportunity narrowing,' says WHO director – video",https://www.theguardian.com/world/video/2020/feb/21/coronavirus-window-of-opportunity-narrowing-says-who-director-video,21-02-2020,20:01:04,The Guardian
249,"Coronavirus: as mask shortages bite, what must Carrie Lam do to fix Hong Kong’s supply crisis?",https://www.scmp.com/news/hong-kong/health-environment/article/3051976/coronavirus-mask-shortages-bite-what-must-carrie,24-02-2020,00:00:16,South China Morning Post
250,Hong Kong property heavyweight branches out as it pumps millions into face mask production,https://www.scmp.com/news/hong-kong/hong-kong-economy/article/3051985/hong-kong-property-heavyweight-branches-out-it,23-02-2020,23:05:10,South China Morning Post
251,"Laid low by coronavirus, Wuhan’s industrial heart is kept beating by its defence industries",https://www.scmp.com/news/china/military/article/3051193/laid-low-coronavirus-wuhans-industrial-heart-kept-beating-its,23-02-2020,18:00:07,South China Morning Post
252,"Coronavirus: Italy battles outbreak surge as three die, total cases rise to over 100",https://www.scmp.com/news/world/europe/article/3052003/coronavirus-italy-battles-outbreak-surge-cases-rise-over-100,23-02-2020,15:50:05,South China Morning Post
253,"Coronavirus: don’t let down your guard just yet, cooped-up Chinese residents warned",https://www.scmp.com/news/china/society/article/3051999/coronavirus-dont-let-down-your-guard-just-yet-cooped-chinese,23-02-2020,15:30:08,South China Morning Post
254,"Trapped, desperate, and pregnant: expectant mothers among Hongkongers stranded in epicentre of deadly coronavirus with no help in sight",https://www.scmp.com/news/hong-kong/politics/article/3052000/trapped-desperate-and-pregnant-expectant-mothers-among,23-02-2020,15:07:12,South China Morning Post
255,"Iran announces low election turnout, blames coronavirus ‘propaganda’",https://www.scmp.com/news/world/middle-east/article/3051996/iran-announces-low-election-turnout-blames-coronavirus,23-02-2020,14:19:46,South China Morning Post
256,"Coronavirus: prisons must learn from outbreak, China’s top legal official says",https://www.scmp.com/news/china/society/article/3051983/coronavirus-prisons-must-learn-outbreak-chinas-top-legal,23-02-2020,13:00:13,South China Morning Post
257,"Coronavirus is China’s fastest-spreading public health crisis, President Xi Jinping says",https://www.scmp.com/news/china/politics/article/3051988/coronavirus-chinas-fastest-spreading-public-health-crisis,23-02-2020,12:24:12,South China Morning Post
258,"Coronavirus did not originate in Wuhan seafood market, Chinese scientists say",https://www.scmp.com/news/china/science/article/3051981/coronavirus-did-not-originate-wuhan-seafood-market-chinese,23-02-2020,11:38:08,South China Morning Post
259,"Coronavirus: Hong Kong’s low-income families struggling to afford masks and disinfectant, new study claims",https://www.scmp.com/news/hong-kong/health-environment/article/3051968/coronavirus-hong-kongs-low-income-families,23-02-2020,09:15:51,South China Morning Post
260,Coronavirus: Wuhan to quarantine all cured patients for 14 days after some test positive again,https://www.scmp.com/news/china/society/article/3051966/coronavirus-wuhan-quarantine-all-cured-patients-14-days-after,23-02-2020,09:06:25,South China Morning Post
261,Iran rocked by ‘rapid’ coronavirus outbreak,https://www.scmp.com/news/world/middle-east/article/3051965/iran-takes-drastic-steps-contain-rapid-coronavirus-outbreak,23-02-2020,08:42:57,South China Morning Post
262,Coronavirus: Taiwanese workers call time on mainland China over Covid-19 fears,https://www.scmp.com/news/china/society/article/3051961/taiwanese-workers-call-time-mainland-china-over-covid-19-fears,23-02-2020,08:15:10,South China Morning Post
263,Chinese targeted in Russia raids as coronavirus fears spread,https://www.scmp.com/news/world/russia-central-asia/article/3051964/chinese-targeted-russia-raids-coronavirus-fears,23-02-2020,08:10:05,South China Morning Post
264,Coronavirus: four more Hong Kong passengers evacuated from Diamond Princess test positive,https://www.scmp.com/news/hong-kong/health-environment/article/3051963/coronavirus-cross-border-driver-among-two-more,23-02-2020,07:48:34,South China Morning Post
265,"Paul Chan’s budget should ease the pain of the coronavirus crisis in Hong Kong, but not much more",https://www.scmp.com/comment/opinion/article/3051840/paul-chans-budget-should-ease-pain-coronavirus-crisis-hong-kong-not,23-02-2020,07:30:15,South China Morning Post
266,Coronavirus: Israel’s ambassador to China under quarantine in Beijing after sharing flight with South Koreans infected with Covid-19,https://www.scmp.com/news/china/diplomacy/article/3051960/israels-ambassador-china-under-quarantine-beijing-after,23-02-2020,07:30:00,South China Morning Post
267,Coronavirus comedy: do bad-taste jokes disguise Afghanistan’s outbreak anxiety?,https://www.scmp.com/week-asia/health-environment/article/3051933/coronavirus-comedy-do-bad-taste-jokes-disguise,23-02-2020,07:00:10,South China Morning Post
268,Coronavirus: China’s small businesses ‘still losing blood’ despite creative means of retrieving stranded workers,https://www.scmp.com/economy/china-economy/article/3051838/coronavirus-chinas-small-businesses-still-losing-blood,23-02-2020,07:00:06,South China Morning Post
269,South Korea raises disease alert level to ‘highest’ as coronavirus cases surge,https://www.scmp.com/news/asia/east-asia/article/3051952/grave-coronavirus-situation-south-korean-city-daegu-mayor,23-02-2020,04:10:35,South China Morning Post
270,Coronavirus: 100 Hongkongers still stuck in Japan after third airlift for Diamond Princess cruise passengers,https://www.scmp.com/news/hong-kong/health-environment/article/3051951/coronavirus-100-hongkongers-still-stuck-japan,23-02-2020,04:08:07,South China Morning Post
271,Locked in the land of loss and regretting: one month in China under coronavirus siege,https://www.scmp.com/news/china/society/article/3051947/locked-land-loss-and-regretting-one-month-china-under,23-02-2020,04:00:24,South China Morning Post
272,Vietnam counts the economic cost of the Covid-19 epidemic,https://www.scmp.com/news/china/diplomacy/article/3051898/vietnam-counts-economic-cost-covid-19-epidemic,23-02-2020,04:00:21,South China Morning Post
273,"On birthday, Japan’s Emperor Naruhito talks about coronavirus and ill Empress Masako’s ‘ups and downs’",https://www.scmp.com/news/asia/east-asia/article/3051948/birthday-japans-emperor-naruhito-talks-about-coronavirus-and,23-02-2020,03:00:54,South China Morning Post
274,Coronavirus: to Chinese democracy what Chernobyl was to glasnost?,https://www.scmp.com/week-asia/opinion/article/3051831/coronavirus-chinese-democracy-what-chernobyl-was-glasnost,23-02-2020,03:00:12,South China Morning Post
275,Coronavirus spurs Singapore and Hong Kong Christians to see crisis as test of faith and unity,https://www.scmp.com/week-asia/health-environment/article/3051932/coronavirus-spurs-singapore-and-hong-kong-christians,23-02-2020,01:30:09,South China Morning Post
276,The West unleashes a new strain of racism in the name of coronavirus prevention,https://www.scmp.com/comment/opinion/article/3051744/west-unleashes-new-strain-racism-name-coronavirus-prevention,23-02-2020,01:15:10,South China Morning Post
277,Coronavirus outbreak leaves Hong Kong funeral homes facing coffin shortage,https://www.scmp.com/news/hong-kong/health-environment/article/3051924/coronavirus-killer-disease-leaves-hong-kong,23-02-2020,01:00:10,South China Morning Post
278,Coronavirus Live Updates: South Korea Raises Threat Alert Level,https://www.nytimes.com/2020/02/23/world/asia/china-coronavirus.html,24-02-2020,00:13:33,The New York Times
279,"As Coronavirus Cases Spiral, South Korea Raises Threat Alert Level",https://www.nytimes.com/2020/02/23/world/asia/south-korea-coronavirus-moon.html,23-02-2020,22:28:58,The New York Times
280,Religious Groups in China Step Into the Coronavirus Crisis,https://www.nytimes.com/2020/02/23/world/asia/china-religion-coronavirus-donations.html,23-02-2020,21:29:55,The New York Times
281,‘We’re in a Petri Dish’: How a Coronavirus Ravaged a Cruise Ship,https://www.nytimes.com/2020/02/22/world/asia/coronavirus-japan-cruise-ship.html,23-02-2020,10:37:23,The New York Times
282,Coronavirus Spreads as New Cases Double in South Korea,https://www.nytimes.com/2020/02/22/world/asia/coronavirus-south-korea-iran.html,23-02-2020,06:13:24,The New York Times
283,Trump Was Furious That Passengers With Coronavirus Were Brought Back to U.S.,https://www.nytimes.com/2020/02/22/us/politics/trump-coronavirus-cruise-ship.html,23-02-2020,14:58:34,The New York Times
284,"Coronavirus Cases in the United States Reach 34, and More Are Expected",https://www.nytimes.com/2020/02/21/health/coronavirus-cases-usa.html,22-02-2020,17:20:27,The New York Times
285,"With 4 Deaths in Iran and More Cases on 3 Continents, Fears of Coronavirus Pandemic Rise",https://www.nytimes.com/2020/02/21/world/asia/china-coronavirus-iran.html,22-02-2020,05:52:49,The New York Times
286,Shadowy Church Is at Center of Coronavirus Outbreak in South Korea,https://www.nytimes.com/2020/02/21/world/asia/south-korea-coronavirus-shincheonji.html,22-02-2020,05:54:35,The New York Times
287,"Russia, Germany, Coronavirus: Your Friday Briefing",https://www.nytimes.com/2020/02/21/briefing/russia-germany-coronavirus.html,21-02-2020,06:03:49,The New York Times
288,Why the Coronavirus Seems to Hit Men Harder Than Women,https://www.nytimes.com/2020/02/20/health/coronavirus-men-women.html,20-02-2020,20:39:00,The New York Times
289,"Venice Carnival, Milan Fashion Week disrupted as Italy coronavirus outbreak spooks Europe",http://www.straitstimes.com/world/europe/venice-carnival-milan-fashion-week-disrupted-as-italy-coronavirus-outbreak-spooks,23-02-2020,23:57:04,The Straits Times
290,"As coronavirus pandemic looms, WHO chief Tedros engages Chinese President Xi",http://www.straitstimes.com/world/europe/as-coronavirus-pandemic-looms-who-chief-tedros-engages-chinese-president-xi,23-02-2020,23:24:23,The Straits Times
291,Italy battles to contain Europe's first major outbreak of coronavirus,http://www.straitstimes.com/world/europe/italy-battles-to-contain-europes-first-major-outbreak-of-coronavirus,23-02-2020,23:20:12,The Straits Times
292,"Spread of coronavirus confirms WHO fears, say experts",http://www.straitstimes.com/world/europe/spread-of-coronavirus-confirms-who-fears-say-experts,23-02-2020,22:57:52,The Straits Times
293,Coronavirus: Trains between Italy and Austria resume after passengers test negative,http://www.straitstimes.com/world/europe/coronavirus-austria-stops-train-services-with-italy-over-suspected-infections,23-02-2020,21:07:54,The Straits Times
294,"Coronavirus: Northern towns in Italy shut off, public events cancelled as virus cases go past 130",http://www.straitstimes.com/world/europe/northern-towns-shut-off-public-events-cancelled-as-virus-cases-go-past-130,23-02-2020,21:00:00,The Straits Times
295,Coronavirus: Four patients test positive in Britain after cruise ship evacuation,http://www.straitstimes.com/world/europe/coronavirus-four-patients-test-positive-in-britain-after-cruise-ship-evacuation,23-02-2020,20:28:27,The Straits Times
296,How China's economic fight against coronavirus will unfold,http://www.straitstimes.com/business/economy/how-chinas-economic-fight-against-coronavirus-will-unfold,23-02-2020,21:00:00,The Straits Times
297,Coronavirus: Virus curbs force schools to adapt as National School Games put on hold,http://www.straitstimes.com/sport/schools/virus-curbs-force-schools-to-adapt,23-02-2020,21:00:00,The Straits Times
298,Coronavirus: Enforcement operations manager ensuring foreign workers obey stay-home rules,http://www.straitstimes.com/singapore/ensuring-foreign-workers-obey-stay-home-rules,23-02-2020,21:00:00,The Straits Times
299,"Coronavirus: 'It's a dirty job, but if we don't do it, who will?'",http://www.straitstimes.com/singapore/its-a-dirty-job-but-if-we-dont-do-it-who-will,23-02-2020,21:00:00,The Straits Times
300,"Coronavirus: Trained SCDF officers, ready to attend to potential Covid-19 patients",http://www.straitstimes.com/singapore/trained-ready-to-attend-to-potential-covid-19-patients-front-line-workers-keep-spore-going,23-02-2020,21:00:00,The Straits Times
301,Coronavirus: Cashier going about her work calmly to serve shoppers,http://www.straitstimes.com/singapore/going-about-her-work-calmly-to-serve-shoppers,23-02-2020,21:00:00,The Straits Times
302,Coronavirus: Patients' long ventilator stays put strain on hospitals,http://www.straitstimes.com/asia/australianz/coronavirus-patients-long-ventilator-stays-put-strain-on-hospitals,24-02-2020,00:00:05,The Straits Times
303,Coronavirus lockdowns torment an army of poor migrant workers in China,http://www.straitstimes.com/asia/east-asia/coronavirus-lockdowns-torment-an-army-of-poor-migrant-workers-in-china,23-02-2020,23:38:11,The Straits Times
304,"China pushes factories to reopen, risking renewed coronavirus spread",http://www.straitstimes.com/asia/east-asia/china-pushes-factories-to-reopen-risking-renewed-coronavirus-spread,23-02-2020,23:03:28,The Straits Times
305,South Korea on red alert as coronavirus cases shoot up to 604,http://www.straitstimes.com/asia/east-asia/s-korea-on-red-alert-as-coronavirus-cases-shoot-up-to-604,23-02-2020,21:00:00,The Straits Times
306,Coronavirus: PM Shinzo Abe calls for 'basic policy' to fight spread of disease,http://www.straitstimes.com/asia/east-asia/abe-calls-for-basic-policy-to-fight-spread-of-disease,23-02-2020,21:00:00,The Straits Times
307,"Coronavirus: City 'eerily deserted' as number of cases soar, says Singaporean in Daegu",http://www.straitstimes.com/asia/east-asia/city-eerily-deserted-as-number-of-cases-soar-says-sporean-in-daegu,23-02-2020,21:00:00,The Straits Times
308,Coronavirus is communist nation's largest public health crisis: Xi Jinping,http://www.straitstimes.com/asia/east-asia/virus-is-communist-nations-largest-public-health-crisis-xi,23-02-2020,21:00:00,The Straits Times
309,Coronavirus: Indonesia refuses entry to 118 foreigners to prevent virus spread,http://www.straitstimes.com/asia/se-asia/coronavirus-indonesia-refuses-entry-to-118-foreigners-to-prevent-virus-spread,23-02-2020,17:05:16,The Straits Times
310,"Forum: Fight against coronavirus laudable, but what about dengue effort?",http://www.straitstimes.com/forum/fight-against-coronavirus-laudable-but-what-about-dengue-effort,23-02-2020,21:00:00,The Straits Times
311,Forum: Educate public on disposal of masks,http://www.straitstimes.com/forum/educate-public-on-disposal-of-masks,23-02-2020,21:00:00,The Straits Times
312,Forum: Important to monitor psychological impact of Covid-19,http://www.straitstimes.com/forum/important-to-monitor-psychological-impact-of-covid-19,23-02-2020,21:00:00,The Straits Times
313,"The Big Read: A month into COVID-19 outbreak, retailers, eateries are reeling from near-empty malls and streets",https://www.channelnewsasia.com/news/singapore/covid-19-coronavirus-businesses-rent-sales-12461962,23-02-2020,22:10:40,Channel NewsAsia
314,Commentary: The great COVID-19 disruption to Asian economies has begun,https://www.channelnewsasia.com/news/commentary/covid-19-wuhan-coronavirus-economy-impact-trade-supply-chain-12435728,23-02-2020,22:10:38,Channel NewsAsia
315,Israel confirms second COVID-19 case among cruise ship returnees,https://www.channelnewsasia.com/news/world/israel-confirms-second-covid-19-case-among-cruise-ship-returnees-12463030,23-02-2020,21:50:37,Channel NewsAsia
316,Football: Lazio on Juve's heels as coronavirus fears decimate Serie A matches,https://www.channelnewsasia.com/news/sport/football-lazio-on-juve-s-heels-as-coronavirus-fears-decimate-12462952,23-02-2020,19:36:39,Channel NewsAsia
317,Italy announces three deaths linked to COVID-19,https://www.channelnewsasia.com/news/world/italy-announces-three-deaths-linked-to-covid-19-12462900,23-02-2020,22:28:13,Channel NewsAsia
318,"COVID-19 puts global recovery at risk, modest growth expected: IMF to G20",https://www.channelnewsasia.com/news/world/coronavirus-global-economic-recovery-at-risk-covid-19-g20-imf-12462680,23-02-2020,16:20:37,Channel NewsAsia
319,"Several countries shut Iran border, halt flights due to COVID-19",https://www.channelnewsasia.com/news/world/coronavirus-turkey-pakistan-iraq-shut-iran-border-halt-flights-12462548,23-02-2020,15:16:25,Channel NewsAsia
320,"Iran announces low poll turnout, blames COVID-19 ""propaganda""",https://www.channelnewsasia.com/news/world/covid-19-iran-low-poll-turnout-coronavirus-propaganda-elections-12462546,23-02-2020,14:12:25,Channel NewsAsia
321,"Jordan bars travellers from China, Iran, South Korea over COVID-19",https://www.channelnewsasia.com/news/world/covid-19-jordan-bars-travellers-china-iran-south-korea-12462512,23-02-2020,13:50:37,Channel NewsAsia
322,Indonesia refuses entry to 118 foreigners amid COVID-19 outbreak,https://www.channelnewsasia.com/news/asia/covid-19-coronavirus-indonesia-bali-refuse-entry-foreigners-12462488,23-02-2020,13:40:37,Channel NewsAsia
323,Italy races to contain COVID-19 outbreak as cases rise to 132,https://www.channelnewsasia.com/news/world/coronavirus-italy-covid-19-outbreak-new-cases-12462248,23-02-2020,15:53:11,Channel NewsAsia
324,Serie A matches among fixtures cancelled in Italy after coronavirus outbreak,https://www.channelnewsasia.com/news/sport/coronavirus-covid19-seria-a-three-matches-postponed-12461796,23-02-2020,13:10:48,Channel NewsAsia
325,"No new COVID-19 cases in Singapore; 2 more patients discharged, including taxi driver",https://www.channelnewsasia.com/news/singapore/covid-19-coronavirus-singapore-moh-update-new-cases-discharged-12462176,23-02-2020,12:56:21,Channel NewsAsia
326,"COVID-19: Third passenger from Japan cruise ship dies, says health ministry",https://www.channelnewsasia.com/news/asia/coronavirus-diamond-princess-cruise-japan-covid-19-death-12462348,23-02-2020,11:40:37,Channel NewsAsia
327,Israel quarantines pupils who met South Korean tourists over COVID-19 fears,https://www.channelnewsasia.com/news/world/coronavirus-israel-quarantines-pupils-korean-tourists-covid-19-12462284,23-02-2020,11:13:43,Channel NewsAsia
328,Chinese restaurants starved for cash as COVID-19 hits industry,https://www.channelnewsasia.com/news/business/covid-19-coronavirus-china-restaurants-business-hit-employment-12462094,23-02-2020,10:51:35,Channel NewsAsia
329,"Iran says in total 43 infected with coronavirus, 8 dead: Official",https://www.channelnewsasia.com/news/world/coronavirus-covid-19-iran-more-infected-death-toll-8-12462232,23-02-2020,10:22:48,Channel NewsAsia
330,France prepares in case of COVID-19 epidemic: Health minister,https://www.channelnewsasia.com/news/world/coronavirus-france-prepares-covid-19-epidemic-12462236,23-02-2020,09:43:40,Channel NewsAsia
331,Singaporeans advised to defer non-essential travel to South Korean cities affected by COVID-19: MOH,https://www.channelnewsasia.com/news/singapore/covid-19-south-korea-daegu-cheongdo-travel-advisory-moh-12462192,23-02-2020,09:54:24,Channel NewsAsia
332,Iran accuses foreign media of using COVID-19 to 'discourage' voters,https://www.channelnewsasia.com/news/world/coronavirus-iran-foreign-media-covid-19-discourage-voters-12462180,23-02-2020,09:00:43,Channel NewsAsia
333,COVID-19: South Korea raises virus alert to 'grave' as infections surge,https://www.channelnewsasia.com/news/asia/coronavirus-south-korea-covid-19-highest-alert-president-moon-12462162,23-02-2020,13:04:01,Channel NewsAsia
334,Floating Petri dishes? Coronavirus puts cruise industry in the dock,https://www.channelnewsasia.com/news/asia/covid-19-coronavirus-cruise-diamond-princess-outbreaks-12462142,23-02-2020,06:56:24,Channel NewsAsia
335,COVID-19: Sister of Malaysian patient who attended Singapore conference discharged,https://www.channelnewsasia.com/news/asia/covid-19-coronavirus-malaysia-case-13-hyatt-singapore-12461996,23-02-2020,04:50:58,Channel NewsAsia
336,"Fear, isolation cloaks town at centre of Italy's COVID-19 outbreak",https://www.channelnewsasia.com/news/world/fear-isolation-cloaks-town-at-centre-of-italy-s-covid-19-12461874,23-02-2020,13:19:56,Channel NewsAsia
337,South Korea reports 169 new COVID-19 cases; three more deaths,https://www.channelnewsasia.com/news/asia/covid19-south-korea-reports-two-deaths-123-coronavirus-cases-12461862,23-02-2020,12:48:56,Channel NewsAsia
338,China reports fewer COVID-19 cases outside epicentre Hubei,https://www.channelnewsasia.com/news/asia/covid19-coronavirus-china-hubei-wuhan-new-cases-feb-23-12461784,23-02-2020,06:38:42,Channel NewsAsia
339,COVID-19: Some Johor Bahru eateries feel the pinch as fewer Singaporeans travel across the Causeway,https://www.channelnewsasia.com/news/asia/coronavirus-covid-19-malaysia-johor-bahru-food-restaurants-12456214,22-02-2020,22:10:38,Channel NewsAsia
