Index,Title,URL,Date,Time,Channel
675,Coronavirus: Wuhan natives in US unite to support their city during crisis,https://www.scmp.com/news/china/society/article/3052340/solidarity-abroad-wuhan-natives-us-unite-support-their-city,25-02-2020,20:20:56,South China Morning Post
676,"Coronavirus: US outbreak now inevitable, leading American health official warns",https://www.scmp.com/news/china/society/article/3052337/coronavirus-us-outbreak-now-inevitable-top-american-health,25-02-2020,17:59:50,South China Morning Post
677,China hits back at American ‘coronavirus overreaction’ with travel warning for US,https://www.scmp.com/news/china/diplomacy/article/3052302/china-hits-back-american-coronavirus-overreaction-travel,25-02-2020,15:00:07,South China Morning Post
678,Coronavirus: doubts raised over whether Chinese companies can use force majeure to counter risks,https://www.scmp.com/economy/china-economy/article/3052277/coronavirus-doubts-raised-over-whether-chinese-companies-can,25-02-2020,14:30:09,South China Morning Post
679,Coronavirus: secretive South Korean church linked to outbreak held meetings in Wuhan until December,https://www.scmp.com/news/china/politics/article/3052322/coronavirus-secretive-south-korean-church-linked-outbreak-held,25-02-2020,14:24:23,South China Morning Post
680,Italy death toll jumps to 11 as coronavirus spreads through Europe and beyond,https://www.scmp.com/news/world/europe/article/3052324/coronavirus-spreads-through-europe-italy-austria-croatia-and,25-02-2020,14:20:46,South China Morning Post
681,Coronavirus: China is making a ‘bigger effort to cooperate’ with WHO than during Sars,https://www.scmp.com/news/china/society/article/3052258/coronavirus-china-making-bigger-effort-cooperate-who-during-sars,25-02-2020,13:30:15,South China Morning Post
682,Coronavirus Live Updates: Europe Threatened as Disease Spreads from Italy,https://www.nytimes.com/2020/02/26/world/asia/coronavirus-news.html,26-02-2020,09:36:24,The New York Times
683,‘I Felt Like Crying’: Coronavirus Shakes China’s Expecting Mothers,https://www.nytimes.com/2020/02/25/business/coronavirus-china-pregnant.html,26-02-2020,05:45:15,The New York Times
684,"Shaved Heads, Adult Diapers: Life as a Nurse in the Coronavirus Outbreak",https://www.nytimes.com/2020/02/26/business/coronavirus-china-nurse-menstruation.html,26-02-2020,07:39:21,The New York Times
685,"​In Coronavirus Crisis, Korean City Tries Openness, a Contrast to China",https://www.nytimes.com/2020/02/25/world/asia/daegu-south-korea-coronavirus.html,26-02-2020,01:56:55,The New York Times
686,Spanish Hotel Is Locked Down After Guests Test Positive for Coronavirus,https://www.nytimes.com/2020/02/25/world/europe/spain-coronavirus-hotel-canary.html,26-02-2020,02:28:05,The New York Times
687,"Coronavirus Spreads to Soccer’s Schedule, Closing Stadiums and Stranding Teams",https://www.nytimes.com/2020/02/25/world/europe/coronavirus-soccer.html,25-02-2020,20:56:35,The New York Times
688,"Coronavirus, Financial Markets, Emmanuel Macron: Your Wednesday Briefing",https://www.nytimes.com/2020/02/25/briefing/coronavirus-financial-markets-emmanuel-macron.html,26-02-2020,06:07:41,The New York Times
689,C.D.C. Officials Warn of Coronavirus Outbreaks in the U.S.,https://www.nytimes.com/2020/02/25/health/coronavirus-us.html,26-02-2020,04:41:10,The New York Times
690,"Coronavirus, Harvey Weinstein, Kobe Bryant: Your Tuesday Briefing",https://www.nytimes.com/2020/02/25/briefing/coronavirus-harvey-weinstein-kobe-bryant.html,25-02-2020,12:32:04,The New York Times
691,"Westerdam Passengers at Low Risk of Coronavirus Infection, C.D.C. Says",https://www.nytimes.com/2020/02/24/health/coronavirus-westerdam-cdc.html,24-02-2020,22:15:07,The New York Times
692,"Coronavirus Stalls Milan, Italy’s Economic Engine",https://www.nytimes.com/2020/02/24/world/europe/24coronavirus-milan-italy.html,25-02-2020,12:57:02,The New York Times
693,France reports first French death from coronavirus,http://www.straitstimes.com/world/europe/france-reports-first-french-death-from-coronavirus,26-02-2020,09:35:29,The Straits Times
694,US scrambles to prepare for potential coronavirus pandemic,http://www.straitstimes.com/world/united-states/us-scrambles-to-prepare-for-potential-coronavirus-pandemic,26-02-2020,08:02:17,The Straits Times
695,A kiss is just a kiss except when it spreads the coronavirus,http://www.straitstimes.com/world/europe/a-kiss-is-just-a-kiss-except-when-it-spreads-the-coronavirus,26-02-2020,06:59:17,The Straits Times
696,"Coronavirus: Kuwait reports 2 new cases, taking country total to 11",http://www.straitstimes.com/world/middle-east/coronavirus-kuwait-reports-2-new-cases-taking-country-total-to-11,26-02-2020,02:54:28,The Straits Times
697,Coronavirus: Trump plea for US to shrug off virus fears ignored by markets,http://www.straitstimes.com/world/united-states/coronavirus-trump-plea-for-us-to-shrug-off-virus-fears-ignored-by-markets,26-02-2020,00:21:08,The Straits Times
698,'Not just an Italian problem': Coronavirus threatens Europe's economy,http://www.straitstimes.com/world/europe/not-just-an-italian-problem-coronavirus-threatens-europes-economy,26-02-2020,00:17:28,The Straits Times
699,"Coronavirus market plunge is 'tip of the iceberg', US Democratic presidential candidate Warren warns",http://www.straitstimes.com/world/united-states/coronavirus-market-plunge-is-tip-of-the-iceberg-us-democratic-presidential,25-02-2020,23:54:32,The Straits Times
700,Coronavirus: Olympics have a $1.2 billion reserve fund for cancelled games,http://www.straitstimes.com/world/united-states/coronavirus-olympics-have-a-12-billion-reserve-fund-for-cancelled-games,25-02-2020,23:39:32,The Straits Times
701,Coronavirus: Tourists in luxury Tenerife hotel amid virus fears,http://www.straitstimes.com/world/europe/coronavirus-tourists-in-luxury-tenerife-hotel-amid-virus-fears,25-02-2020,23:13:25,The Straits Times
702,"New coronavirus cases in Germany, one man in critical condition",http://www.straitstimes.com/world/europe/southern-german-state-confirms-coronavirus-case,25-02-2020,20:24:41,The Straits Times
703,"Coronavirus: Kuwait suspends all flights with Singapore, Japan over virus fears",http://www.straitstimes.com/world/middle-east/coronavirus-kuwait-suspends-all-flights-with-singapore-japan-over-virus-fears,25-02-2020,19:39:15,The Straits Times
704,Coronavirus: US health officials urge Americans to prepare for its spread,http://www.straitstimes.com/world/united-states/coronavirus-us-health-secretary-alex-azar-says-more-cases-likely-seeks-more,25-02-2020,17:23:08,The Straits Times
705,Coronavirus hits more nations as WHO warns world is ‘simply not ready’ for spread,http://www.straitstimes.com/world/europe/coronavirus-world-simply-not-ready-for-its-spread-says-who-china-mission-chief,25-02-2020,17:02:50,The Straits Times
706,US says Iran may have suppressed 'vital details' on coronavirus outbreak,http://www.straitstimes.com/world/united-states/us-says-iran-may-have-suppressed-vital-details-on-coronavirus-outbreak,25-02-2020,16:13:39,The Straits Times
707,Coronavirus damage to China's economy clear from early indicators,http://www.straitstimes.com/business/economy/coronavirus-damage-to-chinas-economy-clear-from-early-indicators,26-02-2020,07:20:28,The Straits Times
708,DBS nudges firms to go digital in second round of coronavirus relief measures,http://www.straitstimes.com/business/banking/dbs-nudges-firms-to-go-digital-in-second-round-of-coronavirus-relief-measures,26-02-2020,05:38:56,The Straits Times
709,Amcham member firms in Singapore keeping headcount here despite coronavirus hit,http://www.straitstimes.com/business/economy/us-firms-in-singapore-keeping-headcount-here-despite-coronavirus-hit-amcham-survey,26-02-2020,04:30:00,The Straits Times
710,"CapitaLand senior management, board members to take pay cut amid coronavirus outbreak",http://www.straitstimes.com/business/companies-markets/capitaland-senior-management-board-members-to-take-pay-cut-amid,26-02-2020,02:42:19,The Straits Times
711,Singapore economy seen shrinking 0.6% in Q1 from coronavirus: Reuters poll,http://www.straitstimes.com/business/economy/singapore-economy-seen-shrinking-06-in-q1-from-coronavirus-reuters-poll,26-02-2020,00:28:48,The Straits Times
712,Virgin Australia to cut capacity after first-half underlying profit sinks 78% as coronavirus bites,http://www.straitstimes.com/business/companies-markets/virgin-australia-to-cut-capacity-after-first-half-underlying-profit-sinks,25-02-2020,23:13:40,The Straits Times
713,Coronavirus: Fears of Covid-19 pandemic spreading Tokyo Olympics unease,http://www.straitstimes.com/sport/coronavirus-fears-of-covid-19-pandemic-spreading-tokyo-olympics-unease,26-02-2020,09:13:46,The Straits Times
714,Coronavirus: Japan PM Shinzo Abe wants big events canned or scaled back due to outbreak,http://www.straitstimes.com/sport/coronavirus-japan-pm-shinzo-abe-wants-big-events-canned-or-scaled-back-due-to-outbreak,26-02-2020,07:50:53,The Straits Times
715,Coronavirus: Infection fears cause cinema attendance to drop,http://www.straitstimes.com/lifestyle/entertainment/coronavirus-infection-fears-cause-cinema-attendance-to-drop,26-02-2020,07:30:00,The Straits Times
716,Coronavirus: Hydeout music festival postponed to October,http://www.straitstimes.com/lifestyle/entertainment/coronavirus-hydeout-music-festival-postponed-to-october,26-02-2020,07:29:01,The Straits Times
717,Mission: Impossible filming halted in Italy due to coronavirus,http://www.straitstimes.com/lifestyle/entertainment/mission-impossible-filming-halted-in-italy-due-to-coronavirus,25-02-2020,21:00:00,The Straits Times
718,Masks: Fashion week's must-have accessory,http://www.straitstimes.com/lifestyle/fashion/masks-fashion-weeks-must-have-accessory,25-02-2020,21:00:00,The Straits Times
719,Coronavirus: Is it a pandemic yet?,http://www.straitstimes.com/opinion/is-it-a-pandemic-yet,25-02-2020,21:00:00,The Straits Times
720,Coronavirus: Prudential receives more than 60 claims for $500 cash benefit,http://www.straitstimes.com/singapore/health/coronavirus-prudential-receives-more-than-60-claims-for-500-cash-benefit,26-02-2020,09:43:44,The Straits Times
721,Singaporeans must not be complacent in fight against coronavirus: President Halimah,http://www.straitstimes.com/singapore/singaporeans-must-not-be-complacent-in-fight-against-coronavirus-president-halimah,26-02-2020,09:26:41,The Straits Times
722,"Man who breached coronavirus stay-home notice stripped of Singapore PR status, barred from re-entry",http://www.straitstimes.com/singapore/coronavirus-singapore-permanent-resident-who-breached-stay-home-notice-stripped-of-pr,26-02-2020,07:44:57,The Straits Times
723,Coronavirus: China couple to be charged under Infectious Diseases Act with giving false info to MOH officials,http://www.straitstimes.com/singapore/couple-who-had-coronavirus-charged-under-infectious-diseases-act-for-giving-false,26-02-2020,07:15:08,The Straits Times
724,Coronavirus: Grace Assembly church resumes operations two weeks after home quarantine of staff,http://www.straitstimes.com/singapore/coronavirus-grace-assembly-church-resumes-operations-two-weeks-after-home-quarantine-of,26-02-2020,07:07:52,The Straits Times
725,"Coronavirus: Singapore, Malaysia agree on areas of cooperation at first meeting of joint working group",http://www.straitstimes.com/singapore/coronavirus-singapore-malaysia-agree-on-areas-of-cooperation-at-first-meeting-of-joint,26-02-2020,04:13:54,The Straits Times
726,Coronavirus not detected in bats and other animals in Singapore so far,http://www.straitstimes.com/singapore/environment/coronavirus-see-a-bat-no-need-to-panic-say-experts,26-02-2020,02:11:48,The Straits Times
727,Crucial for community to bounce back after coronavirus crisis: IPS forum panellist,http://www.straitstimes.com/singapore/crucial-for-community-to-bounce-back-after-virus-crisis-ips-forum-panellist,25-02-2020,21:00:00,The Straits Times
728,S'pore has to be prepared for more imported Covid-19 cases: Gan,http://www.straitstimes.com/singapore/health/spore-has-to-be-prepared-for-more-imported-covid-19-cases-gan,25-02-2020,21:00:00,The Straits Times
729,Parliament: MOM to issue guidelines to employers on 5-day MC during coronavirus outbreak,http://www.straitstimes.com/politics/parliament-mom-to-issue-guidelines-to-employers-on-5-day-mc-during-coronavirus-outbreak,26-02-2020,07:23:38,The Straits Times
730,"Budget debate: MPs urge speedier support to help firms, workers cope with coronavirus impact",http://www.straitstimes.com/politics/budget-debate-mps-urge-speedier-support-more-help-for-freelancers-to-help-businesses,26-02-2020,07:01:10,The Straits Times
731,"'Fear and panic' as coronavirus threatens Afghanistan, Pakistan",http://www.straitstimes.com/asia/south-asia/fear-and-panic-as-coronavirus-threatens-afghanistan-pakistan,26-02-2020,09:32:38,The Straits Times
732,"All confirmed cases of coronavirus in Vietnam cured, anti-epidemic measures strengthened",http://www.straitstimes.com/asia/se-asia/all-confirmed-cases-of-coronavirus-in-vietnam-cured-anti-epidemic-measures-strengthened,26-02-2020,09:00:54,The Straits Times
733,China's coronavirus-hit airlines are showing signs of recovery,http://www.straitstimes.com/asia/east-asia/chinas-coronavirus-hit-airlines-are-showing-signs-of-recovery,26-02-2020,08:18:16,The Straits Times
734,Coronavirus: Five more Chinese regions lower emergency response level as threat recedes,http://www.straitstimes.com/asia/east-asia/coronavirus-five-more-chinese-regions-lower-emergency-response-level-as-threat,26-02-2020,08:14:27,The Straits Times
735,Worried Chinese turn to online doctor consultations amid coronavirus outbreak,http://www.straitstimes.com/asia/east-asia/worried-chinese-turn-to-online-doctor-consultations-amid-coronavirus-outbreak,26-02-2020,08:02:13,The Straits Times
736,Philippines bars travellers to South Korea as coronavirus spreads,http://www.straitstimes.com/asia/se-asia/philippines-imposes-travel-ban-on-south-koreas-coronavirus-hit-north-gyeongsang,26-02-2020,06:51:05,The Straits Times
737,Coronavirus: Vietnam bars tourists from virus-hit parts of South Korea,http://www.straitstimes.com/asia/se-asia/coronavirus-vietnam-bars-tourists-from-virus-hit-parts-of-south-korea,26-02-2020,06:46:19,The Straits Times
738,North Korea imposes 'extraordinary' measures against coronavirus,http://www.straitstimes.com/asia/east-asia/north-korea-imposes-extraordinary-measures-against-coronavirus,26-02-2020,06:44:18,The Straits Times
739,"Coronavirus: Dozens allowed off Japan virus-hit ship have 'symptoms', says minister",http://www.straitstimes.com/asia/east-asia/coronavirus-dozens-allowed-off-japan-virus-hit-ship-have-symptoms-says-minister,26-02-2020,05:40:01,The Straits Times
740,"Thailand steps up coronavirus fight after confirming 3 more cases, total now 40",http://www.straitstimes.com/asia/se-asia/thailand-steps-up-coronavirus-fight-after-confirming-3-more-cases-total-now-40,26-02-2020,05:23:06,The Straits Times
741,"Coronavirus: Japan's Hokkaido prefecture seeks closure of all public elementary, junior high schools",http://www.straitstimes.com/asia/east-asia/coronavirus-japans-hokkaido-prefecture-seeks-closure-of-all-public-elementary-junior,26-02-2020,02:55:49,The Straits Times
742,US forces in South Korea report first coronavirus case,http://www.straitstimes.com/asia/east-asia/us-forces-in-south-korea-report-first-coronavirus-case,26-02-2020,02:35:27,The Straits Times
743,445 Filipinos aboard coronavirus-hit cruise ship under quarantine in Philippines,http://www.straitstimes.com/asia/se-asia/chinese-hospitals-discharge-29745-recovered-patients-of-coronavirus-infection,26-02-2020,02:20:59,The Straits Times
744,14% of recovered coronavirus patients in China's Guangdong tested positive again,http://www.straitstimes.com/asia/east-asia/14-of-recovered-coronavirus-patients-in-chinas-guangdong-tested-positive-again,26-02-2020,02:06:02,The Straits Times
745,"Coronavirus: China reports 406 new cases, 52 more deaths",http://www.straitstimes.com/asia/east-asia/china-reports-52-more-virus-deaths-lowest-in-3-weeks,26-02-2020,02:01:09,The Straits Times
746,Coronavirus: China quarantines 94 on flight from Seoul after 3 show fever symptoms,http://www.straitstimes.com/asia/east-asia/coronavirus-china-quarantines-94-on-flight-from-seoul-after-3-show-fever-symptoms,26-02-2020,01:26:32,The Straits Times
747,"Coronavirus: South Korea cases exceed 1,200, heightening fear of further spread",http://www.straitstimes.com/asia/east-asia/south-korea-reports-169-new-coronavirus-cases-total-tops-1100,26-02-2020,01:14:28,The Straits Times
748,'I felt like crying': Coronavirus shakes China's expecting mothers,http://www.straitstimes.com/asia/east-asia/i-felt-like-crying-coronavirus-shakes-chinas-expecting-mothers,26-02-2020,01:04:35,The Straits Times
749,Jakarta unveils $1b package to counter coronavirus impact,http://www.straitstimes.com/asia/se-asia/jakarta-unveils-1b-package-to-counter-coronavirus-impact,25-02-2020,21:00:00,The Straits Times
750,Coronavirus: More clusters trigger fears of mass infections in South Korea,http://www.straitstimes.com/asia/east-asia/more-clusters-trigger-fears-of-mass-infections,25-02-2020,21:00:00,The Straits Times
751,"Philippine citizens infected with coronavirus on cruise ship rises to 80, others fly home",http://www.straitstimes.com/asia/se-asia/philippine-citizens-infected-with-coronavirus-on-cruise-ship-rises-to-80-others-fly,25-02-2020,18:04:11,The Straits Times
752,The Big Story: Budget 2020 debate begins; Inter-agency task force against family violence; S'pore-made coronavirus test,http://www.straitstimes.com/multimedia/the-big-story-budget-2020-debate-begins-inter-agency-task-force-against-family-violence,26-02-2020,09:25:00,The Straits Times
753,China's blood donations dry up as COVID-19 outbreak quells giving,https://www.channelnewsasia.com/news/asia/china-blood-donations-dry-up-covid-19-coronavirus-12472326,26-02-2020,10:04:55,Channel NewsAsia
754,San Francisco declares emergency over coronavirus,https://www.channelnewsasia.com/news/world/san-francisco-declares-emergency-over-coronavirus-12471324,26-02-2020,10:01:06,Channel NewsAsia
755,Toyota cancels non-urgent travel for Japan workers due to coronavirus,https://www.channelnewsasia.com/news/business/toyota-cancels-non-urgent-travel-for-japan-workers-due-to-coronavirus-12472472,26-02-2020,10:02:38,Channel NewsAsia
756,France reports first French death from COVID-19,https://www.channelnewsasia.com/news/world/coronavirus-covid19-france-reports-first-french-death-12472366,26-02-2020,09:52:55,Channel NewsAsia
757,"'Fear and panic' as COVID-19 threatens Afghanistan, Pakistan",https://www.channelnewsasia.com/news/world/fear-panic-coronavirus-threatens-afghanistan-pakistan-12472320,26-02-2020,09:40:37,Channel NewsAsia
758,"Lufthansa says to freeze hiring, cut costs over coronavirus",https://www.channelnewsasia.com/news/business/lufthansa-freeze-hiring-cut-costs-over-covid-19-coronavirus-12472220,26-02-2020,09:20:39,Channel NewsAsia
759,"Australia to close schools, cancel sports in event of COVID-19 outbreak",https://www.channelnewsasia.com/news/world/australia-close-schools-cancel-sports-event-coronavirus-outbreak-12472248,26-02-2020,09:10:38,Channel NewsAsia
760,"UAE ready for 'worst case' COVID-19 scenarios, says government",https://www.channelnewsasia.com/news/world/uae-worst-case-coronavirus-scenarios-government-12472136,26-02-2020,09:50:13,Channel NewsAsia
761,Austria quarantines a dozen people after first COVID-19 cases,https://www.channelnewsasia.com/news/world/austria-quarantines-dozen-people-after-first-coronavirus-cases-12472110,26-02-2020,08:30:38,Channel NewsAsia
762,Five more Chinese regions lower emergency response level as COVID-19 threat recedes,https://www.channelnewsasia.com/news/asia/chinese-regions-lower-emergency-response-level-hainan-sichuan-12472038,26-02-2020,08:23:37,Channel NewsAsia
763,Thais advised to postpone unnecessary trips to nine COVID-19 affected destinations,https://www.channelnewsasia.com/news/asia/thailand-covid-19-travel-countries-advisory-coronavirus-12471902,26-02-2020,08:05:33,Channel NewsAsia
764,"South Korea starts COVID-19 checks on more than 200,000 sect members",https://www.channelnewsasia.com/news/asia/south-korea-covid-19-checks-religious-sect-shincheonji-12471988,26-02-2020,09:29:30,Channel NewsAsia
765,Tennis: Coronavirus forces Japan Davis Cup tie behind closed doors,https://www.channelnewsasia.com/news/sport/tennis-coronavirus-forces-japan-davis-cup-tie-behind-closed-12471942,26-02-2020,07:28:40,Channel NewsAsia
766,COVID-19: Two to be charged with giving false information to MOH during contact tracing,https://www.channelnewsasia.com/news/singapore/covid19-coronavirus-charged-false-info-moh-contact-tracing-12471894,26-02-2020,07:50:39,Channel NewsAsia
767,China rolls out fresh data collection campaign to combat COVID-19,https://www.channelnewsasia.com/news/business/china-big-data-collection-campaign-covid-19-coronavirus-privacy-12471846,26-02-2020,08:42:10,Channel NewsAsia
768,"Thailand reports 3 new COVID-19 cases, total infections at 40",https://www.channelnewsasia.com/news/asia/thailand-reports-3-new-covid-19-cases-total-infections-at-40-12471608,26-02-2020,05:20:37,Channel NewsAsia
769,Asia’s 50 Best Restaurants Awards to go online amid coronavirus fears,https://cnaluxury.channelnewsasia.com/experiences/asia-50-best-restaurants-moves-online-coronavirus-12471230,26-02-2020,04:30:37,Channel NewsAsia
770,"Singapore, Malaysia agree to align COVID-19 screening protocols at land borders",https://www.channelnewsasia.com/news/singapore/singapore-malaysia-covid-19-agreement-land-border-checks-12471320,26-02-2020,04:20:37,Channel NewsAsia
771,COVID-19: Special aircraft on second Wuhan evacuation mission arrives in Malaysia,https://www.channelnewsasia.com/news/asia/covid19-air-asia-flight-wuhan-evacuation-arrives-malaysia-12471422,26-02-2020,04:10:48,Channel NewsAsia
772,Internet giants fight spread of COVID-19 untruths,https://www.channelnewsasia.com/news/business/covid-19-internet-giants-fight-untruths-google-facebook-youtube-12471328,26-02-2020,03:33:30,Channel NewsAsia
773,"China reports 52 more COVID-19 deaths, lowest in 3 weeks",https://www.channelnewsasia.com/news/asia/china-covid-19-hubei-coronavirus-death-toll-12471094,26-02-2020,03:25:24,Channel NewsAsia
774,Labour crunch and supply delays: Some construction firms in Singapore feeling the strain of COVID-19,https://www.channelnewsasia.com/news/business/labour-crunch-supply-delays-covid-19-construction-singapore-12468994,26-02-2020,08:07:03,Channel NewsAsia
775,"Japan reports second COVID-19 death, PM urges two-week curbs on sports events",https://www.channelnewsasia.com/news/asia/japan-reports-second-covid-19-death-pm-urges-two-week-curbs-on-12471074,26-02-2020,09:10:35,Channel NewsAsia
776,"South Korea COVID-19 cases exceeds 1,200; US soldier among new cases",https://www.channelnewsasia.com/news/asia/south-korea-covid-19-death-new-cases-feb-26-12471026,26-02-2020,08:41:14,Channel NewsAsia
777,Singapore economy to contract 0.6% in Q1 amid coronavirus outbreak: Reuters poll,https://www.channelnewsasia.com/news/business/covid19-economy-impact-spread-china-asia-poll-12470996,26-02-2020,02:26:31,Channel NewsAsia
778,Health authorities expect COVID-19 community spread on US soil,https://www.channelnewsasia.com/news/world/covid-19-authorities-expect-community-spread-us-soil-12470978,26-02-2020,01:31:13,Channel NewsAsia
779,Calls for calm as COVID-19 fears surround Juventus Champions League tie,https://www.channelnewsasia.com/news/sport/football-juventus-italy-covid-19-coronavirus-champions-league-12470716,25-02-2020,23:58:41,Channel NewsAsia
780,Honeymoon from hell: Coronavirus travel bans trap South Koreans abroad,https://www.channelnewsasia.com/news/asia/covid-19-coronavirus-travel-bans-trap-south-koreans-abroad-12469894,26-02-2020,02:34:42,Channel NewsAsia
781,"Commentary: When China sneezes, the world economy catches a COVID-19 cold",https://www.channelnewsasia.com/news/commentary/covid-19-coronavirus-impact-china-supply-chains-manufacturing-12466386,25-02-2020,22:10:38,Channel NewsAsia
782,20 of Malaysia’s COVID-19 cases have fully recovered and been discharged from hospitals,https://www.channelnewsasia.com/news/asia/malaysia-covid19-coronavirus-discharged-12469848,25-02-2020,15:10:37,Channel NewsAsia
783,COVID-19 travel bans trap South Koreans abroad,https://www.channelnewsasia.com/news/asia/covid-19-coronavirus-travel-bans-trap-south-koreans-abroad-12469894,25-02-2020,14:39:10,Channel NewsAsia
784,No spike in suspected COVID-19 cases in Bali after visit of Japanese man who tested positive: Indonesian Health Ministry,https://www.channelnewsasia.com/news/asia/no-spike-in-suspected-covid-19-in-bali-after-japanese-positive-12469204,25-02-2020,14:03:29,Channel NewsAsia
785,Football: Japan suspends J-League over COVID-19 fears as Olympics loom,https://www.channelnewsasia.com/news/sport/covid19-football-japan-suspends-j-league-fears-olympics-12469548,25-02-2020,12:15:47,Channel NewsAsia
786,"'Where's Abe?' critics ask, as coronavirus spreads in Japan",https://www.channelnewsasia.com/news/asia/where-s-abe-critics-ask-as-coronavirus-spreads-in-japan-12469246,25-02-2020,11:14:44,Channel NewsAsia
787,Plastic shields protect China's ride-hailing drivers against COVID-19,https://www.channelnewsasia.com/news/asia/china-plastic-shield-protect-ride-hailing-driver-against-virus-12469136,25-02-2020,09:33:31,Channel NewsAsia
788,Commentary: COVID-19 may be a mild illness for most people,https://www.channelnewsasia.com/news/commentary/coronavirus-covid-19-not-so-serious-12469016,26-02-2020,02:15:24,Channel NewsAsia
