index,headline,source_url,publish_date,publisher
0,COVID-19 outbreak begins to disrupt booming China drug trials,https://www.channelnewsasia.com/news/world/covid-19-outbreak-begins-to-disrupt-booming-china-drug-trials-12428756,13-02-2020 02:13:15,Channel News Asia
1,"COVID-19: More than 1,000 calls, visits made each day by MOM to ensure work pass holders adhere to leave of absence",https://www.channelnewsasia.com/news/singapore/wuhan-virus-covid-19-loa-mom-coronavirus-12427628,12-02-2020 22:41:35,Channel News Asia
2,COVID-19: Air China cancels flights to Greece up to Mar 18,https://www.channelnewsasia.com/news/asia/air-china-cancels-flight-greece-march-coronavirus-12428120,12-02-2020 22:26:04,Channel News Asia
3,"COVID-19: Spaniards repatriated from China to be discharged, no virus found",https://www.channelnewsasia.com/news/world/covid-19-spaniards-repatriated-from-china-discharged-12428040,12-02-2020 22:07:34,Channel News Asia
4,"To fight COVID-19, disinfectant tunnel in China sprays industrial workers",https://www.channelnewsasia.com/news/asia/china-tunnel-spray-disinfectant-industrial-workers-12427964,12-02-2020 21:35:57,Channel News Asia
5,New ways for Singaporeans to offer help and support amid outbreak of COVID-19: Desmond Lee,https://www.channelnewsasia.com/news/singapore/covid-19-coronavirus-new-ways-for-singaporeans-to-offer-help-12427792,12-02-2020 20:55:59,Channel News Asia
6,"COVID-19: Supply chain remains robust, 'panic buying' situation has stabilised, says Lawrence Wong",https://www.channelnewsasia.com/news/singapore/wuhan-virus-coronavirus-covid-19-groceries-lawrence-wong-12427296,12-02-2020 20:40:07,Channel News Asia
7,"COVID-19: Quarantine over, Japan evacuees emerge ready for home",https://www.channelnewsasia.com/news/asia/coronavirus-quarantine-over-japan-evacuees-12427736,12-02-2020 20:33:59,Channel News Asia
8,Cruise ship stranded by COVID-19 fears to dock in Cambodia,https://www.channelnewsasia.com/news/asia/wuhan-coronavirus-covid-19-westerdam-ship-dock-cambodia-12427660,12-02-2020 20:23:58,Channel News Asia
9,"Coronavirus outbreak 'just beginning' outside China, says expert",https://www.channelnewsasia.com/news/asia/coronavirus-outbreak-outside-china-12427618,12-02-2020 20:20:04,Channel News Asia
10,Grab to pilot service offering round-the-clock rides home for healthcare professionals ,https://www.channelnewsasia.com/news/singapore/grabcare-wuhan-virus-coronavirus-covid-19-pilot-grab-12427022,12-02-2020 18:55:26,Channel News Asia
11,"3 new cases of COVID-19 in Singapore, including DBS employee, 2 church employees",https://www.channelnewsasia.com/news/singapore/coronavirus-covid-19-singapore-cases-feb-12-12426526,12-02-2020 18:34:38,Channel News Asia
12,"COVID-19: Johor state government says no need for panic buying, shops well-stocked with essentials",https://www.channelnewsasia.com/news/asia/coronavirus-malaysia-johor-singapore-panic-buy-essentials-12426716,12-02-2020 18:10:20,Channel News Asia
13,China's Formula 1 Grand Prix postponed over COVID-19 fears,https://www.channelnewsasia.com/news/sport/coronavirus-covid-19-formula-1-china-grand-prix-12426874,12-02-2020 17:29:33,Channel News Asia
14,219 suspected COVID-19 cases in total conveyed by ambulance as of Wednesday morning: SCDF,https://www.channelnewsasia.com/news/singapore/wuhan-virus-219-covid-19-suspected-cases-ambulance-scdf-12426652,12-02-2020 17:02:52,Channel News Asia
15,"Commentary: In the midst of COVID-19 outbreak, look out for these promising sectors",https://www.channelnewsasia.com/news/commentary/sectors-to-invest-during-wuhan-coronavirus-covid-19-12426378,12-02-2020 16:58:25,Channel News Asia
16,China charges man who pushed for birthday party despite coronavirus ban,https://www.channelnewsasia.com/news/asia/china-charges-man-push-birthday-party-despite-coronavirus-ban-12426732,12-02-2020 16:49:19,Channel News Asia
17,COVID-19: What you need to know about the Diamond Princess ship quarantined in Japan,https://www.channelnewsasia.com/news/asia/coronavirus-covid19-diamond-princess-cruise-japan-quarantine-12426234,12-02-2020 16:45:14,Channel News Asia
18,"Chess, squabbles aboard cruise ship cast away by coronavirus fears",https://www.channelnewsasia.com/news/asia/cruise-ms-westerdam-cast-away-coronavirus-fears-12426650,12-02-2020 16:35:46,Channel News Asia
19,Discrimination of healthcare workers due to coronavirus ‘disgraceful’: Amrin Amin,https://www.channelnewsasia.com/news/singapore/wuhan-virus-coronavirus-covid19-discrimination-healthcare-worker-12426528,12-02-2020 16:09:04,Channel News Asia
20,Indonesians with travel history to Singapore will not be barred from returning home: Indonesian embassy,https://www.channelnewsasia.com/news/asia/indonesia-singapore-wuhan-coronavirus-no-refused-entry-12425956,12-02-2020 16:08:41,Channel News Asia
21,Iran woman dies of suspected coronavirus infection: Report,https://www.channelnewsasia.com/news/world/iran-woman-dies-suspected-coronavirus-infection-report-12426556,12-02-2020 15:58:58,Channel News Asia
22,AI-driven system that speeds up temperature screening piloted at 2 locations,https://www.channelnewsasia.com/news/singapore/wuhan-virus-coronavirus-temperature-ai-tech-12426160,12-02-2020 15:48:45,Channel News Asia
23,China retreats online to weather coronavirus storm,https://www.channelnewsasia.com/news/asia/china-online-commerce-coronavirus-outbreak-12426490,12-02-2020 15:46:34,Channel News Asia
24,Russia discharges second China coronavirus patient,https://www.channelnewsasia.com/news/world/russia-discharges-second-china-coronavirus-patient-12426458,12-02-2020 15:29:22,Channel News Asia
25,"DBS employee infected with novel coronavirus, some staff told to work from home",https://www.channelnewsasia.com/news/singapore/wuhan-virus-coronavirus-dbs-employee-mbfc-12426336,12-02-2020 15:19:28,Channel News Asia
26,Overworked and unprotected: Wuhan doctors in China's coronavirus epicentre risk infection,https://www.channelnewsasia.com/news/asia/wuhan-virus-exhausted-doctors-at-china-coronavirus-overworked-12425986,12-02-2020 13:34:58,Channel News Asia
27,Hotpot restaurants fall victim to coronavirus fears in Hong Kong,https://www.channelnewsasia.com/news/asia/hotpot-restaurants-wuhan-coronavirus-steamboat-hong-kong-12425686,12-02-2020 12:00:59,Channel News Asia
28,New coronavirus cases lowest since Jan but experts disagree over peak,https://www.channelnewsasia.com/news/asia/new-wuhan-coronavirus-cases-lowest-experts-disagree-peak-12425742,12-02-2020 11:27:55,Channel News Asia
29,"Man arrested after attacking police, auxiliary officers at Sengkang General Hospital",https://www.channelnewsasia.com/news/singapore/sengkang-general-hospital-attack-police-wuhan-coronavirus-12425180,12-02-2020 08:55:40,Channel News Asia
30,"Japan cruise ship coronavirus cases climb to 175, including quarantine officer",https://www.channelnewsasia.com/news/asia/japan-cruise-ship-diamond-princess-new-coronavirus-wuhan-virus-12425154,12-02-2020 08:14:57,Channel News Asia
31,"China reports 97 new deaths from coronavirus, bringing toll to more than 1,100",https://www.channelnewsasia.com/news/asia/wuhan-virus-death-toll-feb-12-12425114,12-02-2020 07:10:16,Channel News Asia
32,Coronavirus outbreak: Economic fallout could be worse than SARS,https://www.channelnewsasia.com/news/cnainsider/novel-coronavirus-outbreak-economic-fallout-worse-than-sars-12424290,12-02-2020 06:15:00,Channel News Asia
33,"Commentary: When it comes to coronavirus, men are more vulnerable",https://www.channelnewsasia.com/news/commentary/wuhan-coronavirus-sars-mers-immune-sex-gender-difference-death-12420766,12-02-2020 06:02:24,Channel News Asia
34,Commentary: The biggest work-from-home exercise may have just begun. How ready is Singapore?,https://www.channelnewsasia.com/news/commentary/wuhan-coronavirus-work-from-home-flexible-best-practices-tips-12421586,12-02-2020 06:02:19,Channel News Asia
35,Coronavirus emergency is 'Public Enemy Number 1': WHO,https://www.channelnewsasia.com/news/world/wuhan-virus-coronavirus-who-covid-12424930,12-02-2020 05:42:23,Channel News Asia
36,US authorises Hong Kong staff to leave over coronavirus,https://www.channelnewsasia.com/news/world/us-authorises-hong-kong-staff-leave-over-coronavirus-12424166,11-02-2020 23:30:46,Channel News Asia
37,WHO names novel coronavirus as 'COVID-19',https://www.channelnewsasia.com/news/world/wuhan-virus-coronavirus-who-new-name-12424116,11-02-2020 23:17:27,Channel News Asia
38,China's Huanggang says coronavirus situation in city remains severe,https://www.channelnewsasia.com/news/asia/wuhan-virus-coronavirus-huanggang-city-12423964,11-02-2020 22:41:21,Channel News Asia
39,Indonesia says nothing to hide after no coronavirus cases detected,https://www.channelnewsasia.com/news/asia/wuhan-coronavirus-indonesia-no-confirmed-cases-12423568,11-02-2020 21:21:57,Channel News Asia
40,UK virus 'super-spreader' says he has recovered,https://www.channelnewsasia.com/news/world/uk-virus-super-spreader-grand-hyatt-business-meeting-recovered-12423482,11-02-2020 20:39:33,Channel News Asia
41,"Certis Cisco officer infected with coronavirus not deployed at main Chingay parade, says People’s Association",https://www.channelnewsasia.com/news/singapore/cisco-officer-coronavirus-chingay-parade-people-association-12423258,11-02-2020 20:09:30,Channel News Asia
42,Is It Still Safe To Go Swimming With The Novel Coronavirus Outbreak? How About Other Activities? We Ask A Doctor,https://www.channelnewsasia.comhttp://www.8days.sg/8days/liveandlearn/vanityandhealth/is-it-still-safe-to-go-swimming-with-the-novel-coronavirus-12423016,11-02-2020 20:07:15,Channel News Asia
43,"2 new coronavirus cases in Singapore, including second Bangladeshi worker and RWS casino employee",https://www.channelnewsasia.com/news/singapore/novel-coronavirus-confirmed-cases-singapore-feb-11-12421724,11-02-2020 20:00:07,Channel News Asia
44,UK team tests novel coronavirus vaccine on mice,https://www.channelnewsasia.com/news/world/wuhan-virus-coronavirus-uk-vaccine-researchers-12423290,11-02-2020 19:39:12,Channel News Asia
45,Malaysian Health Minister announces joint working committee with Singapore to tackle novel coronavirus,https://www.channelnewsasia.com/news/asia/wuhan-coronavirus-malaysia-singapore-joint-working-committee-12423114,11-02-2020 19:24:21,Channel News Asia
46,Coronavirus emergency 'holds a very grave threat' for world: WHO,https://www.channelnewsasia.com/news/asia/wuhan-coronavirus-grave-threat-who-12423160,11-02-2020 18:28:13,Channel News Asia
47,New coronavirus found in Japan evacuees who initially tested negative,https://www.channelnewsasia.com/news/asia/coronavirus-japan-cruise-evacuees-initially-tested-negative-12423106,11-02-2020 18:20:59,Channel News Asia
48,No plans to cancel SAF in-camp training amid coronavirus concerns: Heng Chee How,https://www.channelnewsasia.com/news/singapore/wuhan-virus-coronavirus-saf-army-not-cancel-training-bmtc-12422932,11-02-2020 18:00:07,Channel News Asia
49,Bankers in Asia brace for a coronavirus-related deal drought,https://www.channelnewsasia.com/news/business/bankers-asia-brace-coronavirus-related-deal-drought-china-12422564,11-02-2020 17:50:06,Channel News Asia
50,Bankers in Asia brace for a coronavirus-related deal drought,https://www.channelnewsasia.com/news/business/bankers-asia-brace-coronavirus-related-deal-drought-china-12422564,11-02-2020 17:50:06,Channel News Asia
51,"World Bank not considering new China loans to fight coronavirus, president says",https://www.channelnewsasia.com/news/business/world-bank-not-considering-new-china-loans-coronavirus-fight-12422894,11-02-2020 17:33:35,Channel News Asia
52,"Coronavirus: South Korea, Israel advise citizens to defer travel to Singapore",https://www.channelnewsasia.com/news/singapore/wuhan-coronavirus-travel-advisories-to-singapore-12422306,11-02-2020 17:07:55,Channel News Asia
53,'Painstaking' contact tracing work by SPF led to discovery of possible cluster at Paya Lebar church: Shanmugam,https://www.channelnewsasia.com/news/singapore/coronavirus-singapore-police-contact-tracing-shanmugam-12422668,11-02-2020 17:04:35,Channel News Asia
54,Taiwan hits out at China coronavirus travel bans,https://www.channelnewsasia.com/news/asia/taiwan-china-coronavirus-travel-bans-12422686,11-02-2020 16:42:20,Channel News Asia
55,China tightens movement restrictions in locked-down Wuhan,https://www.channelnewsasia.com/news/asia/wuhan-virus-coronavirus-china-lockdown-12422538,11-02-2020 16:35:30,Channel News Asia
56,"Coronavirus case confirmed in California, takes US total to 13",https://www.channelnewsasia.com/news/world/coronavirus-case-confirmed-in-california--takes-us-total-to-13-12421002,11-02-2020 16:32:40,Channel News Asia
57,"Symptoms of novel coronavirus mild, similar to all respiratory viruses in early stage: Expert",https://www.channelnewsasia.com/news/singapore/symptoms-of-novel-coronavirus-mild-similar-to-all-respiratory-12422036,11-02-2020 15:59:42,Channel News Asia
58,HK banks unveil relief measures for mortgage borrowers hit by coronavirus,https://www.channelnewsasia.com/news/business/wuhan-virus-coronavirus-hong-kong-banks-12422436,11-02-2020 15:43:22,Channel News Asia
59,Malaysia domestic trade ministry conducting inspections to ensure no panic buying of essentials by Singaporeans in Johor,https://www.channelnewsasia.com/news/asia/coronavirus-malaysia-panic-buying-singaporeans-johor-12421390,11-02-2020 14:37:11,Channel News Asia
60,"Badminton: China, Hong Kong to miss Asian team event due to coronavirus",https://www.channelnewsasia.com/news/sport/badminton--china--hong-kong-to-miss-asian-team-event-due-to-coronavirus-12422236,11-02-2020 14:20:38,Channel News Asia
61,NTU to log student attendance via QR codes to facilitate contact tracing for coronavirus outbreak if needed,https://www.channelnewsasia.com/news/singapore/wuhan-virus-ntu-contact-tracing-attendance-qr-codes-12422134,11-02-2020 14:13:57,Channel News Asia
62,China removes two Hubei leaders as coronavirus crisis deepens,https://www.channelnewsasia.com/news/asia/china-hubei-dismisses-leaders-wuhan-virus-coronavirus-12420628,11-02-2020 13:52:00,Channel News Asia
63,Two coronavirus patients discharged from Malaysian hospitals remain in the country for now: Chinese embassy,https://www.channelnewsasia.com/news/asia/malaysia-recovered-wuhan-coronavirus-patients-china-embassy-12421116,11-02-2020 13:09:07,Channel News Asia
64,Thailand refuses entry to cruise ship amid coronavirus concerns,https://www.channelnewsasia.com/news/asia/thailand-refuses-entry-cruise-ship-wuhan-virus-coronavirus-12421278,11-02-2020 12:15:32,Channel News Asia
65,Hong Kong evacuates residential building after virus cluster find,https://www.channelnewsasia.com/news/asia/hong-kong-evacuates-apartments-tsing-yi-faeces-pipes-spread-12421102,11-02-2020 12:02:36,Channel News Asia
66,"Singapore tourism to take 'significant hit' in 2020 due to coronavirus, up to 30% fewer visitors expected",https://www.channelnewsasia.com/news/singapore/coronavirus-singapore-tourism-to-fall-30-percent-12420674,11-02-2020 10:31:00,Channel News Asia
67,Retailer 3 Stars asked to explain high prices for masks following public complaints: MTI,https://www.channelnewsasia.com/news/singapore/wuhan-virus-coronavirus-3-stars-mask-high-prices-12420598,11-02-2020 10:03:58,Channel News Asia
68,Philippine airlines cancel flights to Taiwan over coronavirus,https://www.channelnewsasia.com/news/asia/philippine-airlines-cancel-taiwan-flights-wuhan-coronavirus-12420544,11-02-2020 09:22:59,Channel News Asia
69,"China coronavirus death toll passes 1,000",https://www.channelnewsasia.com/news/asia/china-wuhan-coronavirus-death-toll-passes-1-000-government-12420352,11-02-2020 07:31:58,Channel News Asia
70,US opens coronavirus push with aid to Laos,https://www.channelnewsasia.com/news/asia/us-opens-coronavirus-push-with-aid-to-laos-12420126,11-02-2020 06:21:36,Channel News Asia
71,‘Not enough manpower to get food to people in need’: Food charities hit as coronavirus measures ramped up,https://www.channelnewsasia.com/news/cnainsider/food-charities-heart-volunteers-wuhan-coronavirus-singapore-12418782,11-02-2020 06:15:00,Channel News Asia
72,Commentary: Singaporeans queued for toilet paper and instant noodles – there is no shame in that,https://www.channelnewsasia.com/news/commentary/panic-buying-wuhan-coronavirus-toilet-paper-instant-noodles-qu-12418048,11-02-2020 05:57:39,Channel News Asia
73,Coronavirus clips wings of Asia's biggest air show,https://www.channelnewsasia.com/news/business/coronavirus-clips-wings-of-asia-s-biggest-air-show-12420076,11-02-2020 05:56:03,Channel News Asia
74,"Commentary: Modern medicine, health systems have created illusion we have complete biological control over our fate",https://www.channelnewsasia.com/news/commentary/wuhan-coronavirus-response-epidemic-vaccine-us-donald-trump-12417736,11-02-2020 05:55:48,Channel News Asia
75,Cleared for discharge: What we know about the coronavirus patients who recovered in Malaysia,https://www.channelnewsasia.com/news/asia/wuhan-coronavirus-malaysia-discharged-patients-chinese-nationals-12417750,11-02-2020 05:55:31,Channel News Asia
76,"OG cuts shopping hours, Honestbee temporarily closes grocery store over coronavirus fears",https://www.channelnewsasia.com/news/business/og-cuts-shopping-hours-honestbee-temporarily-closes-grocery-12418328,11-02-2020 05:55:19,Channel News Asia
77,Countries rush to build diagnostic capacity as coronavirus spreads,https://www.channelnewsasia.com/news/world/countries-rush-to-build-diagnostic-capacity-as-coronavirus-spreads-12420064,11-02-2020 05:42:13,Channel News Asia
78,From Singapore to UK through the Alps: How one man spread coronavirus,https://www.channelnewsasia.com/news/world/from-singapore-to-uk-through-the-alps-how-one-man-spread-12419330,11-02-2020 03:43:05,Channel News Asia
79,Spurs star Dele Alli apologises as FA probe coronavirus post,https://www.channelnewsasia.com/news/sport/spurs-star-dele-alli-apologises-fa-probe-coronavirus-post-12419312,11-02-2020 03:05:20,Channel News Asia
80,"Oscars, movies help pass the time on cruise ship quarantined in Japan",https://www.channelnewsasia.com/news/asia/wuhan-virus-coronavirus-japan-cruise-diamond-princess-passenger-12419242,11-02-2020 02:47:34,Channel News Asia
81,"'Come home': Pakistan student in Wuhan misses father's funeral, anxiety grows",https://www.channelnewsasia.com/news/asia/wuhan-virus-coronavirus-pakistan-student-father-funeral-12419012,10-02-2020 23:57:01,Channel News Asia
82,"Coronavirus: No need to reject workers from dorm that housed infected Bangladeshi, says MOM",https://www.channelnewsasia.com/news/singapore/wuhan-virus-coronavirus-leo-dorm-bangladesh-worker-12418738,10-02-2020 23:41:51,Channel News Asia
83,Exaggeration to consider Grand Hyatt meeting a 'super-spreading' event: WHO expert,https://www.channelnewsasia.com/news/asia/wuhan-virus-coronavirus-grand-hyatt-who-12418994,10-02-2020 23:38:48,Channel News Asia
84,Bright future for aviation despite coronavirus challenge: DPM Heng ,https://www.channelnewsasia.com/news/singapore/wuhan-virus-coronavirus-aviation-future-heng-swee-keat-12418730,10-02-2020 22:27:03,Channel News Asia
85,"No evidence of aerosol transmission in novel coronavirus, says MOH",https://www.channelnewsasia.com/news/singapore/wuhan-virus-coronavirus-aerosol-transmission-moh-12418446,10-02-2020 22:01:00,Channel News Asia
86,Nissan to halt production at Japan factory due to coronavirus,https://www.channelnewsasia.com/news/business/nissan-to-halt-production-at-japan-factory-due-to-coronavirus-12418696,10-02-2020 21:41:13,Channel News Asia
87,China's government to prevent major layoffs amid coronavirus outbreak: Xi Jinping,https://www.channelnewsasia.com/news/asia/wuhan-coronavirus-china-economy-xi-jinping-12418398,10-02-2020 21:24:22,Channel News Asia
88,"2 new coronavirus cases in Singapore, including Certis Cisco employee who served quarantine orders",https://www.channelnewsasia.com/news/singapore/novel-coronavirus-confirmed-cases-singapore-feb-10-12417508,10-02-2020 20:24:06,Channel News Asia
89,Singapore working with international body to develop vaccine for novel coronavirus,https://www.channelnewsasia.com/news/singapore/singapore-working-with-international-body-to-develop-vaccine-for-12418126,10-02-2020 20:22:33,Channel News Asia
90,"China says 27 foreigners in the country have been infected with coronavirus, 2 dead",https://www.channelnewsasia.com/news/asia/wuhan-virus-coronavirus-china-foreigners-12418146,10-02-2020 19:51:39,Channel News Asia
91,"Singapore Airlines, SilkAir suspend some flights to China over coronavirus outbreak",https://www.channelnewsasia.com/news/singapore/wuhan-coronavirus-singapore-airlines-sia-silkair-suspend-flights-12417984,10-02-2020 19:40:47,Channel News Asia
92,Sarawak enforces 14-day home quarantine rule for travellers from Singapore,https://www.channelnewsasia.com/news/asia/wuhan-virus-coronavirus-sarawak-quarantine-singapore-12418054,10-02-2020 19:16:05,Channel News Asia
93,Attendance at Victoria Junior College 'very normal' despite coronavirus situation: Ong Ye Kung,https://www.channelnewsasia.com/news/singapore/coronavirus-victoria-junior-college-ong-ye-kung-visit-12417856,10-02-2020 18:31:49,Channel News Asia
94,"Taxi, private-hire drivers to get 300,000 masks for passengers amid coronavirus fears",https://www.channelnewsasia.com/news/singapore/coronavirus-taxi-private-hire-drivers-300000-masks-passengers-12416554,10-02-2020 17:22:13,Channel News Asia
95,Malaysian government mulling stimulus package as coronavirus outbreak takes toll on economy,https://www.channelnewsasia.com/news/asia/wuhan-coronavirus-malaysia-stimulus-package-mahathir-guan-eng-12417728,10-02-2020 17:14:28,Channel News Asia
96,Coronavirus chaos ravages Asia's sporting calendar,https://www.channelnewsasia.com/news/sport/coronavirus-chaos-ravages-asia-s-sporting-calendar-12417710,10-02-2020 17:01:34,Channel News Asia
97,More than 180 police officers deployed at quarantine facilities across Singapore,https://www.channelnewsasia.com/news/singapore/wuhan-coronavirus-quarantine-facilities-singapore-police-officer-12417732,10-02-2020 17:01:07,Channel News Asia
98,UK declares coronavirus a serious and imminent threat to public health,https://www.channelnewsasia.com/news/world/wuhan-virus-coronavirus-uk-serious-imminent-threat-12417612,10-02-2020 16:14:57,Channel News Asia
99,"Kuwait, Qatar issue travel advisories for Singapore, urge citizens to defer travel plans",https://www.channelnewsasia.com/news/singapore/wuhan-virus-coronavirus-singapore-kuwait-qatar-travel-advisory-12417074,10-02-2020 14:59:16,Channel News Asia
100,Coronavirus transforms daily life on Hong Kong's fearful streets,https://www.channelnewsasia.com/news/asia/coronavirus-transforms-daily-life-on-hong-kong-s-fearful-streets-12417150,10-02-2020 14:44:17,Channel News Asia
101,66 more people found to have coronavirus on Diamond Princess cruise ship in Japan,https://www.channelnewsasia.com/news/asia/wuhan-virus-coronavirus-japan-cruise-ship-diamond-princess-12416970,10-02-2020 13:45:23,Channel News Asia
102,Novel coronavirus in Singapore: What we know about the patients who have fully recovered,https://www.channelnewsasia.com/news/singapore/coronavirus-singapore-fully-recovered-patients-list-12416232,10-02-2020 11:47:09,Channel News Asia
103,"Coronavirus cases outside China 'could be spark' for bigger fire, says WHO",https://www.channelnewsasia.com/news/asia/coronavirus-cases-outside-china-could-be-spark-for-bigger-fire-12416398,10-02-2020 11:20:38,Channel News Asia
104,HSBC Women's golf in Singapore cancelled because of coronavirus,https://www.channelnewsasia.com/news/sport/wuhan-virus-hsbc-womens-golf-cancelled-12416324,10-02-2020 11:14:26,Channel News Asia
105,China stutters back to work as coronavirus deaths soar,https://www.channelnewsasia.com/news/asia/china-stutters-back-to-work-as-coronavirus-deaths-soar-12416234,10-02-2020 10:56:35,Channel News Asia
106,"Malaysia confirms sixth citizen case of coronavirus, man worked in Macau before coming home unwell",https://www.channelnewsasia.com/news/asia/coronavirus-malaysia-confirms-sixth-citizen-case-macau-12415998,10-02-2020 10:11:39,Channel News Asia
107,China coronavirus death toll surpasses 900,https://www.channelnewsasia.com/news/asia/wuhan-virus-china-death-toll-12415512,10-02-2020 07:19:41,Channel News Asia
108,Commentary: Novel coronavirus outbreak weighs heavily on global economy,https://www.channelnewsasia.com/news/commentary/novel-coronavirus-impact-businesses-global-economy-chains-12412560,10-02-2020 06:28:52,Channel News Asia
109,Nine members of Hong Kong family get virus after 'hotpot meal': Officials,https://www.channelnewsasia.com/news/asia/nine-members-of-hong-kong-family-get-virus-after-hotpot-meal-12413460,10-02-2020 05:20:00,Channel News Asia
110,Bangladesh aircrew refuse to work on Wuhan evacuation flight,https://www.channelnewsasia.com/news/asia/wuhan-virus-bangladesh-flight-refuse-work-evacuation-12413616,10-02-2020 01:30:56,Channel News Asia
111,"In French Alpine village, families line up for coronavirus tests",https://www.channelnewsasia.com/news/world/wuhan-virus-coronavirus-france-briton-12414136,10-02-2020 00:00:47,Channel News Asia
112,China offers US$43b boost to firms fighting novel coronavirus,https://www.channelnewsasia.com/news/business/wuhan-virus-coronavirus-china-funds-12413792,09-02-2020 23:25:52,Channel News Asia
113,6 new coronavirus cases found on Japan cruise ship,https://www.channelnewsasia.com/news/asia/wuhan-virus-coronavirus-japan-cruise-ship-12413680,09-02-2020 22:41:56,Channel News Asia
114,"Coronavirus outbreak: 3 new cases confirmed in Singapore, 4 more discharged",https://www.channelnewsasia.com/news/singapore/wuhan-coronavirus-singapore-new-confirmed-cases-feb-9-12412622,09-02-2020 21:45:40,Channel News Asia
