index,headline,source_url,publish_date,publisher
229,Hong Kong checks quarantined ship for novel coronavirus as medical workers escalate strikes,https://www.channelnewsasia.com/news/asia/wuhan-coronavirus-hong-kong-quarantine-ship-world-dream-taiwan-12400510,06-02-2020 12:39:30,Channel News Asia
230,Chinese players will not be banned from events due to coronavirus: Badminton World Federation ,https://www.channelnewsasia.com/news/sport/wuhan-coronavirus-badminton-chinese-players-not-banned-events-12400486,06-02-2020 12:10:27,Channel News Asia
231,Workers making iPhones in central China plant to be quarantined over coronavirus ,https://www.channelnewsasia.com/news/asia/wuhan-virus-coronaviru-iphones-central-china-foxconn-quarantined-12400402,06-02-2020 11:49:22,Channel News Asia
232,Ten more on cruise ship off Japan have new coronavirus: Local media,https://www.channelnewsasia.com/news/asia/wuhan-virus-cruise-ship-japan-infected-12399872,06-02-2020 08:21:32,Channel News Asia
233,China coronavirus death toll rises to 563,https://www.channelnewsasia.com/news/asia/china-coronavirus-death-toll-rises-to-563-12399726,06-02-2020 06:50:06,Channel News Asia
234,'The kampung spirit is still alive': Punggol residents step up amid coronavirus outbreak,https://www.channelnewsasia.com/news/singapore/wuhan-coronavirus-singapore-virus-punggol-kampung-spirit-12397614,06-02-2020 06:30:41,Channel News Asia
235,Commentary: Are we overreacting to the novel coronavirus?,https://www.channelnewsasia.com/news/commentary/wuhan-coronavirus-china-sars-epidemic-outbreak-media-overreact-12394674,06-02-2020 06:29:21,Channel News Asia
236,Commentary: Looks like containment of novel coronavirus not as effective as we had hoped,https://www.channelnewsasia.com/news/commentary/wuhan-coronavirus-quarantine-lockdown-containment-mitigation-how-12394178,06-02-2020 06:28:39,Channel News Asia
237,Drugmakers see long road ahead in coronavirus vaccine race,https://www.channelnewsasia.com/news/world/drugmakers-see-long-road-ahead-in-coronavirus-vaccine-race-12399552,06-02-2020 05:05:07,Channel News Asia
238,Gates Foundation pledges US$100m for coronavirus response,https://www.channelnewsasia.com/news/world/wuhan-coronavirus-bill-gates-foundation-donation-100-million-12399060,06-02-2020 01:46:09,Channel News Asia
239,"What we know about the 4 new coronavirus cases in Singapore, including 6-month-old baby",https://www.channelnewsasia.com/news/singapore/wuhan-virus-singapore-coronavirus-new-cases-baby-12399000,06-02-2020 00:29:01,Channel News Asia
240,WHO issues appeal for US$675 million to fight novel coronavirus,https://www.channelnewsasia.com/news/world/who-issues-appeal-million-fight-novel-coronavirus-12399066,06-02-2020 00:03:51,Channel News Asia
241,Chinese aerobatics team to perform at Singapore Airshow after 'careful consideration' by authorities,https://www.channelnewsasia.com/news/singapore/aerobatics-team-china-ba-yi-august-1st-airshow-wuhan-coronavirus-12398516,05-02-2020 23:47:25,Channel News Asia
242,"More than 100 people attended meeting at Grand Hyatt Singapore linked to Malaysia, South Korea coronavirus cases",https://www.channelnewsasia.com/news/singapore/wuhan-coronavirus-grand-hyatt-meeting-malaysia-korea-12398310,05-02-2020 23:30:04,Channel News Asia
243,Hundreds of US evacuees under coronavirus quarantine at military bases,https://www.channelnewsasia.com/news/world/us-evacute-wuhan-coronavirus-flight-california-air-base-12398406,05-02-2020 23:20:07,Channel News Asia
244,'Fragile' Africa prepares for high risk of coronavirus spread,https://www.channelnewsasia.com/news/world/fragile-africa-prepare-high-risk-coronavirus-spread-12398528,05-02-2020 23:03:11,Channel News Asia
245,"Coronavirus outbreak: 6-month-old baby among 4 new cases in Singapore, 3 of them linked to local transmission cluster ",https://www.channelnewsasia.com/news/singapore/wuhan-virus-coronavirus-singapore-number-cases-12395928,05-02-2020 22:26:55,Channel News Asia
246,Coronavirus outbreak: Malaysia to bring home civil servants from China,https://www.channelnewsasia.com/news/asia/coronavirus-malaysia-bring-home-civil-servants-from-china-12398126,05-02-2020 22:09:12,Channel News Asia
247,Thousands of Chinese tourists stranded in Bali after flights suspended,https://www.channelnewsasia.com/news/asia/china-tourist-stranded-bali-flight-cancel-coronavirus-12398212,05-02-2020 21:49:56,Channel News Asia
248,Brazil's lower house of Congress approves coronavirus quarantine bill,https://www.channelnewsasia.com/news/world/brazil-congress-lower-house-approves-coronavirus-quarantine-bill-12397994,05-02-2020 20:17:10,Channel News Asia
249,Olympics: China coronavirus spread could throw cold water on 2020 Games - Chief,https://www.channelnewsasia.com/news/sport/olympics-china-coronavirus-spread-2020-games-12397888,05-02-2020 19:59:33,Channel News Asia
250,"Singapore Red Cross raises more than S$100,000 in public donations to help communities in China affected by coronavirus",https://www.channelnewsasia.com/news/singapore/singapore-red-cross-wuhan-coronavirus-public-donations-china-12397716,05-02-2020 19:45:51,Channel News Asia
251,"Deep cleaning measures at Grand Hyatt hotel linked to Malaysian, South Korean coronavirus cases",https://www.channelnewsasia.com/news/singapore/wuhan-coronavirus-grand-hyatt-deep-clean-12397284,05-02-2020 19:29:37,Channel News Asia
252,Coronavirus outbreak: Johor to suspend all state-organised events in February,https://www.channelnewsasia.com/news/asia/wuhan-virus-outbreak-johor-to-suspend-all-mass-gathering-events-12397508,05-02-2020 19:05:34,Channel News Asia
253,Airbus closes China plant due to coronavirus,https://www.channelnewsasia.com/news/business/airbus-closes-china-plant-wuhan-coronavirus-12397662,05-02-2020 18:56:28,Channel News Asia
254,"Mothers may pass novel coronavirus to unborn children, say Chinese doctors",https://www.channelnewsasia.com/news/asia/wuhan-virus-coronavirus-pregnant-women-baby-12397512,05-02-2020 18:47:09,Channel News Asia
255,"Data suggests novel coronavirus infections under-reported, exaggerating fatality rate",https://www.channelnewsasia.com/news/asia/wuhan-virus-coronavirus-death-rate-cases-12397358,05-02-2020 18:25:51,Channel News Asia
256,Malaysian journalist charged over China coronavirus posts,https://www.channelnewsasia.com/news/asia/malaysian-journalist-charged-over-china-coronavirus-posts-12397286,05-02-2020 18:11:48,Channel News Asia
257,Thai taxi driver who had coronavirus tells Wuhan to keep fighting,https://www.channelnewsasia.com/news/asia/thailand-taxi-driver-coronavirus-tells-wuhan-keep-fighting-12397170,05-02-2020 18:01:11,Channel News Asia
258,Coronavirus outbreak: Britain charters final Wuhan evacuation flight,https://www.channelnewsasia.com/news/world/coronavirus-outbreak-britain-charters-final-wuhan-evacuation-12396692,05-02-2020 17:25:40,Channel News Asia
259,Coronavirus outbreak: Hong Kong to quarantine all arrivals from mainland China,https://www.channelnewsasia.com/news/asia/wuhan-coronavirus-hong-kong-quarantine-mainland-china-visitors-12396568,05-02-2020 17:11:47,Channel News Asia
260,Two Malaysians evacuated from Wuhan tested positive for novel coronavirus,https://www.channelnewsasia.com/news/asia/wuhan-coronavirus-malaysia-two-positive-evacuated-12396282,05-02-2020 17:03:14,Channel News Asia
261,"Wilted flowers, empty cafes: China's small businesses bear coronavirus costs",https://www.channelnewsasia.com/news/asia/wuhan-coronavirus-china-small-business-bear-costs-shut-down-12396266,05-02-2020 16:53:06,Channel News Asia
262,Vietnam setting up field hospitals for possible coronavirus influx,https://www.channelnewsasia.com/news/asia/vietnam-set-up-field-hospitals-coronavirus-influx-12396242,05-02-2020 16:13:26,Channel News Asia
263,China lab seeks patent on use of Gilead's coronavirus treatment,https://www.channelnewsasia.com/news/business/china-lab-patent-gilead-coronavirus-treatment-12396008,05-02-2020 15:50:16,Channel News Asia
264,"Cathay Pacific asks 27,000 employees to take unpaid leave as coronavirus outbreak hit demand",https://www.channelnewsasia.com/news/asia/hong-kong-airline-cathay-ask-staff-take-unpaid-leave-coronavirus-12395946,05-02-2020 15:26:41,Channel News Asia
265,More Chinese cities shut down as novel coronavirus death toll rises,https://www.channelnewsasia.com/news/asia/wuhan-coronavirus-more-china-cities-shut-hangzhou-zhejiang-hubei-12395706,05-02-2020 15:06:19,Channel News Asia
266,Town councils step up cleaning at high human traffic areas to counter coronavirus,https://www.channelnewsasia.com/news/singapore/wuhan-coronavirus-virus-enhanced-cleaning-masagos-nea-12395526,05-02-2020 15:01:23,Channel News Asia
267,Hong Kong conducts health checks on cruise ship denied Taiwan docking,https://www.channelnewsasia.com/news/asia/wuhan-virus-coronavirus-hong-kong-taiwan-cruise-ship-12395546,05-02-2020 14:30:50,Channel News Asia
268,Tokyo Olympic boss 'extremely worried' about deadly virus ,https://www.channelnewsasia.com/news/sport/tokyo-olympic-boss--extremely-worried--about-deadly-virus--12395704,05-02-2020 14:30:18,Channel News Asia
269,Hong Kong medical staff strike for third day as locally transmitted coronavirus cases rise,https://www.channelnewsasia.com/news/asia/hong-kong-medical-staff-strike-wuhan-coronavirus-rise-cases-12395288,05-02-2020 13:43:36,Channel News Asia
270,Last century's epidemics more deadly than today's,https://www.channelnewsasia.com/news/world/wuhan-coronavirus-epidemics-sars-ebola-swine-flu-aids-diseases-12395038,05-02-2020 13:06:30,Channel News Asia
271,"Shortage of face masks in JB amid coronavirus scare, some retailers selling above price ceiling",https://www.channelnewsasia.com/news/asia/wuhan-coronavirus-masks-malaysia-johor-bahru-price-ceiling-12388090,05-02-2020 12:28:43,Channel News Asia
272,The ‘novel coronavirus’ could get an official name in days: Report,https://www.channelnewsasia.com/news/world/wuhan-coronavirus-who-scientists-work-to-give-official-name-12394928,05-02-2020 12:25:54,Channel News Asia
273,3 new coronavirus cases in South Korea; 2 men had travelled to Singapore for conference,https://www.channelnewsasia.com/news/asia/wuhan-virus-coronavirus-south-korea-cases-12394934,05-02-2020 12:12:10,Channel News Asia
274,Repatriated Belgian tests positive for novel coronavirus,https://www.channelnewsasia.com/news/world/wuhan-coronavirus-virus-belgium-tests-positive-china-12394176,05-02-2020 11:05:47,Channel News Asia
275,'Sufficient room’ within policy band for easing in line with coronavirus economic impact: MAS,https://www.channelnewsasia.com/news/business/sufficient-room-within-policy-band-for-easing-coronavirus-mas-12394530,05-02-2020 11:05:35,Channel News Asia
276,"American, United suspending US flights to and from Hong Kong through Feb 20",https://www.channelnewsasia.com/news/business/wuhan-coronavirus-american-united-suspending-flights-hong-kong-12393744,05-02-2020 08:10:41,Channel News Asia
277,At least 10 on Japan cruise ship test positive for novel coronavirus,https://www.channelnewsasia.com/news/asia/japan-wuhan-coronavirus-cruise-ship-quarantine-virus-12393602,05-02-2020 08:08:44,Channel News Asia
278,China coronavirus death toll rises to 490 as more countries confirm local transmission,https://www.channelnewsasia.com/news/asia/wuhan-virus-death-toll-cases-coronavirus-china-12393418,05-02-2020 07:01:00,Channel News Asia
279,Indonesian health ministry says lab has all needed equipment to detect novel coronavirus,https://www.channelnewsasia.com/news/asia/wuhan-coronavirus-indonesia-testing-kits-laboratory-12389198,05-02-2020 06:35:02,Channel News Asia
280,Commentary: Hot and humid weather may end the novel coronavirus – as well as the development of a vaccine,https://www.channelnewsasia.com/news/commentary/hot-climate-wuhan-virus-vaccine-12389694,05-02-2020 06:32:56,Channel News Asia
281,World has 'window of opportunity' to halt virus spread: WHO chief,https://www.channelnewsasia.com/news/world/wuhan-virus-who-china-data-window-of-opportunity-12392968,05-02-2020 03:48:26,Channel News Asia
282,"WHO calls for improved data-sharing on virus, says sending team to China",https://www.channelnewsasia.com/news/world/who-calls-for-improved-data-sharing-on-virus--says-sending-team-to-china-12392908,05-02-2020 03:43:02,Channel News Asia
283,Four-year-old coronavirus patient in Malaysia discharged from hospital,https://www.channelnewsasia.com/news/asia/wuhan-coronavirus-virus-girl-malaysia-recover-12392238,05-02-2020 00:45:16,Channel News Asia
284,Coronavirus outbreak: Singapore to provide S$1 million in seed funding to groups helping China communities,https://www.channelnewsasia.com/news/singapore/wuhan-virus-singapore-support-aid-efforts-coronavirus-12392090,05-02-2020 00:20:19,Channel News Asia
285,Canada aims to evacuate citizens from China on Thursday: Source,https://www.channelnewsasia.com/news/world/canada-evacuate-citizens-from-china-wuhan-coronavirus-12392120,04-02-2020 23:58:09,Channel News Asia
286,Royal Caribbean cancels eight China cruises on coronavirus fears,https://www.channelnewsasia.com/news/business/royal-caribbean-cancels-eight-china-cruises-on-coronavirus-fears-12391310,04-02-2020 21:57:00,Channel News Asia
287,Indonesian women arrested for spreading coronavirus hoax,https://www.channelnewsasia.com/news/asia/wuhan-virus-indonesian-women-arrested-spreading-hoax-12391216,04-02-2020 21:28:59,Channel News Asia
288,Novel coronavirus patient discharged from NCID after recovery: MOH,https://www.channelnewsasia.com/news/singapore/wuhan-coronavirus-patient-discharged-ncid-moh-12390714,04-02-2020 21:07:26,Channel News Asia
289,Mask Vigilantes Are Giving Out Free Masks. Here’s How You Can Get Them,https://www.channelnewsasia.comhttp://www.8days.sg/8days/liveandlearn/vanityandhealth/mask-vigilantes-are-giving-out-free-masks-here-s-how-you-can-get-12390902,04-02-2020 21:00:29,Channel News Asia
290,Coronavirus outbreak: Britain tells its citizens to leave China after airlines suspend flights,https://www.channelnewsasia.com/news/world/britain-tells-citizens-leave-china-wuhan-coronavirus-12391026,04-02-2020 21:00:15,Channel News Asia
291,"AFC matches involving Chinese teams postponed to April, May due to virus scare",https://www.channelnewsasia.com/news/sport/afc-matches-involving-chinese-teams-postponed-to-april-may-due-12390994,04-02-2020 20:44:01,Channel News Asia
292,What we know about the people who died from the novel coronavirus,https://www.channelnewsasia.com/news/asia/wuhan-virus-coronavirus-what-we-know-about-the-fatalities-12390814,04-02-2020 20:05:37,Channel News Asia
293,South Korean 'mask hoarders' threatened with jail,https://www.channelnewsasia.com/news/asia/south-korean-mask-hoarders-threatened-with-jail-12390524,04-02-2020 18:21:54,Channel News Asia
294,Cambodian PM says he will visit students in China's Wuhan for moral support,https://www.channelnewsasia.com/news/asia/cambodia-pm-visit-students-china-wuhan-coronavirus-moral-support-12390216,04-02-2020 18:08:55,Channel News Asia
295,What we know about the locally transmitted coronavirus cases in Singapore,https://www.channelnewsasia.com/news/singapore/wuhan-coronavirus-singapore-virus-new-cases-local-transmission-12390118,04-02-2020 18:00:06,Channel News Asia
296,"Coronavirus outbreak: Schools, eldercare facilities to suspend large gatherings after first local transmission",https://www.channelnewsasia.com/news/singapore/wuhan-coronavirus-singapore-enhanced-measures-schools-businesses-12389986,04-02-2020 18:00:00,Channel News Asia
297,"Thailand confirms 6 new cases of novel coronavirus, including 4 Thais",https://www.channelnewsasia.com/news/asia/wuhan-coronavirus-thailand-new-cases-citizens-japan-drivers-12390442,04-02-2020 17:53:36,Channel News Asia
298,Novel coronavirus spreads fear and racism worldwide,https://www.channelnewsasia.com/news/world/wuhan-coronavirus-spreads-fear-racism-worldwide-travel-ban-12389834,04-02-2020 16:07:12,Channel News Asia
299,"Millions in China banish coronavirus blues with online games, video apps",https://www.channelnewsasia.com/news/business/wuhan-coronavirus-china-online-games-video-apps-12389902,04-02-2020 15:54:32,Channel News Asia
300,Commentary: Open communication and international partnerships needed to fight novel coronavirus,https://www.channelnewsasia.com/news/commentary/wuhan-coronavirus-china-government-sars-response-measure-who-12388634,04-02-2020 15:31:34,Channel News Asia
301,Taiwan calls China 'vile' for limiting WHO access during virus outbreak,https://www.channelnewsasia.com/news/asia/wuhan-virus-taiwan-china-limit-who-access-12389416,04-02-2020 15:26:52,Channel News Asia
302,Malaysia confirms first citizen case of novel coronavirus; man was in Singapore for meeting attended by Chinese delegates,https://www.channelnewsasia.com/news/asia/wuhan-coronavirus-malaysia-first-citizen-case-malaysian-12389728,04-02-2020 14:44:51,Channel News Asia
303,Macau to suspend casino operations for 2 weeks to curb spread of novel coronavirus,https://www.channelnewsasia.com/news/asia/wuhan-virus-china-novel-coronavirus-macau-casino-suspend-12389478,04-02-2020 14:22:12,Channel News Asia
304,"South Korea's Black Eagles, 16 exhibitors cancel appearances at Singapore Airshow ",https://www.channelnewsasia.com/news/singapore/singapore-airshow-south-korea-black-eagles-16-exhibitors-cancel-12389250,04-02-2020 14:03:55,Channel News Asia
305,South Korean tourist tests positive for novel coronavirus after visiting Thailand,https://www.channelnewsasia.com/news/asia/south-korea-woman-wuhan-coronavirus-positive-thailand-visit-12389294,04-02-2020 13:38:56,Channel News Asia
306,China opens novel coronavirus hospital built from scratch in under two weeks,https://www.channelnewsasia.com/news/asia/wuhan-coronavirus-china-opens-hospital-built-two-weeks-hubei-12388804,04-02-2020 12:54:05,Channel News Asia
307,"Actresses Jeanette Aw, Joanne Peh back in Singapore from China",https://www.channelnewsasia.com/news/lifestyle/jeanette-aw-joanne-peh-singapore-china-wuhan-coronavirus-12388716,04-02-2020 12:50:21,Channel News Asia
308,"Hangzhou and Taizhou, cities far from virus epicentre, implement travel restrictions",https://www.channelnewsasia.com/news/asia/hangzhou-and-taizhou-cities-far-from-virus-epicentre-implement-12388714,04-02-2020 12:42:39,Channel News Asia
309,How luxury brands in Singapore are coping with the novel coronavirus outbreak,https://www.channelnewsasia.com/news/cna-luxury/experiences/singapore-luxury-brands-wuhan-coronavirus-12388210,04-02-2020 12:04:08,Channel News Asia
310,Have a good cry but no boozing: Expert tips for coronavirus-stressed China,https://www.channelnewsasia.com/news/asia/wuhan-coronavirus-tips-stressed-china-cry-exercise-no-booze-12388514,04-02-2020 11:54:45,Channel News Asia
311,NATAS postpones travel fair amid concerns that coronavirus outbreak will dampen turnout,https://www.channelnewsasia.com/news/singapore/wuhan-virus-china-coronavirus-natas-travel-fair-12388428,04-02-2020 11:01:50,Channel News Asia
312,Hong Kong reports first coronavirus death,https://www.channelnewsasia.com/news/asia/wuhan-virus-hong-kong-death-china-infection-toll-12388372,04-02-2020 10:43:22,Channel News Asia
313,Malaysians evacuated from Wuhan arrive at KLIA,https://www.channelnewsasia.com/news/asia/malaysia-evacuate-wuhan-coronavirus-arrive-klia-quarantine-12388318,04-02-2020 10:42:03,Channel News Asia
314,"Japan testing 3,700 people quarantined on cruise ship after Hong Kong novel coronavirus case",https://www.channelnewsasia.com/news/asia/japan-wuhan-coronavirus-cruise-ship-quarantine-virus-12388092,04-02-2020 09:09:07,Channel News Asia
315,World Bank calls for global effort against virus,https://www.channelnewsasia.com/news/world/world-bank-wuhan-virus-global-effort-12388076,04-02-2020 08:39:12,Channel News Asia
316,China to allow in US health experts as coronavirus shows no sign of slowing,https://www.channelnewsasia.com/news/asia/wuhan-virus-us-health-experts-who-12384350,04-02-2020 08:26:25,Channel News Asia
317,Some businesses suffer fallout from novel coronavirus,https://www.channelnewsasia.com/news/singapore/some-businesses-suffer-fallout-novel-coronavirus-wuhan-12386396,04-02-2020 07:52:48,Channel News Asia
318,China coronavirus death toll soars past 400,https://www.channelnewsasia.com/news/asia/wuhan-virus-china-coronavirus-death-toll-rises-12387992,04-02-2020 07:04:03,Channel News Asia
319,Commentary: Novel coronavirus reveals old vulnerabilities in the global economy,https://www.channelnewsasia.com/news/commentary/wuhan-virus-global-economic-growth-markets-12386076,04-02-2020 06:30:19,Channel News Asia
320,Commentary: We know more about the novel coronavirus but uncertainty remains about how virus spreads,https://www.channelnewsasia.com/news/commentary/wuhan-coronavirus-symptoms-incubation-quarantine-spread-12385734,04-02-2020 06:22:40,Channel News Asia
321,Disquiet in Indonesia’s Natuna over use of island as quarantine site amid coronavirus outbreak,https://www.channelnewsasia.com/news/asia/wuhan-coronavirus-indonesia-natuna-afraid-concerned-quarantine-12386040,04-02-2020 06:22:30,Channel News Asia
322,G7 health ministers agree on coordinated approach to coronavirus,https://www.channelnewsasia.com/news/world/g7-health-ministers-agree-on-coordinated-approach-to-coronavirus-12387750,04-02-2020 04:26:59,Channel News Asia
323,US health officials announce second case of person-to-person coronavirus transmission,https://www.channelnewsasia.com/news/world/us-health-officials-announce-second-case-of-person-to-person-12387726,04-02-2020 04:22:19,Channel News Asia
324,Sub-standard mask donations hamper China virus response: Red Cross,https://www.channelnewsasia.com/news/asia/sub-standard-mask-donations-hamper-china-virus-response--red-cross-12387652,04-02-2020 03:42:42,Channel News Asia
325,"Brazil to declare emergency, quarantine nationals returning from China",https://www.channelnewsasia.com/news/world/brazil-to-declare-emergency--quarantine-nationals-returning-from-china-12387272,04-02-2020 02:13:42,Channel News Asia
326,China detains woman for hiding coronavirus contact history,https://www.channelnewsasia.com/news/asia/wuhan-coronavirus-china-detains-hiding-contact-history-virus-12387102,04-02-2020 01:10:52,Channel News Asia
327,Novel coronavirus: Landlords may be penalised for evicting tenants on quarantine or leave of absence,https://www.channelnewsasia.com/news/singapore/wuhan-coronavirus-landlords-eviction-tenants-quarantine-loa-12387052,04-02-2020 00:36:18,Channel News Asia
328,Philippines' Duterte says xenophobia against Chinese over coronavirus must stop,https://www.channelnewsasia.com/news/asia/wuhan-virus-philippines-duterte-chinese-xenophobia-12387050,03-02-2020 23:40:19,Channel News Asia
329,"Air transit hub UAE to suspend China flights, excluding Beijing",https://www.channelnewsasia.com/news/world/air-transit-hub-uae-suspend-china-flights-excluding-beijing-12387036,03-02-2020 23:35:27,Channel News Asia
330,China says it shared 'latest information' with Taiwan about coronavirus outbreak,https://www.channelnewsasia.com/news/asia/wuhan-coronavirus-china-taiwan-who-un-12386984,03-02-2020 23:05:01,Channel News Asia
331,China admits 'shortcomings' in virus response,https://www.channelnewsasia.com/news/asia/china-leadership-admits-shortcomings-virus-response-12386982,03-02-2020 22:58:05,Channel News Asia
332,MPs raise concerns over possible community spread of novel coronavirus and the economic impact on Singapore,https://www.channelnewsasia.com/news/singapore/wuhan-coronavirus-concerns-parliament-mps-12386616,03-02-2020 22:37:09,Channel News Asia
333,Pakistan bucks trend and resumes flights to virus-hit China,https://www.channelnewsasia.com/news/asia/pakistan-bucks-trend-and-resumes-flights-to-virus-hit-china-12386946,03-02-2020 22:19:19,Channel News Asia
334,Chinese citizens turn to virus tracker apps to avoid infected neighbourhoods,https://www.channelnewsasia.com/news/asia/chinese-citizens-turn-to-virus-tracker-apps-to-avoid-infected-neighbourhoods-12386932,03-02-2020 22:12:01,Channel News Asia
335,China's anti-doping agency halts testing due to coronavirus,https://www.channelnewsasia.com/news/sport/wuhan-coronavirus-china-anti-doping-agency-halts-testing-12386762,03-02-2020 21:01:45,Channel News Asia
336,Chinese turn to social media to feed stranded pets in virus city,https://www.channelnewsasia.com/news/asia/china-wuhan-coronavirus-stranded-pets-social-media-12386638,03-02-2020 20:23:49,Channel News Asia
337,No new cases of novel coronavirus in Singapore for second day running; total remains at 18,https://www.channelnewsasia.com/news/singapore/wuhan-coronavirus-singapore-no-new-cases-feb-3-12384398,03-02-2020 19:52:26,Channel News Asia
338,Malaysia to quarantine citizens evacuated from Wuhan in remote location,https://www.channelnewsasia.com/news/asia/malaysia-evacuate-citizens-wuhan-coronavirus-quarantine-remote-12386402,03-02-2020 19:40:26,Channel News Asia
339,In full: Lawrence Wong's ministerial statement on Singapore's response to novel coronavirus,https://www.channelnewsasia.com/news/singapore/wuhan-coronavirus-lawrence-wong-ministerial-statement-virus-12385480,03-02-2020 19:29:24,Channel News Asia
340,Chinese cerebral palsy patient dies after father quarantined for coronavirus,https://www.channelnewsasia.com/news/asia/wuhan-coronavirus-dad-quarantined-disabled-boy-dies-12386258,03-02-2020 19:02:34,Channel News Asia
341,"China decries travel, visa measures taken against WHO advice on coronavirus",https://www.channelnewsasia.com/news/asia/wuhan-virus-china-decries-travel-visa-measures-who-12386306,03-02-2020 18:50:54,Channel News Asia
342,WHO launches campaign against China virus misinformation,https://www.channelnewsasia.com/news/world/who-launches-campaign-against-china-virus-misinformation-12386244,03-02-2020 18:37:37,Channel News Asia
