index,headline,source_url,publish_date,publisher
269,"S’pore roads & streets really palpably quieter & emptier on Sunday, Feb. 2, 2020",https://www.mothership.sg/2020/02/wuhan-virus-china-tourists-singapore-quiet/,03-02-2020 09:08:00,Mothership
270,Wuhan virus: 15 travellers refused entry into S’pore less than a day after travel restriction enforced,https://www.mothership.sg/2020/02/wuhan-virus-15-travellers-refused/,03-02-2020 04:38:00,Mothership
271,"No new Wuhan virus cases identified in S’pore as of Feb. 2, 2020",https://www.mothership.sg/2020/02/no-new-wuhan-virus/,03-02-2020 04:03:00,Mothership
272,STB to subsidise cleaning costs of hotels with confirmed & suspected Wuhan virus cases,https://www.mothership.sg/2020/02/stb-tourism-wuhan-virus/,03-02-2020 01:05:00,Mothership
273,PM Lee: Anti-China sentiments unhelpful during Wuhan coronavirus outbreak,https://www.mothership.sg/2020/02/pm-lee-teck-ghee-cny/,02-02-2020 21:59:00,Mothership
274,Workforce S’pore apologise for misunderstanding over instruction to staff not to wear face masks to avoid sending ‘wrong signal’,https://www.mothership.sg/2020/02/workforce-singapore-not-wear-mask/,02-02-2020 21:44:00,Mothership
275,"What happened in S’pore during the SARS outbreak in 2003 & how we dealt with it, explained",https://www.mothership.sg/2020/02/sars-wuhan-outbreak-explained/,02-02-2020 20:54:00,Mothership
276,The Philippines reports first death of patient with Wuhan virus outside China,https://www.mothership.sg/2020/02/first-death-philippines-wuhan-virus/,02-02-2020 20:08:00,Mothership
277,"China slams countries that ban Chinese travellers, says travel restrictions an ‘overreaction’",https://www.mothership.sg/2020/02/china-travel-restrictions-overreaction/,02-02-2020 17:29:00,Mothership
278,Macau prepared 20 million face masks to sell to residents at fixed price amid Wuhan virus outbreak,https://www.mothership.sg/2020/02/macau-face-masks/,02-02-2020 12:03:00,Mothership
279,DPM Heng: Govt prepared to foot part of wage costs to retrain S’pore workers to cushion economic impact of Wuhan virus,https://www.mothership.sg/2020/02/heng-swee-keat-wuhanvirus-package/,02-02-2020 07:21:00,Mothership
280,"China’s Hunan hit by H5N1 bird flu amidst Wuhan virus outbreak, over 17,000 poultry killed",https://www.mothership.sg/2020/02/china-hunan-h5n1/,02-02-2020 07:11:00,Mothership
281,"Another S’porean infected with Wuhan virus, total confirmed cases in S’pore at 18",https://www.mothership.sg/2020/02/singaporean-new-wuhan-case-numbers/,02-02-2020 03:36:00,Mothership
282,"Arrested whistleblower doctor not wrong for warning about Wuhan virus, China top court slams police",https://www.mothership.sg/2020/02/wuhan-doctor-whistleblower/,02-02-2020 03:09:00,Mothership
283,"No need to avoid places with suspected/confirmed cases of Wuhan virus, S’pore govt says",https://www.mothership.sg/2020/02/places-to-avoid-wuhanvirus/,02-02-2020 01:43:00,Mothership
284,M’sia Ministry of Health clarifies that the Wuhan virus does not make people act like zombies,https://www.mothership.sg/2020/02/malaysia-wuhan-virus-zombie/,02-02-2020 01:08:00,Mothership
285,More countries place travel restrictions on China in wake of Wuhan virus outbreak,https://www.mothership.sg/2020/02/world-travel-restrictions-china/,01-02-2020 23:33:00,Mothership
286,"ICA officers can wear masks if they need to, but biggest risk comes from hand contact: Shanmugam",https://www.mothership.sg/2020/02/shanmugam-ica-wuhan-masks/,01-02-2020 23:00:00,Mothership
287,S’pore religious leaders perform prayers for Wuhan virus victims & frontline medical staff,https://www.mothership.sg/2020/02/prayer-iro-religious-leaders-wuhan-singapore/,01-02-2020 20:43:00,Mothership
288,"Scoot suspending all flights to mainland China from Feb. 8 to March 28, 2020",https://www.mothership.sg/2020/02/scoot-suspending-flights-singapore-wuhan/,01-02-2020 18:59:00,Mothership
289,"259 people have died from Wuhan virus as of Feb. 1. 11,821 cases in China, 124 abroad.",https://www.mothership.sg/2020/02/wuhan-virus-daily-updates-feb-1/,01-02-2020 17:40:00,Mothership
290,In-laws of S’pore American School staff believed to be 8th & 9th confirmed cases of Wuhan virus,https://www.mothership.sg/2020/02/singapore-american-school-coronavirus/,01-02-2020 09:17:00,Mothership
291,"Shoppers clean out Mustafa Centre of hand sanitisers, disinfectants & antiseptic wet wipes",https://www.mothership.sg/2020/02/mustafa-hand-sanitiser-masks/,01-02-2020 08:22:00,Mothership
292,"Russia confirms 1st two cases of Wuhan virus, demand for masks increases by 13 times",https://www.mothership.sg/2020/01/russia-wuhan-coronavirus/,01-02-2020 06:02:00,Mothership
293,"1,500 SAF personnel packing 5.2 million masks for 1.37 million S’pore households",https://www.mothership.sg/2020/01/1500-saf-personnel-pack-masks/,01-02-2020 05:12:00,Mothership
294,ICA: Frontline officers don’t wear masks because risk from transient contact assessed to be ‘low’,https://www.mothership.sg/2020/01/why-ica-officers-dont-wear-masks/,01-02-2020 04:22:00,Mothership
295,"1st S’porean to be infected with Wuhan virus among 3 new cases in S’pore, was evacuated from Wuhan on Jan. 30",https://www.mothership.sg/2020/01/wuhan-new-cases-update/,01-02-2020 04:14:00,Mothership
296,"UK confirms first 2 cases of Wuhan virus, brought to Newcastle for treatment overnight",https://www.mothership.sg/2020/01/uk-first-2-cases-wuhan-virus/,01-02-2020 03:55:00,Mothership
297,New suspected case of Wuhan virus: woman who visited HarbourFront Centre clinic on Jan. 31,https://www.mothership.sg/2020/01/wuhan-virus-harbourfront-centre/,01-02-2020 03:16:00,Mothership
298,Heng Swee Keat to announce economic package to cushion impact of Wuhan virus on S’pore’s economy,https://www.mothership.sg/2020/01/heng-swee-keat-wuhan-virus-economic-package/,01-02-2020 03:04:00,Mothership
299,First human-to-human transmission of Wuhan coronavirus confirmed in Thailand,https://www.mothership.sg/2020/01/thailand-wuhan-coronavirus/,01-02-2020 03:02:00,Mothership
300,S’pore extends travel ban to all visitors who have been to mainland China in past 14 days,https://www.mothership.sg/2020/01/singapore-travel-ban-extends/,01-02-2020 02:00:00,Mothership
301,PM Lee: Glad to have POFMA to curb fake news on Wuhan virus,https://www.mothership.sg/2020/01/pm-lee-pofma-wuhan-virus/,01-02-2020 01:10:00,Mothership
302,"About 1,000 short-term temperature screener jobs in S’pore paying S$7-S$32 an hour",https://www.mothership.sg/2020/01/temperature-screeners-singapore-job-part-time/,01-02-2020 00:45:00,Mothership
303,"Danish newspaper not apologising to China over coronavirus flag, says it didn’t do anything wrong",https://www.mothership.sg/2020/01/danish-newspaper-china-flag/,31-01-2020 23:34:00,Mothership
304,Wuhan girl shares heartbreaking story about losing mother to Wuhan virus on CNY,https://www.mothership.sg/2020/01/wuhan-resident-story-mother-died/,31-01-2020 23:11:00,Mothership
305,Total number of Wuhan virus cases in South Korea hits 7,https://www.mothership.sg/2020/01/wuhan-virus-south-korea/,31-01-2020 22:28:00,Mothership
306,PM Lee: S’pore a long way from community spread if we stay vigilant,https://www.mothership.sg/2020/01/pm-lee-ncid-visit/,31-01-2020 21:59:00,Mothership
307,S’pore foreign affairs minister Vivian Balakrishnan confident China will beat Wuhan virus,https://www.mothership.sg/2020/01/mfa-china-wuhan-virus/,31-01-2020 20:26:00,Mothership
308,Ministers Gan Kim Yong & Chan Chun Sing invoke POFMA against false claims about Wuhan virus,https://www.mothership.sg/2020/01/ministers-gan-kim-yong-chan-chun-sing-invoke-pofma-against-false-claims-about-wuhan-virus/,31-01-2020 19:22:00,Mothership
309,"China’s Wuhan virus death toll jumps to 213, confirmed cases reach 9,692",https://www.mothership.sg/2020/01/newest-numbers-wuhan-virus-31-jan/,31-01-2020 19:06:00,Mothership
310,It’s official: WHO declares Wuhan coronavirus outbreak an international emergency,https://www.mothership.sg/2020/01/emergency-who-wuhan-coronavirus/,31-01-2020 18:17:00,Mothership
311,"Scoot suspending travel to 11 China cities, SIA & SilkAir reducing capacity for flights to China",https://www.mothership.sg/2020/01/scoot-sia-silk-air-travel-to-china-update/,31-01-2020 16:51:00,Mothership
312,S’pore government to foot hospital bills for all suspected & confirmed Wuhan virus cases locally,https://www.mothership.sg/2020/01/hospital-bills-wuhan-virus-government-pay/,31-01-2020 08:40:00,Mothership
313,Facebook unable to put up POFMA correction notice as fake news posts about Woodlands MRT deleted,https://www.mothership.sg/2020/01/facebook-pofma-deleted-woodlands/,31-01-2020 06:35:00,Mothership
314,"11th, 12th & 13th cases of Wuhan virus confirmed in S’pore",https://www.mothership.sg/2020/01/new-wuhan-cases-singapore/,31-01-2020 05:00:00,Mothership
315,2 more suspected cases of Wuhan virus at West Coast Plaza & Sun Plaza,https://www.mothership.sg/2020/01/2-more-suspected-cases-of-wuhan-virus-at-west-coast-plaza-sun-plaza/,31-01-2020 04:22:00,Mothership
316,Teen with cerebral palsy in China died alone at home after his family quarantined,https://www.mothership.sg/2020/01/china-teen-dies-left-alone-family-quarantined/,31-01-2020 03:12:00,Mothership
317,S’pore immigration & customs officers at frontlines allegedly instructed not to wear masks at work,https://www.mothership.sg/2020/01/ica-face-masks/,31-01-2020 03:06:00,Mothership
318,MUIS: Muslims who are unwell or in quarantine can skip Friday prayers at a mosque,https://www.mothership.sg/2020/01/skip-friday-prayers-wuhan-virus/,31-01-2020 02:55:00,Mothership
319,Japan confirms first 2 cases of Wuhan virus without any signs of infection,https://www.mothership.sg/2020/01/japan-wuhan-virus-no-symptoms/,31-01-2020 02:17:00,Mothership
320,RWS staff allegedly told not to wear masks because of ‘VIP guest’s complaint’,https://www.mothership.sg/2020/01/wechat-rws-staff-wear-mask/,31-01-2020 01:49:00,Mothership
321,"Wuhan residents depart S’pore on Scoot flight on Jan. 29, 2020",https://www.mothership.sg/2020/01/wuhan-residents-leave-singapore-scoot/,31-01-2020 01:43:00,Mothership
322,Taeyeon & NCT Dream’s upcoming S’pore concerts indefinitely postponed due to Wuhan virus,https://www.mothership.sg/2020/01/taeyon-nct-dream-singapore-concert-cancelled/,31-01-2020 01:18:00,Mothership
323,Suspected case at Tiong Bahru baby clinic tests negative for Wuhan coronavirus,https://www.mothership.sg/2020/01/wuhan-virus-sbcc-tiong-bahru/,31-01-2020 00:43:00,Mothership
324,Wuhan virus has spread to every region in China,https://www.mothership.sg/2020/01/wuhan-coronavirus-china-tibet/,30-01-2020 23:47:00,Mothership
325,Suspected case of Wuhan virus at clinic in Bukit Panjang Hillion Mall on Jan. 29,https://www.mothership.sg/2020/01/suspected-case-bukit-panjang-hillion/,30-01-2020 22:09:00,Mothership
326,WHO reconsidering to declare Wuhan virus outbreak as global health emergency,https://www.mothership.sg/2020/01/wuhan-coronavirus-who/,30-01-2020 21:57:00,Mothership
327,S’pore govt will work with community leaders to distribute masks to S’pore’s homeless,https://www.mothership.sg/2020/01/homeless-singapore-wuhan/,30-01-2020 21:37:00,Mothership
328,Some S’poreans in Wuhan unable to fly back to S’pore because they already had symptoms,https://www.mothership.sg/2020/01/singaporeans-stuck-in-wuhan/,30-01-2020 21:22:00,Mothership
329,Govt will inspect & question scalpers who profiteer from reselling face masks,https://www.mothership.sg/2020/01/govt-scalpers-wuhan/,30-01-2020 21:12:00,Mothership
330,China pneumonia cases may be new type of virus: WHO,https://mothership.sg/2020/01/china-wuhan-pneumonia/,09-01-2020 12:50,Mothership
331,MOH: 3-year-old girl with pneumonia not linked to outbreak in Wuhan,https://mothership.sg/2020/01/first-suspect-case-wuhan-pneumonia-singapore-no-link/,06-01-2020 00:35,Mothership
332,"China reports 4 more cases of Wuhan pneumonia, researchers believe over 1,700 infected",https://mothership.sg/2020/01/china-wuhan-pneumonia-4-cases-thousands-infected/,18-01-2020 22:52,Mothership
333,"52-year-old S’pore resident suspected of Wuhan pneumonia, admitted for further assessment",https://mothership.sg/2020/01/wuhan-pneumonia-new-case-suspected/,18-01-2020 22:24,Mothership
334,Thailand confirms first case of Wuhan pneumonia virus outside China,https://mothership.sg/2020/01/thailand-wuhan-virus/,14-01-2020 17:52,Mothership
335,Wuhan pneumonia may be linked to virus that caused SARS,https://mothership.sg/2020/01/wuhan-pneumonia-link-to-sars/,12-01-2020 12:59,Mothership
336,1st case of Wuhan pneumonia coronavirus confirmed in South Korea,https://mothership.sg/2020/01/south-korea-wuhan-virus/,12-01-2020 12:59,Mothership
337,China reports first death from Wuhan pneumonia virus,https://mothership.sg/2020/01/wuhan-man-pneumonia-dies/,11-01-2020 11:34,Mothership
338,"New case of pneumonia found in S’pore: Chinese national, 26, with travel history to Wuhan",https://mothership.sg/2020/01/chinese-national-isolated-coronavirus-wuhan/,10-01-2020 19:37,Mothership
339,"Milder coronavirus infection cases possibly underreported in China, says experts",https://mothership.sg/2020/02/coronavirus-fatality-lower/,06-02-2020 11:38,Mothership
340,Coronavirus: India airports now screening passengers arriving from S’pore & Thailand,https://mothership.sg/2020/02/india-screen-singapore-passengers/,06-02-2020 08:58,Mothership
341,China’s People’s Liberation Army Air Force aerobatics team will still perform at S’pore Airshow,https://mothership.sg/2020/02/china-air-force-singapore-airshow-wuhan-virus/,06-02-2020 08:56,Mothership
342,Grand Hyatt S’pore business meeting attended by 109 people source of M’sia & South Korea coronavirus cases,https://mothership.sg/2020/02/wuhan-virus-grand-hyatt-singapore/,06-02-2020 07:45,Mothership
343,563 dead as China’s coronavirus outbreak continues to claim lives in hardest-hit regions,https://mothership.sg/2020/02/china-wuhan-virus-update-feb-6/,06-02-2020 07:16,Mothership
344,"Cases 19, 27 & 28: The first S’porean family to get coronavirus locally",https://www.mothership.sg/2020/02/singapore-family-wuhan-virus/,06-02-2020 00:20,Mothership
345,"Newborn baby in China tests positive for coronavirus, infected mother likely the cause",https://mothership.sg/2020/02/newborn-baby-china-wuhan-virus-infected-mother/,06-02-2020 00:16,Mothership
346,"4 more confirmed cases of coronavirus in S’pore, including 6-month-old child of previous cases",https://mothership.sg/2020/02/4-more-confirmed-cases-coronavirus/,05-02-2020 22:19,Mothership
347,"Lavender cluster PRC tourist group also visited T Galleria, Downtown East & Havelock Rd",https://mothership.sg/2020/02/coronavirus-lavender-tourists/,05-02-2020 22:14,Mothership
348,VivoCity quashes rumour of coronavirus infection & closure due to disinfection,https://mothership.sg/2020/02/vivocity-rumour-coronavirus/,05-02-2020 20:58,Mothership
349,Chinese game developer gives away free adult games to make people stay home during Wuhan virus outbreak,https://mothership.sg/2020/02/wuhan-virus-adult-games/,05-02-2020 20:08,Mothership
350,Restaurants in Indonesia take bat dishes off menu over coronavirus fears,https://mothership.sg/2020/02/indonesia-bat-meat-coronavirus/,05-02-2020 19:56,Mothership
351,Hong Kong to quarantine all visitors from mainland China for 14 days,https://mothership.sg/2020/02/hong-kong-quarantine-visitors-mainland-china/,05-02-2020 19:41,Mothership
352,Canadian man’s attempt to go viral with false coronavirus claim forces Jamaican-bound flight to turn back,https://mothership.sg/2020/02/canada-man-coronavirus-prank/,05-02-2020 19:40,Mothership
353,Diabetic man in S’pore can’t get alcohol swabs for insulin jabs because they’re sold out amidst virus outbreak,https://mothership.sg/2020/02/diabetic-man-alcohol-swab/,05-02-2020 19:31,Mothership
354,"M’sian father, 45, & son, 9, infected with coronavirus on Feb. 5, 2020",https://mothership.sg/2020/02/malaysia-father-son-wuhan-virus/,05-02-2020 19:13,Mothership
355,Grand Hyatt S’pore starts ‘deep cleaning measures’ after M’sian guest diagnosed with coronavirus,https://mothership.sg/2020/02/grand-hyatt-singapore-cleaning-coronavirus/,05-02-2020 17:53,Mothership
356,NEA lists disinfectants & cleaning products effective against novel coronavirus,https://mothership.sg/2020/02/nea-coronavirus-cleaning-products-effective/,05-02-2020 17:16,Mothership
357,"Cathay Pacific asks 27,000 staff to take 3 weeks’ unpaid leave in wake of coronavirus outbreak",https://mothership.sg/2020/02/coronavirus-cathay-pacific-unpaid-leave/,05-02-2020 16:43,Mothership
358,Cambodian PM cancels ‘moral support’ visit to 23 Cambodian students in Wuhan,https://mothership.sg/2020/02/cambodia-hun-sen-wuhan-students/,05-02-2020 16:41,Mothership
359,2 S’poreans set up initiative for people to donate free masks & sanitisers to others in need,https://mothership.sg/2020/02/free-mask-sanitiser-giveaway/,05-02-2020 16:31,Mothership
360,S’pore couple on leave of absence attends their own hotel wedding banquet via livestream,https://mothership.sg/2020/02/couple-loa-wedding-livestream/,05-02-2020 16:13,Mothership
361,China’s leadership admits ‘shortcomings & deficiencies’ in initial response to coronavirus outbreak,https://mothership.sg/2020/02/china-wuhan-virus-response-inadequate/,05-02-2020 15:09,Mothership
362,Ningxia Night Market in Sentosa sees sparse crowd due to Wuhan virus outbreak,https://mothership.sg/2020/02/ningxia-night-market-virus-outbreak/,05-02-2020 13:41,Mothership
363,"Beijing streets empty & stores shuttered, video by American residing in China shows",https://mothership.sg/2020/02/china-beijing-empty-wuhan-virus/,05-02-2020 13:37,Mothership
364,4-year-old girl with coronavirus in M’sia first to recover there & will go back to China,https://mothership.sg/2020/02/china-girl-4-wuhan-virus-malaysia-recovered/,05-02-2020 13:13,Mothership
365,"Coronavirus patient, 69, in China, came in close contact with over 100 people & hid travel history",https://mothership.sg/2020/02/china-man-69-wuhan-virus-contact-100/,05-02-2020 13:00,Mothership
366,South Korean man gets Wuhan virus after meeting infected M’sian at Grand Hyatt S’pore,https://mothership.sg/2020/02/south-korea-new-cases-infected-singapore/,05-02-2020 12:52,Mothership
367,MOH: 500 to 600 pneumonia patients to be tested for Wuhan virus every week,https://mothership.sg/2020/02/pneumonia-patients-tested-for-coronavirus-moh/,05-02-2020 12:00,Mothership
368,"28-year-old medical staff in China dies, allegedly after working 10 days straight battling Wuhan virus",https://mothership.sg/2020/02/doctor-overwork-die-wuhan-virus-song-yingjie/,05-02-2020 11:40,Mothership
369,"China’s novel coronavirus death toll rises to 490, confirmed infections hit 24,324",https://mothership.sg/2020/02/china-wuhan-virus-update-feb-5/,05-02-2020 11:33,Mothership
370,South Koreans who hoard masks during Wuhan virus outbreak can be jailed 2 years,https://mothership.sg/2020/02/south-korea-face-masks-jail/,05-02-2020 01:23,Mothership
371,"S’porean man & Vietnamese wife give out 17,000 free masks outside Punggol MRT",https://mothership.sg/2020/02/give-free-mask-punggol/,05-02-2020 00:07,Mothership
372,"S’pore donating S$1 million, medical supplies & test kits to China for Wuhan virus fight",https://mothership.sg/2020/02/singapore-donates-1-million-to-china/,04-02-2020 23:54,Mothership
373,"First M’sian diagnosed with Wuhan virus had visited Grand Hyatt S’pore, stayed here for 1 week",https://mothership.sg/2020/02/malaysian-wuhan-virus-grand-hyatt/,04-02-2020 23:34,Mothership
374,Wuhan Red Cross slammed for failing to deliver supplies to hospitals that urgently need them,https://mothership.sg/2020/02/china-wuhan-red-cross/,04-02-2020 23:13,Mothership
375,Timeline of Chinese tour group that infected tour guide & Lavender shopkeepers,https://mothership.sg/2020/02/chinese-tour-group-wuhan-timeline/,04-02-2020 19:29,Mothership
376,MOE cancels flag-raising ceremony & other group activities to prevent Wuhan virus spread,https://mothership.sg/2020/02/moe-schools-wuhan-virus/,04-02-2020 19:11,Mothership
377,Lavender cluster of Wuhan virus not widespread transmission: MOH Chief Health Scientist,https://mothership.sg/2020/02/lavender-wuhan-virus-spread/,04-02-2020 18:57,Mothership
378,4 Thai citizens among 6 new cases of Wuhan virus reported in Thailand,https://mothership.sg/2020/02/thailand-wuhan-cases-4-thais/,04-02-2020 18:36,Mothership
379,4 in S’pore infected with Wuhan virus due to Chinese tourist stop in Lavender,https://mothership.sg/2020/02/wuhan-virus-local-spread/,04-02-2020 18:01,Mothership
380,"Wuhan man, 35, first patient in S’pore to be cleared of Wuhan virus",https://mothership.sg/2020/02/wuhan-patient-discharge/,04-02-2020 18:00,Mothership
381,"Wuhan virus: 4 cases of human-to-human transmission in S’pore, 6 new cases in total",https://mothership.sg/2020/02/wuhan-virus-singapore-local-transmission/,04-02-2020 18:00,Mothership
382,"China says it urgently needs medical supplies, masks & protective suits to tackle Wuhan virus",https://mothership.sg/2020/02/china-needs-masks-medical-supplies-wuhan-virus/,04-02-2020 17:13,Mothership
383,Healthcare workers in Wuhan reveal cuts & marks on faces from wearing masks,https://mothership.sg/2020/02/healthcare-workers-wuhan-virus-face-mask-cuts/,04-02-2020 16:46,Mothership
384,First M’sian to test positive for Wuhan virus is Selangor man,https://mothership.sg/2020/02/malaysian-wuhan-virus-first/,04-02-2020 15:41,Mothership
385,"South Korean woman, 42, tests positive for coronavirus after visiting Thailand",https://mothership.sg/2020/02/south-korea-16th-case-coronavirus/,04-02-2020 15:21,Mothership
386,Macau suspends casino operations for two weeks to curb spread of Wuhan virus,https://mothership.sg/2020/02/macau-suspends-casinos-two-weeks/,04-02-2020 14:55,Mothership
387,"Japan quarantines 3,700 onboard cruise ship over Wuhan virus",https://mothership.sg/2020/02/japan-quarantines-cruise-ship-wuhan-virus/,04-02-2020 13:41,Mothership
388,"Indonesian evacuees from Wuhan, China sprayed with ‘alcohol’ mist upon disembarking in Batam",https://mothership.sg/2020/02/indonesian-wuhan-virus-spray/,04-02-2020 12:59,Mothership
389,NATAS travel fair postponed from Feb. to May 2020 due to Wuhan virus outbreak,https://mothership.sg/2020/02/natas-travel-fair-wuhan-virus/,04-02-2020 12:26,Mothership
390,S’pore govt: No need for landlords to evict tenants serving quarantine orders or leave of absence,https://mothership.sg/2020/02/evict-wuhan-virus-tenants-quarantine-leave-of-absence/,04-02-2020 11:56,Mothership
391,Wuhan lady pens moving post about what Wuhan was like before virus outbreak,https://mothership.sg/2020/02/what-wuhan-looks-like-before-virus/,04-02-2020 11:28,Mothership
392,"Hong Kong confirms first death from Wuhan virus, second reported death outside mainland China",https://mothership.sg/2020/02/hong-kong-first-death-wuhan-virus/,04-02-2020 11:09,Mothership
393,Ong Ye Kung visits NTU & NUS students on leave of absence,https://mothership.sg/2020/02/ong-ye-kung-visits-loa-students-ntu-nus/,04-02-2020 10:48,Mothership
394,"China’s Wuhan virus death toll rises to 425, confirmed infections hit 20,438",https://mothership.sg/2020/02/wuhan-virus-deaths-feb-4/,04-02-2020 09:41,Mothership
395,"Kind neighbours in Punggol leave hand sanitisers, masks & alcohol swabs in lifts for public use",https://mothership.sg/2020/02/neighbours-donate-hand-sanitiser-mask-lift-punggol/,04-02-2020 00:49,Mothership
396,Wuhan volunteers spend 6 days helping owners rescue more than 300 pets left alone in their homes,https://www.mothership.sg/2020/02/wuhan-virus-pets-rescue/,03-02-2020 20:24,Mothership
397,"Run For Hope postponed to Aug. 16, 2020 due to Wuhan virus outbreak",https://www.mothership.sg/2020/02/run-for-hope-postponed-wuhan-virus/,03-02-2020 20:12,Mothership
398,No new Wuhan virus cases identified in S’pore for 2nd day in a row,https://mothership.sg/2020/02/wuhan-new-cases-in-singapore/,03-02-2020 19:43,Mothership
399,"140 S’poreans still believed to be in Wuhan, govt working with China to help them: Lawrence Wong",https://mothership.sg/2020/02/140-singaporeans-wuhan/,03-02-2020 19:05,Mothership
400,Wuhan virus: Food becomes a challenge for Wuhan residents facing city lockdown,https://mothership.sg/2020/02/wuhan-lockdown-food/,03-02-2020 18:45,Mothership
401,Carouseller selling S’pore govt-issued surgical masks for S$1 each,https://mothership.sg/2020/02/government-masks-carousell/,03-02-2020 18:33,Mothership
402,"NUS & NTU students deliver food to students on leave of absence 3 times a day, every day",https://mothership.sg/2020/02/nus-ntu-students-deliver-food-wuhan-virus/,03-02-2020 18:05,Mothership
403,Masks not mailed out to S’pore households to prevent wastage: Lawrence Wong,https://mothership.sg/2020/02/masks-distribution-wuhan-virus/,03-02-2020 18:00,Mothership
404,"China builds Wuhan virus hospital in 10 days, which state media said would normally take 2 years",https://mothership.sg/2020/02/wuhan-virus-hospital/,03-02-2020 17:35,Mothership
405,"Govt to check on quarantined individuals through video & phone calls, spot checks",https://mothership.sg/2020/02/quarantine-leave-of-absence-lawrence-wong/,03-02-2020 17:35,Mothership
406,Chinese media highlights PM Lee’s remarks voicing support for efforts in combating Wuhan virus,https://mothership.sg/2020/02/china-praises-pm-lee-wuhan-virus-comments/,03-02-2020 17:08,Mothership
407,"800,000 out of 5.2 million free masks collected since Feb. 1",https://mothership.sg/2020/02/free-mask-collection-15-percent/,03-02-2020 17:00,Mothership
408,Guangzhou scientists discover Wuhan virus on door handle at patient’s house,https://mothership.sg/2020/02/wuhan-virus-door-handle/,03-02-2020 16:52,Mothership
