index,headline,source_url,publish_date,publisher,crawl_type
401,S’poreans mildly at risk of throwing 36 years of Total Defence lessons out the window,https://www.mothership.sg/2020/02/total-defence-wuhan-virus/,09/02/2020 06:35,Mothership.sg,auto
402,"GrabShare to suspend temporarily from tonight (Feb. 9, 1am)",https://www.mothership.sg/2020/02/grabshare-suspend-coronavirus/,09/02/2020 07:19,Mothership.sg,auto
403,Coronavirus: 4 patients in critical condition & 1 requires oxygen support,https://www.mothership.sg/2020/02/singapore-coronavirus-4-icu/,09/02/2020 07:27,Mothership.sg,auto
404,"Coronavirus: 7 more confirmed cases in S’pore, 3 possible clusters identified",https://www.mothership.sg/2020/02/coronavirus-confirmed-cases/,09/02/2020 07:30,Mothership.sg,auto
405,Taxi driver & private hire driver among 7 new coronavirus cases in S’pore on Feb. 8,https://www.mothership.sg/2020/02/taxi-driver-coronavirus/,09/02/2020 07:37,Mothership.sg,auto
406,"5 nCoV cases linked to Life Church & Missions S’pore, church services stopped from Feb. 8",https://www.mothership.sg/2020/02/life-church-missions-coronavirus/,09/02/2020 08:12,Mothership.sg,auto
407,Tan Tock Seng Hospital pays tribute to its unsung heroes working tirelessly to fight novel coronavirus,https://www.mothership.sg/2020/02/ttsh-tribute-wuhan-virus/,09/02/2020 12:39,Mothership.sg,auto
408,Nee Soon GRC MP Louis Ng reports Sembawang retailer to MTI for selling 20 masks for S$138,https://www.mothership.sg/2020/02/louis-ng-masks/,09/02/2020 13:49,Mothership.sg,auto
409,China to investigate rumour-monger turned whistle-blower doctor’s death after nationwide outcry,https://www.mothership.sg/2020/02/china-li-wen-liang-death-investigate/,09/02/2020 17:53,Mothership.sg,auto
410,"5 Britons contract coronavirus in French Ski resort, linked to man who attended Grand Hyatt meeting",https://www.mothership.sg/2020/02/uk-nationals-french-resort-coronavirus/,09/02/2020 19:23,Mothership.sg,auto
411,"Global death toll for novel coronavirus reaches over 800, set to exceed SARS",https://www.mothership.sg/2020/02/coronavirus-death-toll-more-than-sars/,09/02/2020 19:39,Mothership.sg,auto
412,S’porean dad & daughters thank doctors & nurses with simple act of buying them breakfast,https://www.mothership.sg/2020/02/dad-daughters-buy-breakfast-doctors-nurses/,09/02/2020 19:59,Mothership.sg,auto
413,"From airport to NCID, S’porean describes what it was like being an almost-suspect coronavirus case",https://www.mothership.sg/2020/02/suspect-coronavirus-case-testing-process-spore/,09/02/2020 20:08,Mothership.sg,auto
414,"Psychology behind panic buying in S’pore supermarkets, explained",https://www.mothership.sg/2020/02/psychology-panic-buying/,09/02/2020 20:26,Mothership.sg,auto
415,"NTUC Fairprice placing limits for amount of rice, instant noodles & toilet paper each shopper can buy",https://www.mothership.sg/2020/02/ntuc-fairprice-limits-rice-instant-noodles-toilet-paper/,09/02/2020 21:02,Mothership.sg,auto
416,"MFA: 174 S’poreans return from Wuhan on Feb. 9, 2020 via Scoot flight",https://www.mothership.sg/2020/02/174-singaporeans-return-from-wuhan/,09/02/2020 21:20,Mothership.sg,auto
417,Thousands of South Korean couples tie the knot in mass wedding amidst coronavirus outbreak,https://www.mothership.sg/2020/02/south-korea-mass-wedding-coronavirus/,09/02/2020 21:46,Mothership.sg,auto
418,A side-by-side comparison of how Hong Kong & S’pore have handled the coronavirus outbreak so far,https://www.mothership.sg/2020/02/hong-kong-singapore-coronavirus-comparison/,09/02/2020 23:52,Mothership.sg,auto
419,MAS asks financial institutions to adopt extra measures for DORSCON Orange,https://www.mothership.sg/2020/02/mas-dorscon-orange-financial-institutions-measures/,10/02/2020 00:17,Mothership.sg,auto
420,Pritam Singh & Edwin Tong clash over merits of POFMA at NTU Forum on fake news,https://www.mothership.sg/2020/02/pritam-singh-edwin-tong-pofma/,10/02/2020 01:17,Mothership.sg,auto
421,No delivery slots left for online grocery shopping service RedMart until Feb 15,https://www.mothership.sg/2020/02/redmart-no-delivery-slots/,10/02/2020 02:16,Mothership.sg,auto
422,Chan Chun Sing: S’poreans who hoard supplies or ‘behave inappropriately’ undermine our international reputation,https://www.mothership.sg/2020/02/chan-chun-sing-singaporeans-hoarding/,10/02/2020 03:49,Mothership.sg,auto
423,"M’sia confirms 17th case of coronavirus, woman related to patient who went to Grand Hyatt S’pore",https://www.mothership.sg/2020/02/malaysia-coronavirus-grand-hyatt/,10/02/2020 04:23,Mothership.sg,auto
424,"Coronavirus: 3 more confirmed cases in S’pore, one’s a Bangladesh national",https://www.mothership.sg/2020/02/coronavirus-confirmed-cases-43/,10/02/2020 05:53,Mothership.sg,auto
425,"Coronavirus: 1st S’porean to recover, with 4 more patients discharged",https://www.mothership.sg/2020/02/coronavirus-4-more-patients-discharged-in-spore-6-fully-recovered-in-total/,10/02/2020 05:59,Mothership.sg,auto
426,Coronavirus: Bangladeshi worker who visited Mustafa among new cases on Feb. 9,https://www.mothership.sg/2020/02/coronavirus-bangladesh-worker-mustafa/,10/02/2020 06:12,Mothership.sg,auto
427,"Coronavirus: 6 patients in critical condition, an increase of 2 from Feb. 8",https://www.mothership.sg/2020/02/coronavirus-6-patients-critical-condition/,10/02/2020 06:21,Mothership.sg,auto
428,Confirmed case at Marina Bay Financial Centre is a S’porean with no recent travel history to China,https://www.mothership.sg/2020/02/marina-bay-financial-centre-coronavirus/,10/02/2020 07:31,Mothership.sg,auto
429,Coronavirus: MOM revokes 4 work passes & suspends privileges of 6 employers for breaching LOA,https://www.mothership.sg/2020/02/mom-revoke-work-pass-coronavirus/,10/02/2020 08:04,Mothership.sg,auto
430,Kuwait the first country to advise its citizens not to travel to S’pore,https://www.mothership.sg/2020/02/kuwait-singapore-coronavirus/,10/02/2020 08:34,Mothership.sg,auto
431,Coronavirus: Kyoto’s tourist attractions see significant drop in visitors,https://www.mothership.sg/2020/02/kyoto-wuhan-virus-empty/,10/02/2020 19:39,Mothership.sg,auto
432,China coronavirus death toll hits 908,https://www.mothership.sg/2020/02/wuhan-virus-death-feb-10/,10/02/2020 19:45,Mothership.sg,auto
433,Long queues for early morning temperature checks at Suntec & Raffles Place office buildings,https://www.mothership.sg/2020/02/long-queues-temperature-check-suntec/,10/02/2020 20:40,Mothership.sg,auto
434,Coronavirus: ‘Normal’ mask-buying crowd at Mustafa even after visit from confirmed case,https://www.mothership.sg/2020/02/mustafa-crowd-coronavirus/,10/02/2020 20:44,Mothership.sg,auto
435,Qatar advises citizens to reconsider travelling to S’pore due to coronavirus outbreak,https://www.mothership.sg/2020/02/qatar-singapore-travel-advisory-coronavirus/,10/02/2020 21:03,Mothership.sg,auto
436,Chinese officials make conflicting public statements on whether coronavirus can be spread by air,https://www.mothership.sg/2020/02/aerosol-transmission-coronavirus/,10/02/2020 21:05,Mothership.sg,auto
437,Taiwanese TV show cuts kissing scene out of fear of spreading coronavirus,https://www.mothership.sg/2020/02/taiwan-tv-ban-kissing-coronavirus/,10/02/2020 21:55,Mothership.sg,auto
438,Tampines GRC MP Cheng Li Hui explains why she wore mask during house visit when she’s well,https://www.mothership.sg/2020/02/cheng-li-hui-coronavirus/,10/02/2020 22:15,Mothership.sg,auto
439,"Coronavirus: 66 new cases on Japanese cruise ship, 136 in total",https://www.mothership.sg/2020/02/diamond-princess-coronavirus-130-cases/,10/02/2020 22:43,Mothership.sg,auto
440,M’sia’s 18th coronavirus infection case is citizen who travelled to mainland China,https://www.mothership.sg/2020/02/malaysia-18-case-coronavirus/,10/02/2020 23:14,Mothership.sg,auto
441,"S’pore govt to give 300,000 masks to taxi & PHC drivers for sick passengers, start temperature-taking",https://www.mothership.sg/2020/02/300000-masks-for-taxi-phv-drivers/,11/02/2020 00:00,Mothership.sg,auto
442,Global Times claims ‘overseas anti-China groups’ incited ‘public sorrow’ in China over whistleblower doctor’s death,https://www.mothership.sg/2020/02/china-global-times-li-wenliang-whistleblower-doctor/,11/02/2020 00:12,Mothership.sg,auto
443,Hubei province in China reports a fatality rate of almost 3% for patients with the coronavirus,https://www.mothership.sg/2020/02/coronavirus-fatality-rate-wuhan-second/,11/02/2020 00:52,Mothership.sg,auto
444,Hong Kong actress Florence Kwok goes all-out on protective gear during flight to M’sia,https://www.mothership.sg/2020/02/florence-kwok-coronavirus/,11/02/2020 00:55,Mothership.sg,auto
445,9 family members in Hong Kong infected with coronavirus after sharing hot pot & BBQ,https://www.mothership.sg/2020/02/hong-kong-family-hot-pot-coronavirus/,11/02/2020 01:08,Mothership.sg,auto
446,Over 180 SPF officers deployed to ensure security at govt quarantine facilities islandwide,https://www.mothership.sg/2020/02/180-police-officers-government-quarantine-facilities-coronavirus/,11/02/2020 01:21,Mothership.sg,auto
447,Coronavirus: NUS student suspended for attending lectures during Leave of Absence,https://www.mothership.sg/2020/02/nus-student-loa-suspension/,11/02/2020 01:36,Mothership.sg,auto
448,"M’sia durian prices fall by 50% as China demand dries up, supplies could flood S’pore market",https://www.mothership.sg/2020/02/durian-cheaper-wuhan-virus/,11/02/2020 01:55,Mothership.sg,auto
449,S’pore lady spots more than 5 discarded used masks in 5 minutes near Tan Tock Seng,https://www.mothership.sg/2020/02/anyhow-throw-mask/,11/02/2020 02:07,Mothership.sg,auto
450,Turn off air-con & stand in the sun touted as good steps to take to not catch coronavirus in S’pore,https://www.mothership.sg/2020/02/air-con-coronavirus/,11/02/2020 02:38,Mothership.sg,auto
451,"Coronavirus: 2 more cases in S’pore, including 2-year-old girl & man on duty during Chingay",https://www.mothership.sg/2020/02/coronavirus-update-february-10/,11/02/2020 04:21,Mothership.sg,auto
452,37-year-old S’porean Certis Cisco employee on duty at Chingay among new cases on Feb. 10,https://www.mothership.sg/2020/02/chingay-coronavirus/,11/02/2020 04:34,Mothership.sg,auto
453,No evidence of airborne transmission of coronavirus: MOH,https://www.mothership.sg/2020/02/no-evidence-wuhan-virus-airborne/,11/02/2020 04:37,Mothership.sg,auto
454,"SIM & SUSS begin temperature screening on campus from Feb. 10, 2020",https://www.mothership.sg/2020/02/sim-suss-temperature-screening-coronavirus/,11/02/2020 05:09,Mothership.sg,auto
455,"Over S$10,000 raised in a day to provide 205 needy S’pore families with daily necessities",https://www.mothership.sg/2020/02/goodie-bag-needy-10k/,11/02/2020 05:10,Mothership.sg,auto
456,NTUC FairPrice working with authorities over students who ‘sampled’ juice and put it back on shelf,https://www.mothership.sg/2020/02/fairprice-responds-juice-sampling/,11/02/2020 05:28,Mothership.sg,auto
457,Antarctica records highest-ever temperature of 18.3°C,https://www.mothership.sg/2020/02/antarctica-highest-ever-temperature-2020/,11/02/2020 08:44,Mothership.sg,auto
458,S’porean nurse relates how she was ostracised for being in uniform & taking the lift to go to work,https://www.mothership.sg/2020/02/nurse-scolded-uniform-wuhan-virus/,11/02/2020 09:16,Mothership.sg,auto
459,"Xi Jinping appears in public after notable absence, lauds Wuhan as ‘a city of heroes’",https://www.mothership.sg/2020/02/china-xi-jinping-coronavirus-beijing/,11/02/2020 10:24,Mothership.sg,auto
460,STB to set up joint task force to combat ‘biggest challenge since SARS’,https://www.mothership.sg/2020/02/stb-2019-tarc-china/,11/02/2020 18:30,Mothership.sg,auto
461,"25-30% drop in tourists expected for 2020, China accounts for 20% of visitor arrivals: STB CEO",https://www.mothership.sg/2020/02/coronavirus-tourism-impact-singapore/,11/02/2020 18:34,Mothership.sg,auto
462,"S’pore saw record number of tourist arrivals from China, the US & Indonesia in 2019",https://www.mothership.sg/2020/02/stb-tourist-numbers-2019/,11/02/2020 18:57,Mothership.sg,auto
463,MTI asking retailer 3 Stars to explain high prices of masks following public complaints,https://www.mothership.sg/2020/02/3-star-mask-sanitiser/,11/02/2020 18:59,Mothership.sg,auto
464,Sarawak imposes immediate 14-day ‘self-quarantine’ for arrivals from S’pore; S’poreans to observe precautions.,https://www.mothership.sg/2020/02/sarawak-quarantine-singaporeans/,11/02/2020 19:10,Mothership.sg,auto
465,"Coronavirus: Over 40,000 confirmed cases, 4,000 discharged & 1,000 deaths reported in China on Feb. 11",https://www.mothership.sg/2020/02/death-toll-passes-1000-china/,11/02/2020 20:15,Mothership.sg,auto
466,Tan Tock Seng Hospital staff shares sacrifice & struggles of working on the frontlines,https://www.mothership.sg/2020/02/tan-tock-seng-hospital-frontline-worker-struggles/,11/02/2020 21:20,Mothership.sg,auto
467,House of Seafood Punggol now giving free masks to members after previously selling 1 box for S$21.40,https://www.mothership.sg/2020/02/house-of-seafood-punggol-give-masks/,11/02/2020 21:50,Mothership.sg,auto
468,"Chinese citizen journalist in Wuhan missing for 5 days, allegedly forcibly quarantined by authorities",https://www.mothership.sg/2020/02/chen-qiushi-forcibly-quarantined/,11/02/2020 22:20,Mothership.sg,auto
469,Coronavirus: How CID officers figured out link between 3 seemingly unrelated cases in just 1 day,https://www.mothership.sg/2020/02/cid-coronavirus/,11/02/2020 23:05,Mothership.sg,auto
470,S’pore Facebook group calls for volunteer motorists to ferry healthcare workers to & from work,https://www.mothership.sg/2020/02/everyday-heroes-sg-volunteer-motorist-ferry-nurse/,11/02/2020 23:21,Mothership.sg,auto
471,Scientists in S’pore aim to develop a trial for a coronavirus vaccine in as little as 4 months,https://www.mothership.sg/2020/02/scientists-singapore-coronavirus-vaccine/,11/02/2020 23:39,Mothership.sg,auto
472,"6 HK bank management trainees went hiking, put it on Instagram when they supposed to be working from home",https://www.mothership.sg/2020/02/bank-management-trainees-hiking-work-from-home/,12/02/2020 00:28,Mothership.sg,auto
473,S’pore police looking into video of youth sipping drink in FairPrice supermarket & putting it back,https://www.mothership.sg/2020/02/fairprice-drink-prank/,12/02/2020 00:45,Mothership.sg,auto
474,Cleaners working hard islandwide as S’pore steps up public spaces cleaning,https://www.mothership.sg/2020/02/singapore-cleaners-work-hard-coronavirus/,12/02/2020 01:05,Mothership.sg,auto
475,"S’pore nurses allowed to wear uniform in public, explained",https://www.mothership.sg/2020/02/nurses-singapore-uniform/,12/02/2020 01:33,Mothership.sg,auto
476,"SAF deferring non-essential, large scale social activities but no plans to cancel ICT & BMT Graduation Parade",https://www.mothership.sg/2020/02/saf-camp-coronavirus-measures-ict/,12/02/2020 02:00,Mothership.sg,auto
477,Israel & South Korea advise citizens not to travel to S’pore due to coronavirus outbreak,https://www.mothership.sg/2020/02/israel-south-korea-coronavirus/,12/02/2020 02:16,Mothership.sg,auto
478,PM Lee praised by foreign media for helping to allay fears amid coronavirus outbreak,https://www.mothership.sg/2020/02/pm-lee-coronavirus-response-speech-praised/,12/02/2020 02:29,Mothership.sg,auto
479,S’porean captures spectacular shot of rainbow arcing across Tanjong Rhu,https://www.mothership.sg/2020/02/rainbow-tanjong-rhu/,12/02/2020 02:42,Mothership.sg,auto
480,"Waiter talks about life aboard cruise ship with 3,700 quarantined passengers, working 13-hour days",https://www.mothership.sg/2020/02/quarantine-ship-how/,12/02/2020 03:10,Mothership.sg,auto
481,STB Chief: No reason for other countries to impose travel advisory on S’pore,https://www.mothership.sg/2020/02/stb-chief-travel-advisory/,12/02/2020 03:30,Mothership.sg,auto
482,"Coronavirus: 2 more confirmed cases in S’pore, including another Bangladesh National",https://www.mothership.sg/2020/02/singapore-coronavirus-update/,12/02/2020 04:06,Mothership.sg,auto
483,Coronavirus: 35-year-old S’pore PR who works at RWS Casino & lives in JB among 2 new cases,https://www.mothership.sg/2020/02/rws-wuhan-virus/,12/02/2020 04:21,Mothership.sg,auto
484,S’pore coronavirus patient who attended Grand Hyatt meeting discharged just 4 days after confirmation of infection,https://www.mothership.sg/2020/02/discharged-patient/,12/02/2020 04:46,Mothership.sg,auto
485,Coronavirus: 2nd Bangladeshi case worked at same location as 1st Bangladeshi case,https://www.mothership.sg/2020/02/coronavirus-bangladesh-seletar/,12/02/2020 04:57,Mothership.sg,auto
486,"Chinese military planes enter Taiwan airspace, foreign minister quips they are ‘useless’ against coronavirus",https://www.mothership.sg/2020/02/china-taiwan-jets-intrusion/,12/02/2020 06:24,Mothership.sg,auto
487,China’s Coronavirus epidemic may peak in mid to late Feb. before plateauing & easing,https://www.mothership.sg/2020/02/china-coronavirus-epidemic-peak/,12/02/2020 07:00,Mothership.sg,auto
488,"SMRT distributed over 1,400 care packages of masks, hand sanitiser & disinfectant to taxi partners",https://www.mothership.sg/2020/02/smrt-care-package-coronavirus/,12/02/2020 07:20,Mothership.sg,auto
489,Novel coronavirus named ‘Covid-19’: World Health Organisation,https://www.mothership.sg/2020/02/covid-19/,12/02/2020 08:00,Mothership.sg,auto
490,Coronavirus: 2 Bangladeshi cases worked at Bombardier’s S’pore Service Centre expansion site,https://www.mothership.sg/2020/02/bombardier-singapore-coronavirus/,12/02/2020 08:07,Mothership.sg,auto
491,"Campaign to buy coffee for S’pore healthcare workers raises over S$13,000 in 1 day",https://www.mothership.sg/2020/02/free-coffee-for-healthcare-workers/,12/02/2020 08:13,Mothership.sg,auto
492,Coronavirus: 2 new cases in Japan both initially tested negative,https://www.mothership.sg/2020/02/japan-coronavirus-tested-negative/,12/02/2020 08:40,Mothership.sg,auto
493,Nas Daily makes 3.5-minute video assuring his mother & your mothers that S’pore will defeat Covid-19,https://www.mothership.sg/2020/02/nas-daily-coronavirus-singapore/,12/02/2020 08:57,Mothership.sg,auto
494,Ubi clinic clarifies notice asking Covid-19 suspect cases to stay away is a misunderstanding,https://www.mothership.sg/2020/02/ubi-clinic-coronavirus/,12/02/2020 09:08,Mothership.sg,auto
495,NEA warns of outbreak of DenV-3 strain of dengue not dominant in S’pore in last 30 years,https://www.mothership.sg/2020/02/dengue-outbreak-singapore/,12/02/2020 09:46,Mothership.sg,auto
496,"Working nearly 14 hours a day, 7 days a week: How MOH tracks down potential coronavirus cases",https://www.mothership.sg/2020/02/contact-tracing-how-long/,12/02/2020 19:18,Mothership.sg,auto
497,"Man, 26, turns hostile at medical staff during check up & punches police officers at Sengkang General Hospital",https://www.mothership.sg/2020/02/man-abuse-public-servants-sengkang-hospital/,12/02/2020 20:04,Mothership.sg,auto
498,HK restaurants remove hotpot from menu after coronavirus infections,https://www.mothership.sg/2020/02/hk-restaurants-remove-hotpot-coronavirus/,12/02/2020 20:55,Mothership.sg,auto
499,About 500 hospital staff in Wuhan affected by novel coronavirus,https://www.mothership.sg/2020/02/hospital-staff-infected-wuhan/,12/02/2020 21:12,Mothership.sg,auto
500,"Indonesia has 0 coronavirus cases, but people still rushing to buy S$150 box of n95 masks",https://www.mothership.sg/2020/02/indonesia-n95-masks-coronavirus/,12/02/2020 22:19,Mothership.sg,auto
501,"Passengers on quarantined cruise ship in Japan get daily meal service, next-day Amazon delivery",https://www.mothership.sg/2020/02/diamond-princess-one-week/,12/02/2020 22:33,Mothership.sg,auto
502,Hashtags related to coronavirus on Instagram direct you to MOH’s website,https://www.mothership.sg/2020/02/coronavirus-instagram-hashtag/,12/02/2020 22:51,Mothership.sg,auto
503,"New coronavirus patient confirmed, 300 people evacuated from Marina Bay Financial Centre",https://www.mothership.sg/2020/02/mbfc-coronavirus-case/,12/02/2020 23:02,Mothership.sg,auto
504,"SCDF paramedics wear protective equipment for all calls, not just potential coronavirus cases",https://www.mothership.sg/2020/02/scdf-always-wear-protective-outfits/,12/02/2020 23:30,Mothership.sg,auto
505,"Nurse in S’pore allegedly kicked off bus for carrying uniform home in plastic bag to wash, her sister fumes",https://www.mothership.sg/2020/02/nurse-kicked-off-bus-uniform/,13/02/2020 00:00,Mothership.sg,auto
506,SingPost suspends shipments to China indefinitely due to coronavirus outbreak,https://www.mothership.sg/2020/02/china-mail-suspended-singpost/,13/02/2020 01:41,Mothership.sg,auto
507,S’pore MOH’s 2013 Facebook post viral again in 2020: ‘Nursing is not a job that just anybody can do’,https://www.mothership.sg/2020/02/ministry-of-health-facebook-post-nurse/,13/02/2020 02:11,Mothership.sg,auto
508,"2,000 Grab drivers volunteer to ferry S’pore healthcare workers to & from hospitals",https://www.mothership.sg/2020/02/2000-grab-drivers-grabcare/,13/02/2020 02:18,Mothership.sg,auto
509,"Coronavirus: 3 more confirmed cases in S’pore, 2 linked to Grace Assembly of God church",https://www.mothership.sg/2020/02/coronavirus-50-confirmed-cases/,13/02/2020 02:40,Mothership.sg,auto
510,"Police identify 2 youths, aged 17, in FairPrice supermarket sipping drinks & putting them back",https://www.mothership.sg/2020/02/fairprice-sip-drinks-police/,13/02/2020 02:40,Mothership.sg,auto
511,"6 more S’pore coronavirus patients discharged, 6-month-old baby “well”",https://www.mothership.sg/2020/02/recovered-coronavirus-patients/,13/02/2020 02:46,Mothership.sg,auto
512,"1 million masks to be set aside for frontline medical workers, even private doctors: Gan Kim Yong",https://www.mothership.sg/2020/02/1-million-masks-private-doctors/,13/02/2020 02:52,Mothership.sg,auto
513,"Medical practitioners issue signed letter asking people to wear masks when leaving home, MOH responds",https://www.mothership.sg/2020/02/medical-health-advisory/,13/02/2020 03:21,Mothership.sg,auto
514,‘Disgraceful’ to discriminate healthcare workers over fears of coronavirus: Amrin Amin,https://www.mothership.sg/2020/02/amrin-amin-nurses-discrimination/,13/02/2020 03:29,Mothership.sg,auto
515,Indonesians travelling from S’pore to Indonesia won’t be refused entry,https://www.mothership.sg/2020/02/indonesia-singapore-coronavirus/,13/02/2020 03:46,Mothership.sg,auto
516,S’poreans write letters of encouragement to front line healthcare workers,https://www.mothership.sg/2020/02/letters-to-healthcare-workers-compilation/,13/02/2020 03:53,Mothership.sg,auto
517,China puts up banners with hilarious threats to remind people to wear face masks,https://www.mothership.sg/2020/02/china-slogans-coronavirus-masks/,13/02/2020 04:00,Mothership.sg,auto
518,Coronavirus: Cleaning your phone might be one of the best ways to protect yourself more,https://www.mothership.sg/2020/02/phones-wuhan-virus-germs/,13/02/2020 04:27,Mothership.sg,auto
519,21 out of 50 coronavirus patients in S’pore linked to these 5 clusters,https://www.mothership.sg/2020/02/singapore-coronavirus-5-clusters/,13/02/2020 04:58,Mothership.sg,auto
520,Man in India allegedly commits suicide after believing he had coronavirus infection,https://www.mothership.sg/2020/02/india-coronavirus-suicide/,13/02/2020 05:19,Mothership.sg,auto
521,RWS: Casino employee did not serve VIP guests from Wuhan prior to coronavirus infection,https://www.mothership.sg/2020/02/rws-casino-employee-35-served-vip-guests-from-wuhan-prior-to-novel-coronavirus-infection/,13/02/2020 06:05,Mothership.sg,auto
522,Wuhan evacuees throw face masks in the air to celebrate end of 14-day quarantine,https://www.mothership.sg/2020/02/throw-face-masks-coronavirus/,13/02/2020 06:57,Mothership.sg,auto
523,"Patient observes professionalism of TTSH medical staff, says they inspire & bring out best in her",https://www.mothership.sg/2020/02/ttsh-medical-staff-professional-tribute/,13/02/2020 07:20,Mothership.sg,auto
