index,headline,source_url,publish_date,publisher,crawl_type
0,"MOH warns pneumonia outbreak in Wuhan, temperature checks to be implemented at Changi Airport from Jan. 3, 2020",https://www.mothership.sg/2020/01/pneumonia-outbreak-wuhan-china/,03/01/2020 07:30,Mothership.sg,auto
1,MOH: 3-year-old girl with pneumonia not linked to outbreak in Wuhan,https://www.mothership.sg/2020/01/first-suspect-case-wuhan-pneumonia-singapore-no-link/,06/01/2020 08:35,Mothership.sg,auto
2,China pneumonia cases may be new type of virus: WHO,https://www.mothership.sg/2020/01/china-wuhan-pneumonia/,09/01/2020 12:50,Mothership.sg,manual
3,"New case of pneumonia found in S’pore: Chinese national, 26, with travel history to Wuhan",https://www.mothership.sg/2020/01/chinese-national-isolated-coronavirus-wuhan/,11/01/2020 03:37,Mothership.sg,auto
4,China reports first death from Wuhan pneumonia virus,https://www.mothership.sg/2020/01/wuhan-man-pneumonia-dies/,11/01/2020 19:34,Mothership.sg,auto
5,Wuhan pneumonia may be linked to virus that caused SARS,https://www.mothership.sg/2020/01/wuhan-pneumonia-link-to-sars/,12/01/2020 20:59,Mothership.sg,auto
6,Thailand confirms first case of Wuhan pneumonia virus outside China,https://www.mothership.sg/2020/01/thailand-wuhan-virus/,15/01/2020 01:52,Mothership.sg,auto
7,69-year-old man with Wuhan travel history is 1st S’porean suspected to have Wuhan pneumonia,https://www.mothership.sg/2020/01/wuhan-pneumonia-first-singaporean/,17/01/2020 03:21,Mothership.sg,auto
8,2 more people in S’pore suspected to have Wuhan pneumonia,https://www.mothership.sg/2020/01/wuhan-pneumonia-singapore-two-patients/,18/01/2020 07:38,Mothership.sg,auto
9,"52-year-old S’pore resident suspected of Wuhan pneumonia, admitted for further assessment",https://www.mothership.sg/2020/01/wuhan-pneumonia-new-case-suspected/,19/01/2020 06:24,Mothership.sg,auto
10,"China reports 4 more cases of Wuhan pneumonia, researchers believe over 1,700 infected",https://www.mothership.sg/2020/01/china-wuhan-pneumonia-4-cases-thousands-infected/,19/01/2020 06:52,Mothership.sg,auto
11,3rd Wuhan pneumonia death confirmed in China as virus spreads to Beijing & Shenzhen,https://www.mothership.sg/2020/01/wuhan-pneumonia-spread-beijing-shenzhen/,20/01/2020 12:41,Mothership.sg,manual
12,1st case of Wuhan pneumonia coronavirus confirmed in South Korea,https://www.mothership.sg/2020/01/south-korea-wuhan-virus/,20/01/2020 23:34,Mothership.sg,auto
13,"Lam Pin Min: MOH closely monitoring pneumonia situation, screening all airport arrivals from China",https://www.mothership.sg/2020/01/lam-pin-min-wuhan-pneumonia/,21/01/2020 05:42,Mothership.sg,auto
14,Human-to-human transmission of Wuhan pneumonia virus confirmed before CNY amidst world’s largest annual migration,https://www.mothership.sg/2020/01/wuhan-contagious-cny/,21/01/2020 09:17,Mothership.sg,manual
15,"200+ cases of Wuhan pneumonia in China, 4 dead. It might get a lot worse after Chinese New Year.",https://www.mothership.sg/2020/01/wuhan-pneumonia-getting-worse/,21/01/2020 20:23,Mothership.sg,auto
16,Wuhan pneumonia outbreak not as serious as SARS: China expert,https://www.mothership.sg/2020/01/china-sars-wuhan-pneumonia/,22/01/2020 01:38,Mothership.sg,auto
17,"Wuhan virus update: 9 dead, over 400 infected, cases now confirmed in US & Taiwan",https://www.mothership.sg/2020/01/wuhan-whats-happening-now/,22/01/2020 19:25,Mothership.sg,auto
18,"Chinese pulmonologist, 84, who discovered SARS virus in 2003, heads to Wuhan to fight new virus",https://www.mothership.sg/2020/01/zhong-nanshan-wuhan-pneumonia/,22/01/2020 20:24,Mothership.sg,auto
19,Japanese store puts up sign barring Chinese customers from entering due to Wuhan pneumonia fear,https://www.mothership.sg/2020/01/japan-wuhan-pneumonia/,22/01/2020 21:30,Mothership.sg,auto
20,North Korea bans all tourists over Wuhan virus outbreak,https://www.mothership.sg/2020/01/north-korea-wuhan-virus-tourist-ban/,22/01/2020 22:12,Mothership.sg,auto
21,"Wuhan pneumonia coronavirus has same ‘ancestor’ as SARS, animals suspected to be source",https://www.mothership.sg/2020/01/wuhan-pneumonia-wildlife-bats/,22/01/2020 23:49,Mothership.sg,auto
22,"China says Wuhan pneumonia virus mutating, originated from market that kept illegal wildlife",https://www.mothership.sg/2020/01/wuhan-virus-mutating/,23/01/2020 00:04,Mothership.sg,auto
23,N95 masks sold out at several pharmacy outlets across S’pore,https://www.mothership.sg/2020/01/n95-wuhan/,23/01/2020 02:48,Mothership.sg,auto
24,"MOH issues travel advisory for Wuhan, recommends caution when travelling to rest of China",https://www.mothership.sg/2020/01/moh-wuhan-travel-advisory/,23/01/2020 04:04,Mothership.sg,auto
25,"3 new individuals in S’pore suspected of Wuhan pneumonia, 1 is 78-year-old S’pore resident",https://www.mothership.sg/2020/01/3-new-wuhan-pneumonia-suspect-cases-singapore/,23/01/2020 06:15,Mothership.sg,auto
26,"S’poreans buy up N95 masks by the box, experts in S’pore recommend surgical masks instead",https://www.mothership.sg/2020/01/n95-mask-pneumonia/,23/01/2020 08:23,Mothership.sg,auto
27,"11 million people prevented from leaving as Wuhan shuts down public transport, outbound flights",https://www.mothership.sg/2020/01/wuhan-lockdown/,23/01/2020 17:07,Mothership.sg,auto
28,Viral photo of Chinese news presenter wearing mask on-screen sparks controversy,https://www.mothership.sg/2020/01/chinese-news-presenter-wears-mask/,23/01/2020 17:17,Mothership.sg,manual
29,"Feverish Wuhan lady ‘escapes’ check at France airport using medicine, blogs about it on Weibo",https://www.mothership.sg/2020/01/wuhan-escape-france-check/,23/01/2020 18:34,Mothership.sg,manual
30,Snakes now pinpointed as likely source of China’s coronavirus,https://www.mothership.sg/2020/01/snakes-wuhan-pneumonia/,23/01/2020 18:40,Mothership.sg,auto
31,MSF reminds parents not to send sick children to school in Wuhan pneumonia advisory,https://www.mothership.sg/2020/01/msf-preschool-wuhan-pneumonia/,23/01/2020 19:17,Mothership.sg,auto
32,"Wuhan nurses in isolation ward share hectic schedule during outbreak, refuse to quit despite danger",https://www.mothership.sg/2020/01/wuhan-nurses-isolation-ward/,23/01/2020 20:46,Mothership.sg,auto
33,Wuhan virus found in patients with no travel history to Wuhan,https://www.mothership.sg/2020/01/no-travel-history-to-wuhan/,24/01/2020 00:37,Mothership.sg,auto
34,"China locks down 2 more cities after Wuhan, about 19 million people affected",https://www.mothership.sg/2020/01/china-lock-down-2-cities-wuhan/,24/01/2020 03:23,Mothership.sg,auto
35,"Outrageous menu from Wuhan’s market shows live deer, peacocks, wolf pups & over 100 wild animals on sale",https://www.mothership.sg/2020/01/wild-animal-wuhan-market/,24/01/2020 03:34,Mothership.sg,auto
36,MOH confirms 1st case of Wuhan virus in S’pore,https://www.mothership.sg/2020/01/moh-confirms-1st-case-of-wuhan-virus-in-spore/,24/01/2020 05:27,Mothership.sg,auto
37,PM Lee: S’pore needs to be operationally ready & psychologically prepared for Wuhan virus,https://www.mothership.sg/2020/01/pm-lee-wuhan-virus-davos/,24/01/2020 06:02,Mothership.sg,auto
38,4 Shangri-La Sentosa staff quarantined after contact with 66-year-old man infected with Wuhan virus,https://www.mothership.sg/2020/01/shangri-la-wuhan/,24/01/2020 06:51,Mothership.sg,auto
39,MOE: No student trips planned to China for February,https://www.mothership.sg/2020/01/moe-student-trips-china-wuhan/,24/01/2020 07:08,Mothership.sg,auto
40,Vietnam confirms 2 cases of Wuhan coronavirus,https://www.mothership.sg/2020/01/vietnam-wuhan-virus/,24/01/2020 07:17,Mothership.sg,auto
41,"Screening of 4 Chinese movies delayed in S’pore cinemas due to Wuhan virus, customers to be refunded",https://www.mothership.sg/2020/01/chinese-movies-delayed-cinemas/,24/01/2020 07:25,Mothership.sg,auto
42,Things S’poreans should know this Wuhan pneumonia virus season to enhance survival rate,https://www.mothership.sg/2020/01/wuhan-pneumonia-virus-updates/,24/01/2020 07:29,Mothership.sg,auto
43,Shangri-La Sentosa guests demand to know which floor infected man stayed & why they weren’t informed of virus earlier,https://www.mothership.sg/2020/01/shangri-la-wuhan-floor/,24/01/2020 07:37,Mothership.sg,auto
44,Chinese state media People’s Daily slammed for claiming a ‘herbal drink’ can prevent Wuhan virus,https://www.mothership.sg/2020/01/people-daily-herbal-drink-wuhan-virus-criticised/,24/01/2020 08:50,Mothership.sg,auto
45,"Chinese health expert: Wuhan virus symptoms appear within 7 days, on average",https://www.mothership.sg/2020/01/wuhan-coronavirus-symptoms/,24/01/2020 16:53,Mothership.sg,auto
46,PM Lee’s 2020 CNY message: Strong families make for a strong nation,https://www.mothership.sg/2020/01/pm-lee-2020-cny-message/,24/01/2020 18:59,Mothership.sg,auto
47,"ICA to implement temperature screening at Woodlands & Tuas checkpoints from Jan. 24, 2020",https://www.mothership.sg/2020/01/ica-temperature-check-woodlands-tuas-wuhan-virus/,24/01/2020 19:01,Mothership.sg,auto
48,Chinese state media CGTN reporter panned for asking basic question at press conference,https://www.mothership.sg/2020/01/news-china-wuhan-cgtn-reporter/,24/01/2020 19:52,Mothership.sg,auto
49,"Before global outbreak of Wuhan virus, Guangzhou residents said: ‘No masks! We trust the govt!’",https://www.mothership.sg/2020/01/before-global-outbreak-of-wuhan-virus-guangzhou-residents-said-no-masks-we-trust-the-govt/,24/01/2020 21:03,Mothership.sg,auto
50,Man with symptoms of pneumonia in Simei taken to Tan Tock Seng hospital for observation,https://www.mothership.sg/2020/01/simei-eastpoint-pneumonia-symptoms/,24/01/2020 21:14,Mothership.sg,auto
51,"China building 1,000-bed hospital in 6 days to treat coronavirus patients",https://www.mothership.sg/2020/01/china-build-hospital-6-days/,24/01/2020 21:28,Mothership.sg,auto
52,"S’pore confirms 2 more cases of Wuhan coronavirus, 3rd in 2 days",https://www.mothership.sg/2020/01/wuhan-singapore-how-many-cases/,24/01/2020 23:07,Mothership.sg,auto
53,"ICA building closed over CNY period, travellers who need to extend stay in S’pore can apply online",https://www.mothership.sg/2020/01/apply-for-travel-extension-singapore-ica/,24/01/2020 23:51,Mothership.sg,auto
54,"Couple allegedly abandoned children at Nanjing airport to board plane, after child discovered with fever",https://www.mothership.sg/2020/01/nanjing-airport-children-abandoned/,24/01/2020 23:57,Mothership.sg,auto
55,"SMRT to provide hand sanitisers at all MRT stations & bus interchanges, steps up precautions for staff",https://www.mothership.sg/2020/01/wuhan-virus-smrt/,25/01/2020 00:01,Mothership.sg,auto
56,"Grab S’pore stockpiling masks & disinfectant, reminds drivers to disinfect vehicles regularly",https://www.mothership.sg/2020/01/grab-singapore-measures-wuhan-disinfectant/,25/01/2020 00:41,Mothership.sg,auto
57,"Netflix drops ‘Pandemic’ docu show amid Wuhan crisis, & a game called ‘Plague Inc.’ is top on App store",https://www.mothership.sg/2020/01/netflix-pandemic-plague-inc/,25/01/2020 00:42,Mothership.sg,auto
58,8 people who came into contact with first Wuhan pneumonia case in S’pore isolated in JB hotel,https://www.mothership.sg/2020/01/wuhan-pneumonia-johor-bahru-8/,25/01/2020 04:09,Mothership.sg,auto
59,Nepal confirms first case of Wuhan coronavirus,https://www.mothership.sg/2020/01/nepal-wuhan-pneumonia-virus/,25/01/2020 08:41,Mothership.sg,auto
60,"Wuhan virus death toll jumps to 41, over 1280 cases in China",https://www.mothership.sg/2020/01/wuhan-virus-how-many-deaths/,25/01/2020 09:48,Mothership.sg,manual
61,Video allegedly shows doctor in Wuhan breaking down over concerns of lack of hospital resources,https://www.mothership.sg/2020/01/wuhan-doctor-breakdown/,25/01/2020 11:30,Mothership.sg,auto
62,35 S’poreans are among the 11 million prevented from leaving Wuhan,https://www.mothership.sg/2020/01/singaporeans-in-wuhan/,25/01/2020 18:17,Mothership.sg,auto
63,"France confirms 3 cases of Wuhan coronavirus, 1st in Europe",https://www.mothership.sg/2020/01/france-wuhan-coronavirus/,25/01/2020 18:44,Mothership.sg,auto
64,"Doctor, 62, at the ‘front line’ of the Wuhan virus outbreak has died from the virus",https://www.mothership.sg/2020/01/wuhan-doctor-die/,25/01/2020 20:22,Mothership.sg,auto
65,"M’sia confirms 3 cases of Wuhan virus, all related to S’pore’s 1st case",https://www.mothership.sg/2020/01/malaysia-wuhan-virus/,25/01/2020 20:38,Mothership.sg,auto
66,"Rumours of over 100 Wuhan travellers denied entry into S’pore untrue, says ICA",https://www.mothership.sg/2020/01/wuhan-traveller-denied-entry-untrue-ica/,25/01/2020 22:22,Mothership.sg,auto
67,2-year-old girl is youngest confirmed case of Wuhan virus,https://www.mothership.sg/2020/01/2-year-old-wuhan-virus-confirmed/,25/01/2020 22:49,Mothership.sg,auto
68,3 medical students among the 35 S’poreans in Wuhan,https://www.mothership.sg/2020/01/3-singaporean-students-in-wuhan/,25/01/2020 23:31,Mothership.sg,auto
69,"All passengers & crew on Scoot flight from S’pore to China isolated, 1 sent for further blood test",https://www.mothership.sg/2020/01/scoot-wuhan-singapore/,25/01/2020 23:46,Mothership.sg,auto
70,S’pore to prepare chalets as quarantine centres for Wuhan coronavirus,https://www.mothership.sg/2020/01/singapore-chalet-quarantine-wuhan-virus/,26/01/2020 02:08,Mothership.sg,auto
71,"The Philippines ban flights to Wuhan, repatriates 464 Wuhan tourists back to China",https://www.mothership.sg/2020/01/philippines-wuhan-ban/,26/01/2020 03:29,Mothership.sg,auto
72,S’pore Airlines to waive cancellation & change fees for tickets to China purchased before Jan. 24,https://www.mothership.sg/2020/01/sia-tickets-waive-china/,26/01/2020 04:36,Mothership.sg,auto
73,"S’pore biotech firm to launch Wuhan virus detection kit by Feb. 1, 2020",https://www.mothership.sg/2020/01/wuhan-detection-kit-singapore/,26/01/2020 06:17,Mothership.sg,auto
74,Beijing to suspend all inter-province bus services on Jan. 26,https://www.mothership.sg/2020/01/beijing-suspends-buses/,26/01/2020 06:45,Mothership.sg,auto
75,"Death, endless patients & breakdowns: What Wuhan’s medical front liners have to face",https://www.mothership.sg/2020/01/wuhan-overworked-cant-take-it/,26/01/2020 07:08,Mothership.sg,auto
76,No new cases of Wuhan virus in S’pore after 3 confirmed cases: MOH,https://www.mothership.sg/2020/01/wuhan-virus-cases-singapore-update-jan-26/,26/01/2020 08:06,Mothership.sg,auto
77,"MOH confirms 4th case of Wuhan virus in S’pore, isolated at Sengkang General Hospital",https://www.mothership.sg/2020/01/wuhan-singapore-4th/,26/01/2020 08:54,Mothership.sg,auto
78,M’sia confirms 4th case of Wuhan virus,https://www.mothership.sg/2020/01/malaysia-4th-case-wuhan-virus/,26/01/2020 11:49,Mothership.sg,auto
79,"Hong Kong declares Wuhan virus as ’emergency’, closes schools & cancels major events",https://www.mothership.sg/2020/01/hongkong-wuhan-virus-emergency/,26/01/2020 11:56,Mothership.sg,auto
80,Chinese citizens joke online about contributing to the nation just by lying down at home,https://www.mothership.sg/2020/01/chinese-contribute-nation-joke-meme/,26/01/2020 12:01,Mothership.sg,auto
81,CGTN video shows mostly empty streets & residents stocking up on groceries in Wuhan,https://www.mothership.sg/2020/01/china-cgtn-video-wuhan-empty/,26/01/2020 12:09,Mothership.sg,auto
82,"Wuhan virus toll rises, 56 dead & 1,975 confirmed infections in China",https://www.mothership.sg/2020/01/wuhan-virus-jan-26-update/,26/01/2020 18:50,Mothership.sg,auto
83,MOH: No one has died from Wuhan coronavirus in S’pore,https://www.mothership.sg/2020/01/moh-debunk-wuhan-virus/,26/01/2020 19:17,Mothership.sg,auto
84,3 doctors in Beijing reportedly infected with Wuhan virus,https://www.mothership.sg/2020/01/beijing-doctors-wuhan-virus/,26/01/2020 19:54,Mothership.sg,auto
85,"207,000 sign online petition to ban Chinese nationals from entering M’sia for fear of Wuhan virus",https://www.mothership.sg/2020/01/petition-ban-china-chinese-malaysia/,26/01/2020 20:38,Mothership.sg,auto
86,Each person infected with Wuhan virus passes it on to 2 to 3 others on average,https://www.mothership.sg/2020/01/wuhan-virus-spread-rate/,26/01/2020 22:35,Mothership.sg,auto
87,Chinese travel show host apologises for eating a bat on camera in 2016 in wake of Wuhan virus,https://www.mothership.sg/2020/01/chinese-eat-bat-sorry/,26/01/2020 23:07,Mothership.sg,auto
88,M’sia police detain Chinese parents who dodged quarantine with toddler & escaped from hospital,https://www.mothership.sg/2020/01/malaysia-detain-chinese-parents-quarantine/,27/01/2020 01:02,Mothership.sg,auto
89,Doctor in China caught on camera claiming Wuhan virus cases under-reported,https://www.mothership.sg/2020/01/doctor-china-wuhan-virus-under-reported/,27/01/2020 01:41,Mothership.sg,auto
90,"Wuhan resident questions Chinese govt, says inaction cost many lives",https://www.mothership.sg/2020/01/china-wuhan-resident-speaks-out/,27/01/2020 04:05,Mothership.sg,auto
91,China bans wildlife trade nationwide in a bid to contain Wuhan virus,https://www.mothership.sg/2020/01/china-bans-wildlife-trade/,27/01/2020 04:50,Mothership.sg,auto
92,Duke-NUS Medical School team discovers why bats make perfect hosts for deadly viruses like SARS,https://www.mothership.sg/2020/01/why-bat-virus-wuhan/,27/01/2020 05:04,Mothership.sg,auto
93,Online shopping parcels from China delivered to you unlikely to spread Wuhan virus,https://www.mothership.sg/2020/01/online-delivery-china-wuhan-virus/,27/01/2020 05:40,Mothership.sg,auto
94,"4th person infected with Wuhan virus in S’pore took public transport, but risk of infection ‘low’: MOH",https://www.mothership.sg/2020/01/wuhan-virus-92-suspect-cases/,27/01/2020 05:47,Mothership.sg,auto
95,Hong Kong bans anyone who has been to Hubei province in last 14 days,https://www.mothership.sg/2020/01/hong-kong-ban-wuhan/,27/01/2020 08:00,Mothership.sg,auto
96,Some NUS & NTU residents evicted via email as campus housing converted into Wuhan virus quarantine facilities,https://www.mothership.sg/2020/01/nus-ntu-quarantine-wuhan-virus/,27/01/2020 10:19,Mothership.sg,auto
97,"5 million people left Wuhan before lockdown & 1,000 new cases expected in the city",https://www.mothership.sg/2020/01/wuhan-5-million-left/,27/01/2020 11:17,Mothership.sg,auto
98,HardwareZone forum post about Wuhan virus S’pore death rumour slapped with POFMA correction direction,https://www.mothership.sg/2020/01/hwz-pofma-wuhan-virus-death-rumour/,27/01/2020 11:51,Mothership.sg,auto
99,"Over 25,000 sign online petition calling for ban on Chinese nationals entering S’pore over fears of Wuhan virus",https://www.mothership.sg/2020/01/singapore-petition-ban-chinese-nationals-wuhan-virus/,27/01/2020 16:24,Mothership.sg,auto
100,Wuhan virus: Travellers on all flights arriving at Changi to be temperature screened from Jan. 29,https://www.mothership.sg/2020/01/wuhan-virus-all-flights-temperature-screened-changi/,27/01/2020 19:49,Mothership.sg,auto
101,Students & staff from MOE schools returning from mainland China to get 14 days leave of absence,https://www.mothership.sg/2020/01/leave-of-absence-moe-students/,27/01/2020 19:50,Mothership.sg,auto
102,Wuhan virus: Chingay & River Hongbao events will go on with extra measures & temp. screening,https://www.mothership.sg/2020/01/community-events-chingay-wuhan-virus/,27/01/2020 20:33,Mothership.sg,auto
103,China confirms first death from Wuhan virus in Hainan,https://www.mothership.sg/2020/01/hainan-wuhan-virus-first-death/,27/01/2020 21:05,Mothership.sg,manual
104,"Ong Ye Kung: NUS, SMU & NTU hostels converted to Wuhan virus quarantine facilities, S’porean students encouraged to stay home",https://www.mothership.sg/2020/01/ntu-smu-nus-hostel-wuhan-virus-quarantine/,27/01/2020 21:29,Mothership.sg,auto
105,"Surgical & N95 masks resold on Carousell, as high as S$288 for box of 20",https://www.mothership.sg/2020/01/surgical-mask-n95-carousell/,27/01/2020 22:47,Mothership.sg,auto
106,DPM Heng: Govt will spare no effort to keep S’poreans safe from Wuhan virus,https://www.mothership.sg/2020/01/heng-swee-keat-wuhan-virus/,27/01/2020 23:10,Mothership.sg,auto
107,MOH: Individual at Compass One attended to by paramedics is not linked to Wuhan virus,https://www.mothership.sg/2020/01/wuhan-compass-one-moh/,28/01/2020 00:32,Mothership.sg,auto
108,"18 S’pore residents & 10 Scoot staff isolated in Hangzhou have returned to S’pore, extra precautions taken",https://www.mothership.sg/2020/01/scoot-tr188-hangzhou-isolation-return/,28/01/2020 01:46,Mothership.sg,auto
109,M’sia to temporarily suspend immigration visas to Chinese nationals from Hubei province over Wuhan virus concerns,https://www.mothership.sg/2020/01/malaysia-suspend-visa-china-wuhan-hubei/,28/01/2020 03:25,Mothership.sg,auto
110,Cambodia confirms 1st case of Wuhan virus,https://www.mothership.sg/2020/01/cambodia-wuhan-virus/,28/01/2020 05:56,Mothership.sg,auto
111,PSP’s Tan Cheng Bock: Let’s not have any blame game & work as a team to contain the Wuhan virus,https://www.mothership.sg/2020/01/psp-tan-cheng-bock-wuhan-virus/,28/01/2020 06:19,Mothership.sg,auto
112,"5th case of Wuhan virus confirmed in S’pore: Woman, 56, stayed at Ceylon Road prior to isolation",https://www.mothership.sg/2020/01/wuhan-virus-singapore-5th-case/,28/01/2020 08:32,Mothership.sg,auto
113,1st case of Wuhan virus confirmed in Germany,https://www.mothership.sg/2020/01/wuhan-virus-germany/,28/01/2020 19:25,Mothership.sg,auto
114,"Wuhan virus: More than 65% increase in confirmed cases, death toll spikes to 106",https://www.mothership.sg/2020/01/wuhan-coronavirus-spike/,28/01/2020 21:43,Mothership.sg,auto
115,Watsons & FairPrice slap quota on number of masks each customer in S’pore can buy,https://www.mothership.sg/2020/01/watsons-fairprice-slap-quota-on-number-of-masks-each-customer-in-spore-can-buy/,28/01/2020 21:56,Mothership.sg,auto
116,Videos show Chinese premier Li Keqiang visiting hospital staff & leading efforts in Wuhan,https://www.mothership.sg/2020/01/li-keqiang-wuhan/,28/01/2020 22:17,Mothership.sg,auto
117,"Thailand confirms 6 more Wuhan virus infections, total of 14 cases",https://www.mothership.sg/2020/01/thailand-wuhan-virus-new-cases/,28/01/2020 22:25,Mothership.sg,auto
118,"Over 100,000 sign online petition calling for ban on Chinese nationals entering S’pore over Wuhan virus fears",https://www.mothership.sg/2020/01/over-100000-sign-online-petition-calling-for-ban-on-chinese-nationals-entering-spore-over-wuhan-virus-fears/,28/01/2020 22:41,Mothership.sg,auto
119,"MOH: Hubei travellers denied entry into S’pore from Jan. 29, 12pm",https://www.mothership.sg/2020/01/enhanced-security-measures-hubei-travellers/,29/01/2020 00:15,Mothership.sg,auto
120,"6th & 7th case of Wuhan virus confirmed in S’pore, both are Chinese nationals from Wuhan",https://www.mothership.sg/2020/01/6th-7th-wuhan-virus-singapore/,29/01/2020 00:16,Mothership.sg,auto
121,"Ex-NMP Calvin Cheng says if S’pore bans China travellers, other countries can do the same to us",https://www.mothership.sg/2020/01/calvin-cheng-singapore-ban-china-travellers/,29/01/2020 00:46,Mothership.sg,auto
122,Dog stops owner from going to Wuhan before severe outbreak by eating her passport,https://www.mothership.sg/2020/01/dog-eat-passport-wuhan/,29/01/2020 01:07,Mothership.sg,auto
123,Sufficient supply of masks in S’pore if we use them ‘sensibly’ & ‘responsibly’: Lam Pin Min,https://www.mothership.sg/2020/01/mask-supply-singapore/,29/01/2020 03:05,Mothership.sg,auto
124,PM Lee advises S’poreans on ways to not spread Wuhan virus & irresponsible rumours,https://www.mothership.sg/2020/01/pm-lee-wuhan/,29/01/2020 03:34,Mothership.sg,auto
125,Website tracks global spread of Wuhan coronavirus in visual way,https://www.mothership.sg/2020/01/website-wuhan-virus-track-update/,29/01/2020 04:08,Mothership.sg,auto
126,"Tan Chuan-Jin criticises HK protesters for destroying designated quarantine facility, urges S’poreans not to develop NIMBY-ism",https://www.mothership.sg/2020/01/tan-chuan-jin-nimby-wuhan/,29/01/2020 04:24,Mothership.sg,auto
127,Facebook issued POFMA correction direction after 2 users alleged Woodlands MRT closed due to Wuhan virus,https://www.mothership.sg/2020/01/pofma-wuhan-virus-woodlands-mrt/,29/01/2020 04:39,Mothership.sg,auto
128,Outward Bound Singapore Pulau Ubin camps converted into Wuhan virus quarantine facility,https://www.mothership.sg/2020/01/outward-bound-singapore-quarantine/,29/01/2020 04:45,Mothership.sg,auto
129,"Novel coronavirus more infectious than SARS but less fatal: PM Lee, Lawrence Wong",https://www.mothership.sg/2020/01/lawrence-wong-wuhan-virus-sars/,29/01/2020 05:11,Mothership.sg,auto
130,Philippines stops issuing visas on arrival to Chinese nationals amidst Wuhan virus scare,https://www.mothership.sg/2020/01/philippines-stops-chinese-visas-on-arrival/,29/01/2020 05:35,Mothership.sg,auto
131,"Crescent Girls’ alumna in Wuhan shares community’s plight, draws mixed reactions from readers",https://www.mothership.sg/2020/01/wuhan-situation/,29/01/2020 05:36,Mothership.sg,auto
132,"Deferment for NSmen & Pre-Enlistees who have travelled to China: MINDEF, MHA",https://www.mothership.sg/2020/01/mha-mindef-wuhan/,29/01/2020 06:18,Mothership.sg,auto
133,Amara S’pore: No suspected or confirmed cases of Wuhan virus at hotel premises,https://www.mothership.sg/2020/01/amara-singapore-no-wuhan-virus/,29/01/2020 06:52,Mothership.sg,auto
134,S’pore Food Agency on Wuhan virus: S’pore does not import livestock or raw meat from China,https://www.mothership.sg/2020/01/singapore-food-wuhan-virus/,29/01/2020 07:25,Mothership.sg,auto
135,MOM to reject all new work pass applications from foreign workers from Hubei,https://www.mothership.sg/2020/01/mom-reject-work-pass-hubei/,29/01/2020 07:54,Mothership.sg,auto
