index,headline,source_url,publish_date,publisher
135,2nd death in the Philippines after suspicions of coronavirus in patient,https://www.mothership.sg/2020/02/second-person-pneumonia-death-philippines/,08-02-2020 19:54:00,Mothership
136,WHO: Global shortage of masks & personal protective equipment due to ‘inappropriate use’ by those not on frontlines,https://www.mothership.sg/2020/02/who-global-shortage-of-masks/,08-02-2020 19:25:00,Mothership
137,"China’s novel coronavirus death toll hits 722, more than 34,000 confirmed cases",https://www.mothership.sg/2020/02/china-coronavirus-death-toll-higher-than-sars/,08-02-2020 19:21:00,Mothership
138,Coronavirus: Recovered Wuhan patient in S’pore was ‘not afraid’ because of ‘wonderful medical team’,https://www.mothership.sg/2020/02/2nd-discharged-coronavirus-singapore-interview/,08-02-2020 18:47:00,Mothership
139,Anecdotes online claim S’pore nurses ostracised for taking MRT in uniform & spreading viruses,https://www.mothership.sg/2020/02/nurses-mrt-uniform-wuhan-virus/,08-02-2020 14:07:00,Mothership
140,Education minister Ong Ye Kung reassures VJC teacher infected with coronavirus it’s not her fault,https://www.mothership.sg/2020/02/ong-ye-kung-vjc-teacher-wuhan-virus/,08-02-2020 12:57:00,Mothership
141,FairPrice clarifies it doesn’t sell bat meat after doctored images circulate online,https://www.mothership.sg/2020/02/fairprice-sell-bat-meat-fake-image/,08-02-2020 10:24:00,Mothership
142,S’pore Airshow to continue with added measures to safeguard attendees’ well-being: Event organiser,https://www.mothership.sg/2020/02/singapore-airshow-2020-continue-safety-measures/,08-02-2020 09:46:00,Mothership
143,Chan Chun Sing urges S’poreans to exercise individual responsibility & ‘not hoard items unnecessarily’,https://www.mothership.sg/2020/02/chan-chun-sing-dorscon-orange-hoarding/,08-02-2020 08:39:00,Mothership
144,Coronavirus: Travellers cancel flights to S’pore over fears of local transmission,https://www.mothership.sg/2020/02/travellers-cancel-singapore/,08-02-2020 07:57:00,Mothership
145,Man who collapsed at Raffles Place MRT was sent to Tan Tock Seng Hospital,https://www.mothership.sg/2020/02/man-collapse-raffles-mrt-ttsh/,08-02-2020 05:23:00,Mothership
146,"Thaipusam in S’pore to proceed on Feb. 8, devotees advised to avoid peak periods at 12am & 6pm",https://www.mothership.sg/2020/02/thaipusam-2020-coronavirus/,08-02-2020 04:08:00,Mothership
147,Pangolin “most likely” intermediate host for coronavirus: Chinese scientists,https://www.mothership.sg/2020/02/pangolin-host-coronavirus/,08-02-2020 03:55:00,Mothership
148,Britain’s 3rd case of coronavirus is British national who had travelled to S’pore,https://www.mothership.sg/2020/02/first-british-national-coronavirus-singapore/,08-02-2020 02:51:00,Mothership
149,Lion dance troupe to get tested after performing at Grand Hyatt conference with coronavirus cases,https://www.mothership.sg/2020/02/lion-dance-conference-grand-hyatt/,08-02-2020 02:19:00,Mothership
150,"Coronavirus: 2nd patient discharged. 2 patients in critical condition, warded in ICU.",https://www.mothership.sg/2020/02/singapore-coronavirus-2-discharge-2-icu/,08-02-2020 01:57:00,Mothership
151,Schools in S’pore to suspend external activities until end of March holidays,https://www.mothership.sg/2020/02/moe-school-suspend-activities-march-holiday/,08-02-2020 01:56:00,Mothership
152,Here’s a list of all additional precautionary measures now that S’pore is at DORSCON Orange alert,https://www.mothership.sg/2020/02/additional-precautionary-measures-dorscon-orange-alert-singapore/,08-02-2020 01:27:00,Mothership
153,"Coronavirus: Community spread confirmed, 3 new cases. S’pore now at Orange alert.",https://www.mothership.sg/2020/02/coronavirus-dorscon-orange-1st-time/,08-02-2020 01:26:00,Mothership
154,"Coronavirus: 42-year-old S’porean VJC teacher among 3 new cases, total cases at 33",https://www.mothership.sg/2020/02/singapore-confirmed-cases-coronavirus-33/,08-02-2020 01:25:00,Mothership
155,Poor & elderly in HK keep reusing masks as they can’t afford or too weak to queue for new ones,https://www.mothership.sg/2020/02/poor-elderly-cant-afford-mask-hong-kong/,08-02-2020 01:14:00,Mothership
156,S’pore’s 29th patient with coronavirus had lohei with colleagues on day he developed symptoms,https://www.mothership.sg/2020/02/wuhan-virus-singapore-29th-patient-lohei/,08-02-2020 00:26:00,Mothership
157,DPM Heng Swee Keat reaffirms S’pore’s commitment to help China fight coronavirus outbreak,https://www.mothership.sg/2020/02/heng-swee-keat-coronavirus/,07-02-2020 23:21:00,Mothership
158,‘Viral CNA tweet’ declaring S’pore schools closed on Feb. 10 due to coronavirus is fake,https://www.mothership.sg/2020/02/fake-tweet-cna-school/,07-02-2020 22:54:00,Mothership
159,"Over 320,000 people sign online petition urging United Nations to get WHO chief to resign",https://www.mothership.sg/2020/02/online-petition-who-chief-resign/,07-02-2020 22:02:00,Mothership
160,Shanmugam criticises S’porean ustaz for saying coronavirus outbreak retribution for China’s oppression of Muslim Uighurs,https://www.mothership.sg/2020/02/shanmugam-xenophobic-ustaz/,07-02-2020 21:06:00,Mothership
161,5 S’poreans aboard quarantined Japanese cruise ship,https://www.mothership.sg/2020/02/5-sporeans-japanese-cruise-ship/,07-02-2020 20:50:00,Mothership
162,"41 more confirmed coronavirus cases aboard quarantined Japanese cruise ship, 61 cases in total",https://www.mothership.sg/2020/02/41-confirmed-coronavirus-cases-japan-cruise-ship/,07-02-2020 19:55:00,Mothership
163,"Coronavirus case 29 visited Seletar clinic twice before diagnosis, GP went on voluntary LOA",https://www.mothership.sg/2020/02/coronavirus-phoenix-medical-group/,07-02-2020 19:12:00,Mothership
164,"Shin Min: Mother of 6-month-old devastated she passed virus to family, talks about guilt she feels",https://www.mothership.sg/2020/02/singapore-wuhan-virus-mother-baby/,07-02-2020 18:46:00,Mothership
165,"Old Chang Kee giving free curry puffs to S’pore doctors & nurses from public hospitals, daily till 5pm",https://www.mothership.sg/2020/02/old-chang-kee-free-curry-puff/,07-02-2020 18:34:00,Mothership
166,MFA in talks with Chinese authorities to mount 2nd evacuation flight from Wuhan,https://www.mothership.sg/2020/02/singapore-evacuation-wuhan-flight/,07-02-2020 18:21:00,Mothership
167,"Whistleblower doctor in China, 34, has died from new coronavirus he tried to warn others about",https://www.mothership.sg/2020/02/whistleblower-doctor-china-dies-wuhan-virus/,07-02-2020 08:14:00,Mothership
168,German YouTuber speaks up for China after follower experiences racism due to virus outbreak,https://www.mothership.sg/2020/02/german-youtuber-speaks-up-china-coronavirus/,07-02-2020 07:33:00,Mothership
169,"How did Patient 29, with no obvious links to previous cases, contract coronavirus?",https://www.mothership.sg/2020/02/patient-29-unlinked-coronavirus-case/,07-02-2020 07:17:00,Mothership
170,Coronavirus: Private hire driver is 27th case in S’pore,https://www.mothership.sg/2020/02/private-hire-driver-wuhan-virus/,07-02-2020 06:43:00,Mothership
171,"Coronavirus: 2 infected patients’ conditions have worsened, 1 in critical condition in ICU",https://www.mothership.sg/2020/02/singapore-coronavirus-patient-icu/,07-02-2020 06:24:00,Mothership
172,"Coronavirus: 2 more confirmed S’porean cases, both with no travel history to Wuhan",https://www.mothership.sg/2020/02/wuhan-virus-local-transmission/,07-02-2020 05:44:00,Mothership
173,S’pore is at Yellow alert for the coronavirus. What would it take to shift to Orange?,https://www.mothership.sg/2020/02/coronavirus-yellow-alert/,07-02-2020 04:12:00,Mothership
174,A complete breakdown of how the coronavirus cases in S’pore are related to one another,https://www.mothership.sg/2020/02/wuhan-virus-linked-how/,07-02-2020 02:43:00,Mothership
175,M’sia’s first locally transmitted coronavirus case is sister of man who went to S’pore conference,https://www.mothership.sg/2020/02/malaysia-first-local-transmission-coronavirus/,07-02-2020 01:37:00,Mothership
176,Xi Jinping warns coronavirus outbreak can affect China’s social stability,https://www.mothership.sg/2020/02/china-xi-jinping-wuhan-virus-social-stability/,07-02-2020 01:27:00,Mothership
177,Health experts debunk video advising people to steam & reuse masks,https://www.mothership.sg/2020/02/video-steam-reuse-masks-debunk/,07-02-2020 01:10:00,Mothership
178,"S’poreans go to Senoko, northern-most part of S’pore, queue in sun to buy 8 litres of disinfectant",https://www.mothership.sg/2020/02/senoko-disinfectant-wuhan-virus/,07-02-2020 01:09:00,Mothership
179,"Jackie Chan, Donnie Yen & Jay Chou feature in music video to support medical workers in Wuhan",https://www.mothership.sg/2020/02/jackie-chan-donnie-yen-jay-chou-music-video-virus/,07-02-2020 00:57:00,Mothership
180,WHO kept informed of Grand Hyatt meeting with 94 overseas participants & 3 coronavirus cases,https://www.mothership.sg/2020/02/who-singapore-conference-coronavirus/,06-02-2020 23:42:00,Mothership
181,Prediction: Coronavirus likely to disappear in May as summer sun heats up China,https://www.mothership.sg/2020/02/wuhan-virus-china-summer-hot/,06-02-2020 23:39:00,Mothership
182,Hong Kong declares community outbreak of coronavirus,https://www.mothership.sg/2020/02/coronavirus-hong-kong-community-outbreak/,06-02-2020 23:28:00,Mothership
183,"Indonesia has 264 million people, over 2 million tourists from China, but 0 reported cases of coronavirus",https://www.mothership.sg/2020/02/indonesia-no-wuhan-virus/,06-02-2020 22:02:00,Mothership
184,Wuhan puts together makeshift ‘square cabin’ hospitals in one night to treat mild coronavirus cases,https://www.mothership.sg/2020/02/wuhan-square-cabin-hospital/,06-02-2020 21:28:00,Mothership
185,Coronavirus: Pakistan resumes flights to China after less than a week,https://www.mothership.sg/2020/02/pakistan-china-resume-flights-coronavirus/,06-02-2020 20:46:00,Mothership
186,Bill Gates donating up to S$138 million to help combat coronavirus all over the world,https://www.mothership.sg/2020/02/bill-gates-donate-coronavirus/,06-02-2020 20:09:00,Mothership
187,"20 coronavirus cases on Japanese cruise ship. Here’s what life is like for the 3,700 passengers stranded inside.",https://www.mothership.sg/2020/02/life-on-japanese-cruise-ship-coronavirus/,06-02-2020 20:05:00,Mothership
188,"Milder coronavirus infection cases possibly underreported in China, says experts",https://www.mothership.sg/2020/02/coronavirus-fatality-lower/,06-02-2020 19:38:00,Mothership
189,56 people in Taiwan died of H1N1 flu virus-affected respiratory failure in past 3 months,https://www.mothership.sg/2020/02/taiwan-h1n1-flu-died/,06-02-2020 17:50:00,Mothership
190,Coronavirus: India airports now screening passengers arriving from S’pore & Thailand,https://www.mothership.sg/2020/02/india-screen-singapore-passengers/,06-02-2020 16:58:00,Mothership
191,China’s People’s Liberation Army Air Force aerobatics team will still perform at S’pore Airshow,https://www.mothership.sg/2020/02/china-air-force-singapore-airshow-wuhan-virus/,06-02-2020 16:56:00,Mothership
192,Grand Hyatt S’pore business meeting attended by 109 people source of M’sia & South Korea coronavirus cases,https://www.mothership.sg/2020/02/wuhan-virus-grand-hyatt-singapore/,06-02-2020 15:45:00,Mothership
193,563 dead as China’s coronavirus outbreak continues to claim lives in hardest-hit regions,https://www.mothership.sg/2020/02/china-wuhan-virus-update-feb-6/,06-02-2020 15:16:00,Mothership
194,"Cases 19, 27 & 28: The first S’porean family to get coronavirus locally",https://www.mothership.sg/2020/02/singapore-family-wuhan-virus/,06-02-2020 08:20:00,Mothership
195,"Newborn baby in China tests positive for coronavirus, infected mother likely the cause",https://www.mothership.sg/2020/02/newborn-baby-china-wuhan-virus-infected-mother/,06-02-2020 08:16:00,Mothership
196,"4 more confirmed cases of coronavirus in S’pore, including 6-month-old child of previous cases",https://www.mothership.sg/2020/02/4-more-confirmed-cases-coronavirus/,06-02-2020 06:19:00,Mothership
197,"Lavender cluster PRC tourist group also visited T Galleria, Downtown East & Havelock Rd",https://www.mothership.sg/2020/02/coronavirus-lavender-tourists/,06-02-2020 06:14:00,Mothership
198,VivoCity quashes rumour of coronavirus infection & closure due to disinfection,https://www.mothership.sg/2020/02/vivocity-rumour-coronavirus/,06-02-2020 04:58:00,Mothership
199,Restaurants in Indonesia take bat dishes off menu over coronavirus fears,https://www.mothership.sg/2020/02/indonesia-bat-meat-coronavirus/,06-02-2020 03:56:00,Mothership
200,Hong Kong to quarantine all visitors from mainland China for 14 days,https://www.mothership.sg/2020/02/hong-kong-quarantine-visitors-mainland-china/,06-02-2020 03:41:00,Mothership
201,Canadian man’s attempt to go viral with false coronavirus claim forces Jamaican-bound flight to turn back,https://www.mothership.sg/2020/02/canada-man-coronavirus-prank/,06-02-2020 03:40:00,Mothership
202,"M’sian father, 45, & son, 9, infected with coronavirus on Feb. 5, 2020",https://www.mothership.sg/2020/02/malaysia-father-son-wuhan-virus/,06-02-2020 03:13:00,Mothership
203,Iconic Starbucks outlet at Fullerton Waterboat House now closed as its lease ended,https://www.mothership.sg/2020/02/starbucks-fullerton-waterboat-house-closed/,06-02-2020 02:02:00,Mothership
204,Grand Hyatt S’pore starts ‘deep cleaning measures’ after M’sian guest diagnosed with coronavirus,https://www.mothership.sg/2020/02/grand-hyatt-singapore-cleaning-coronavirus/,06-02-2020 01:53:00,Mothership
205,"Woman smears blood on lift doors in Yishun, town council to take action if vandalism continues",https://www.mothership.sg/2020/02/woman-smear-blood-in-lift-yishun/,06-02-2020 01:53:00,Mothership
206,Hong Kong protesters nominated for Nobel Peace Prize by US lawmakers,https://www.mothership.sg/2020/02/hong-kong-protesters-nobel-peace-prize/,06-02-2020 01:29:00,Mothership
207,NEA lists disinfectants & cleaning products effective against novel coronavirus,https://www.mothership.sg/2020/02/nea-coronavirus-cleaning-products-effective/,06-02-2020 01:16:00,Mothership
208,"Cathay Pacific asks 27,000 staff to take 3 weeks’ unpaid leave in wake of coronavirus outbreak",https://www.mothership.sg/2020/02/coronavirus-cathay-pacific-unpaid-leave/,06-02-2020 00:43:00,Mothership
209,Cambodian PM cancels ‘moral support’ visit to 23 Cambodian students in Wuhan,https://www.mothership.sg/2020/02/cambodia-hun-sen-wuhan-students/,06-02-2020 00:41:00,Mothership
210,2 S’poreans set up initiative for people to donate free masks & sanitisers to others in need,https://www.mothership.sg/2020/02/free-mask-sanitiser-giveaway/,06-02-2020 00:31:00,Mothership
211,S’pore couple on leave of absence attends their own hotel wedding banquet via livestream,https://www.mothership.sg/2020/02/couple-loa-wedding-livestream/,06-02-2020 00:13:00,Mothership
212,"Devastating virus attacking tomatoes, peppers & chili plants in US, China & Europe",https://www.mothership.sg/2020/02/tomato-rugose-brown-fruit-virus/,05-02-2020 23:10:00,Mothership
213,China’s leadership admits ‘shortcomings & deficiencies’ in initial response to coronavirus outbreak,https://www.mothership.sg/2020/02/china-wuhan-virus-response-inadequate/,05-02-2020 23:09:00,Mothership
214,Ningxia Night Market Sentosa sees sparse crowd due to Wuhan virus outbreak in S’pore,https://www.mothership.sg/2020/02/ningxia-night-market-virus-outbreak/,05-02-2020 21:41:00,Mothership
215,"Beijing streets empty & stores shuttered, video by American residing in China shows",https://www.mothership.sg/2020/02/china-beijing-empty-wuhan-virus/,05-02-2020 21:37:00,Mothership
216,4-year-old girl with coronavirus in M’sia first to recover there & will go back to China,https://www.mothership.sg/2020/02/china-girl-4-wuhan-virus-malaysia-recovered/,05-02-2020 21:13:00,Mothership
217,"Coronavirus patient, 69, in China, came in close contact with over 100 people & hid travel history",https://www.mothership.sg/2020/02/china-man-69-wuhan-virus-contact-100/,05-02-2020 21:00:00,Mothership
218,South Korean man gets Wuhan virus after meeting infected M’sian at Grand Hyatt S’pore,https://www.mothership.sg/2020/02/south-korea-new-cases-infected-singapore/,05-02-2020 20:52:00,Mothership
219,MOH: 500 to 600 pneumonia patients to be tested for Wuhan virus every week,https://www.mothership.sg/2020/02/pneumonia-patients-tested-for-coronavirus-moh/,05-02-2020 20:00:00,Mothership
220,"28-year-old medical staff in China dies, allegedly after working 10 days straight battling Wuhan virus",https://www.mothership.sg/2020/02/doctor-overwork-die-wuhan-virus-song-yingjie/,05-02-2020 19:40:00,Mothership
221,"China’s novel coronavirus death toll rises to 490, confirmed infections hit 24,324",https://www.mothership.sg/2020/02/china-wuhan-virus-update-feb-5/,05-02-2020 19:33:00,Mothership
222,Chan Chun Sing & Pritam Singh debate foreign workers: ‘Immigration is the story of unrequited love’,https://www.mothership.sg/2020/02/chan-chun-sing-pritam-singh-foreign-workers/,05-02-2020 10:07:00,Mothership
223,South Koreans who hoard masks during Wuhan virus outbreak can be jailed 2 years,https://www.mothership.sg/2020/02/south-korea-face-masks-jail/,05-02-2020 09:23:00,Mothership
224,"S’pore donating S$1 million, medical supplies & test kits to China for Wuhan virus fight",https://www.mothership.sg/2020/02/singapore-donates-1-million-to-china/,05-02-2020 07:54:00,Mothership
225,"First M’sian diagnosed with Wuhan virus had visited Grand Hyatt S’pore, stayed here for 1 week",https://www.mothership.sg/2020/02/malaysian-wuhan-virus-grand-hyatt/,05-02-2020 07:34:00,Mothership
226,Wuhan Red Cross slammed for failing to deliver supplies to hospitals that urgently need them,https://www.mothership.sg/2020/02/china-wuhan-red-cross/,05-02-2020 07:13:00,Mothership
227,Timeline of Chinese tour group that infected tour guide & Lavender shopkeepers,https://www.mothership.sg/2020/02/chinese-tour-group-wuhan-timeline/,05-02-2020 03:29:00,Mothership
228,MOE cancels flag-raising ceremony & other group activities to prevent Wuhan virus spread,https://www.mothership.sg/2020/02/moe-schools-wuhan-virus/,05-02-2020 03:11:00,Mothership
229,Lavender cluster of Wuhan virus not widespread transmission: MOH Chief Health Scientist,https://www.mothership.sg/2020/02/lavender-wuhan-virus-spread/,05-02-2020 02:57:00,Mothership
230,4 Thai citizens among 6 new cases of Wuhan virus reported in Thailand,https://www.mothership.sg/2020/02/thailand-wuhan-cases-4-thais/,05-02-2020 02:36:00,Mothership
231,4 in S’pore infected with Wuhan virus due to Chinese tourist stop in Lavender,https://www.mothership.sg/2020/02/wuhan-virus-local-spread/,05-02-2020 02:01:00,Mothership
232,"Wuhan man, 35, first patient in S’pore to be cleared of Wuhan virus",https://www.mothership.sg/2020/02/wuhan-patient-discharge/,05-02-2020 02:00:00,Mothership
233,"Wuhan virus: 4 cases of human-to-human transmission in S’pore, 6 new cases in total",https://www.mothership.sg/2020/02/wuhan-virus-singapore-local-transmission/,05-02-2020 02:00:00,Mothership
234,"China says it urgently needs medical supplies, masks & protective suits to tackle Wuhan virus",https://www.mothership.sg/2020/02/china-needs-masks-medical-supplies-wuhan-virus/,05-02-2020 01:13:00,Mothership
235,Healthcare workers in Wuhan reveal cuts & marks on faces from wearing masks,https://www.mothership.sg/2020/02/healthcare-workers-wuhan-virus-face-mask-cuts/,05-02-2020 00:46:00,Mothership
236,First M’sian to test positive for Wuhan virus is Selangor man,https://www.mothership.sg/2020/02/malaysian-wuhan-virus-first/,04-02-2020 23:41:00,Mothership
237,"South Korean woman, 42, tests positive for coronavirus after visiting Thailand",https://www.mothership.sg/2020/02/south-korea-16th-case-coronavirus/,04-02-2020 23:21:00,Mothership
238,Macau suspends casino operations for two weeks to curb spread of Wuhan virus,https://www.mothership.sg/2020/02/macau-suspends-casinos-two-weeks/,04-02-2020 22:55:00,Mothership
239,Unlabelled boxes of masks placed outside Chinese consulate in Penang mistaken for bomb,https://www.mothership.sg/2020/02/penang-chinese-consulate-masks-bomb/,04-02-2020 22:32:00,Mothership
240,"Japan quarantines 3,700 onboard cruise ship over Wuhan virus",https://www.mothership.sg/2020/02/japan-quarantines-cruise-ship-wuhan-virus/,04-02-2020 21:41:00,Mothership
241,"Indonesian evacuees from Wuhan, China sprayed with ‘alcohol’ mist upon disembarking in Batam",https://www.mothership.sg/2020/02/indonesian-wuhan-virus-spray/,04-02-2020 20:59:00,Mothership
242,NATAS travel fair postponed from Feb. to May 2020 due to Wuhan virus outbreak,https://www.mothership.sg/2020/02/natas-travel-fair-wuhan-virus/,04-02-2020 20:26:00,Mothership
243,S’pore govt: No need for landlords to evict tenants serving quarantine orders or leave of absence,https://www.mothership.sg/2020/02/evict-wuhan-virus-tenants-quarantine-leave-of-absence/,04-02-2020 19:56:00,Mothership
244,"Hong Kong confirms first death from Wuhan virus, second reported death outside mainland China",https://www.mothership.sg/2020/02/hong-kong-first-death-wuhan-virus/,04-02-2020 19:09:00,Mothership
245,Ong Ye Kung visits NTU & NUS students on leave of absence,https://www.mothership.sg/2020/02/ong-ye-kung-visits-loa-students-ntu-nus/,04-02-2020 18:48:00,Mothership
246,Chinese embassy in Israel apologises for comparing travel bans to the Holocaust,https://www.mothership.sg/2020/02/china-israel-embassy-travel-ban-holocaust-sorry/,04-02-2020 18:08:00,Mothership
247,"China’s Wuhan virus death toll rises to 425, confirmed infections hit 20,438",https://www.mothership.sg/2020/02/wuhan-virus-deaths-feb-4/,04-02-2020 17:41:00,Mothership
248,"Kind neighbours in Punggol leave hand sanitisers, masks & alcohol swabs in lifts for public use",https://www.mothership.sg/2020/02/neighbours-donate-hand-sanitiser-mask-lift-punggol/,04-02-2020 08:49:00,Mothership
249,"Run For Hope postponed to Aug. 16, 2020 due to Wuhan virus outbreak",https://www.mothership.sg/2020/02/run-for-hope-postponed-wuhan-virus/,04-02-2020 04:12:00,Mothership
250,No new Wuhan virus cases identified in S’pore for 2nd day in a row,https://www.mothership.sg/2020/02/wuhan-new-cases-in-singapore/,04-02-2020 03:43:00,Mothership
251,"140 S’poreans still believed to be in Wuhan, govt working with China to help them: Lawrence Wong",https://www.mothership.sg/2020/02/140-singaporeans-wuhan/,04-02-2020 03:05:00,Mothership
252,Wuhan virus: Food becomes a challenge for Wuhan residents facing city lockdown,https://www.mothership.sg/2020/02/wuhan-lockdown-food/,04-02-2020 02:45:00,Mothership
253,Carouseller selling S’pore govt-issued surgical masks for S$1 each,https://www.mothership.sg/2020/02/government-masks-carousell/,04-02-2020 02:33:00,Mothership
254,"NUS & NTU students deliver food to students on leave of absence 3 times a day, every day",https://www.mothership.sg/2020/02/nus-ntu-students-deliver-food-wuhan-virus/,04-02-2020 02:05:00,Mothership
255,Masks not mailed out to S’pore households to prevent wastage: Lawrence Wong,https://www.mothership.sg/2020/02/masks-distribution-wuhan-virus/,04-02-2020 02:00:00,Mothership
256,"Govt to check on quarantined individuals through video & phone calls, spot checks",https://www.mothership.sg/2020/02/quarantine-leave-of-absence-lawrence-wong/,04-02-2020 01:35:00,Mothership
257,Chinese media highlights PM Lee’s remarks voicing support for efforts in combating Wuhan virus,https://www.mothership.sg/2020/02/china-praises-pm-lee-wuhan-virus-comments/,04-02-2020 01:08:00,Mothership
258,"800,000 out of 5.2 million free masks collected since Feb. 1",https://www.mothership.sg/2020/02/free-mask-collection-15-percent/,04-02-2020 01:00:00,Mothership
259,Guangzhou scientists discover Wuhan virus on door handle at patient’s house,https://www.mothership.sg/2020/02/wuhan-virus-door-handle/,04-02-2020 00:52:00,Mothership
260,Most travel insurers exclude coverage for Wuhan virus,https://www.mothership.sg/2020/02/wuhan-virus-travel-claims/,04-02-2020 00:20:00,Mothership
261,Gan Kim Yong: S’pore has been preparing for an infectious disease outbreak since SARS in 2003,https://www.mothership.sg/2020/02/singapore-outbreak-preparation-wuhan-virus/,03-02-2020 23:52:00,Mothership
262,6 circulating claims about Wuhan virus that you should be wary of,https://www.mothership.sg/2020/02/wuhan-virus-fake-news/,03-02-2020 23:39:00,Mothership
263,"Wuhan virus may spread from faeces to faces, a.k.a. faecal-oral transmission",https://www.mothership.sg/2020/02/wuhan-virus-excrement/,03-02-2020 23:04:00,Mothership
264,Health Minister Gan Kim Yong explains what S’pore currently knows about Wuhan virus,https://www.mothership.sg/2020/02/wuhan-virus-ministerial-statement-background/,03-02-2020 23:02:00,Mothership
265,Man runs away after leaving 500 masks for police officers in Anhui province,https://www.mothership.sg/2020/02/chinese-man-give-police-face-masks/,03-02-2020 22:51:00,Mothership
266,Thai doctors confirm mix of flu & HIV drugs effective in treating Wuhan virus,https://www.mothership.sg/2020/02/thailand-hiv-drugs-wuhan-virus-treatment/,03-02-2020 20:07:00,Mothership
267,Shanmugam: Wuhan virus situation brought out both best & worst in S’poreans,https://www.mothership.sg/2020/02/shanmugam-singaporeans-wuhan-virus/,03-02-2020 15:20:00,Mothership
268,S’pore doctor who survived SARS infection shares tips on how to avoid getting Wuhan virus,https://www.mothership.sg/2020/02/leong-hoe-nam-wuhan-virus/,03-02-2020 09:58:00,Mothership
