index,headline,source_url,publish_date,publisher,crawl_type,Date
227,Hong Kong reports first coronavirus death; Macau to shut casinos,https://www.todayonline.com/world/hong-kong-reports-first-wuhan-coronavirus-fatality-tvb-news,2020-04-02,Today Online,auto,2020-02-04
228,Macau to suspend casino operations for two weeks to curb spread of virus,https://www.todayonline.com/world/macau-suspend-casino-operations-two-weeks-curb-spread-virus,2020-04-02,Today Online,auto,2020-02-04
229,Hong Kong reports first coronavirus death as hospital workers escalate strike,https://www.todayonline.com/world/hong-kong-reports-first-wuhan-coronavirus-death-hospital-workers-escalate-strike,2020-04-02,Today Online,auto,2020-02-04
230,"15 exhibitors pull out of S'pore Airshow, summit cancelled to ‘allow aviation leaders to deal with coronavirus situation’: Organisers",https://www.todayonline.com/singapore/exhibitors-pull-out-singapore-airshow-aviation-leadership-summit-cancelled-wuhan-coronavirus,2020-04-02,Today Online,auto,2020-02-04
231,"Novel coronavirus: Scrapping school assemblies, field trips, communal activities among new precautionary measures",https://www.todayonline.com/singapore/wuhan-coronavirus-cancellation-school-assemblies-field-trips-and-communal-activities-among-new-measures,2020-04-02,Today Online,auto,2020-02-04
232,Beijing sees 'major test' as doors to China close and coronavirus deaths surpass Sars,https://www.todayonline.com/world/beijing-sees-major-test-doors-china-close-and-wuhan-coronavirus-deaths-surpass-sars,2020-04-02,Today Online,auto,2020-02-04
233,"Beijing in the time of coronavirus: No traffic, empty parks and fear",https://www.todayonline.com/world/beijing-time-coronavirus-no-traffic-empty-parks-and-fear,2020-04-02,Today Online,auto,2020-02-04
234,China admits 'shortcomings' in novel coronavirus response,https://www.todayonline.com/world/china-admits-shortcomings-wuhan-novel-coronavirus-response,2020-04-02,Today Online,auto,2020-02-04
235,Have a good cry but no boozing: Expert tips for virus-stressed China,https://www.todayonline.com/world/have-good-cry-no-boozing-expert-tips-virus-stressed-china,2020-04-02,Today Online,auto,2020-02-04
236,"Novel coronavirus: Singapore reports first local transmissions, 4 cases linked to Jalan Besar shop visited by Chinese tour groups",https://www.todayonline.com/singapore/wuhan-novel-coronavirus-singapore-reports-first-local-transmissions-4-cases-linked-jalan-besar,2020-04-02,Today Online,auto,2020-02-04
237,Use of HIV drugs to fight novel coronavirus in patients in S’pore ‘promising’: MOH chief health scientist,https://www.todayonline.com/singapore/results-using-hivaids-drugs-fight-wuhan-novel-coronavirus-patients-singapore-promising-moh-chief,2020-04-02,Today Online,auto,2020-02-04
238,More Chinese cities shut down as virus death toll rises,https://www.todayonline.com/world/more-chinese-cities-shut-down-virus-death-toll-rises,2020-05-02,Today Online,auto,2020-02-05
239,Coronavirus deaths in mainland China rise to 490 as more countries confirm local transmission,https://www.todayonline.com/world/china-virus-deaths-rise-490-more-countries-confirm-local-transmission,2020-05-02,Today Online,auto,2020-02-05
240,Grand Hyatt Singapore taking steps to clean premises after 2 coronavirus cases reported overseas,https://www.todayonline.com/singapore/singapore-business-meeting-linked-malaysian-korean-coronavirus-cases,2020-05-02,Today Online,auto,2020-02-05
241,Two Malaysians brought back from China tested positive for coronavirus: Minister,https://www.todayonline.com/world/two-malaysians-brought-back-china-tested-positive-coronavirus-minister,2020-05-02,Today Online,auto,2020-02-05
242,China air force cleared for Singapore Airshow amid virus concerns,https://www.todayonline.com/singapore/china-air-force-cleared-singapore-airshow-amid-virus-concerns,2020-05-02,Today Online,auto,2020-02-05
243,Businesses see slowdown of 20% to 50% due to coronavirus outbreak: Ng Chee Meng,https://www.todayonline.com/singapore/businesses-see-slowdown-20-50-due-wuhan-coronavirus-outbreak-ng-chee-meng,2020-05-02,Today Online,auto,2020-02-05
244,Thai taxi driver who had coronavirus tells Wuhan to keep fighting,https://www.todayonline.com/world/thai-taxi-driver-who-had-coronavirus-tells-wuhan-keep-fighting-2,2020-05-02,Today Online,auto,2020-02-05
245,Thai taxi driver who had coronavirus tells Wuhan to keep fighting,https://www.todayonline.com/world/thai-taxi-driver-who-had-coronavirus-tells-wuhan-keep-fighting-1,2020-05-02,Today Online,auto,2020-02-05
246,"South Korea reports two new coronavirus cases, including man who returned from Singapore",https://www.todayonline.com/world/south-korea-reports-two-new-wuhan-coronavirus-cases-including-man-who-returned-singapore,2020-05-02,Today Online,auto,2020-02-05
247,"Cathay Pacific asks all 27,000 employees to take unpaid leave as coronavirus hits demand",https://www.todayonline.com/world/cathay-pacific-asks-all-employees-unpaid-leave-coronavirus-hits-demand,2020-05-02,Today Online,auto,2020-02-05
248,Dog owners in China scramble to buy masks for pets in wake of coronavirus,https://www.todayonline.com/world/dog-owners-china-scramble-buy-masks-pets-wake-coronavirus,2020-05-02,Today Online,auto,2020-02-05
249,"Mothers may pass coronavirus to unborn children, say Chinese doctors",https://www.todayonline.com/world/mothers-may-pass-coronavirus-unborn-children-say-chinese-doctors,2020-05-02,Today Online,auto,2020-02-05
250,"Novel coronavirus: S’pore confirms 4 more cases, 3 of these locally transmitted and linked to same tour group from Guangxi",https://www.todayonline.com/singapore/wuhan-novel-coronavirus-spore-confirms-4-more-cases-3-these-locally-transmitted-and-linked-same,2020-05-02,Today Online,auto,2020-02-05
251,"When fake news, censorship make it harder to tackle a coronavirus",https://www.todayonline.com/commentary/when-fake-news-censorship-make-it-harder-tackle-coronavirus,2020-05-02,Today Online,auto,2020-02-05
252,At least 10 on Japan cruise ship have coronavirus: Minister,https://www.todayonline.com/world/least-10-japan-cruise-ship-have-coronavirus-minister,2020-05-02,Today Online,auto,2020-02-05
253,"Four-year-old Chinese girl in Langkawi with coronavirus cured, allowed to fly home",https://www.todayonline.com/world/four-year-old-chinese-girl-langkawi-coronavirus-cured-allowed-fly-home,2020-05-02,Today Online,auto,2020-02-05
254,Explainer: What to know about the HIV drugs touted as weapon in war on coronavirus,https://www.todayonline.com/world/explainer-what-you-need-know-about-hiv-drugs-touted-weapon-war-coronavirus,2020-05-02,Today Online,auto,2020-02-05
255,Hundreds held on cruise ship in Hong Kong as authorities check for coronavirus,https://www.todayonline.com/world/hundreds-held-cruise-ship-hong-kong-authorities-check-virus,2020-05-02,Today Online,auto,2020-02-05
256,Government donates S$1 million to Singapore Red Cross to aid communities in China stricken by coronavirus,https://www.todayonline.com/singapore/government-donates-s1-million-singapore-red-cross-aid-communities-china-stricken,2020-05-02,Today Online,auto,2020-02-05
257,Fear and takeout: 14 days in coronavirus ‘self-quarantine’,https://www.todayonline.com/world/fear-and-takeout-14-days-coronavirus-self-quarantine,2020-05-02,Today Online,auto,2020-02-05
258,Viral hysteria: Hong Kong panic sparks run on toilet paper,https://www.todayonline.com/world/viral-hysteria-hong-kong-panic-sparks-run-toilet-paper,2020-06-02,Today Online,auto,2020-02-06
259,"Govt to speed up transport projects, roll out ‘strong’ Budget package, as aviation sector hurt by coronavirus: Khaw",https://www.todayonline.com/singapore/government-speed-transport-projects-strong-budget-package-aviation-sector-hurt-wuhan-coronavirus,2020-06-02,Today Online,auto,2020-02-06
260,Chinese baby tests positive for coronavirus just 30 hours after birth,https://www.todayonline.com/world/chinese-baby-tests-positive-coronavirus-just-30-hours-after-birth,2020-06-02,Today Online,auto,2020-02-06
261,Malaysia confirms first local coronavirus transmission,https://www.todayonline.com/world/malaysia-confirms-first-local-coronavirus-transmission,2020-06-02,Today Online,auto,2020-02-06
262,Why the novel coronavirus (mostly) spares children,https://www.todayonline.com/world/why-novel-coronavirus-mostly-spares-children,2020-06-02,Today Online,auto,2020-02-06
263,"China reports 73 new coronavirus deaths on mainland, death toll reaches 563",https://www.todayonline.com/world/china-reports-73-new-deaths-mainland-coronavirus-death-toll-reaches-563,2020-06-02,Today Online,auto,2020-02-06
264,"As coronavirus infects economy, one bank slashes Singapore’s 2020 growth forecast",https://www.todayonline.com/singapore/wuhan-coronavirus-infects-economy-one-bank-slashes-singapores-2020-growth-forecast,2020-06-02,Today Online,auto,2020-02-06
265,Ten more on cruise ship in Japan test positive for coronavirus,https://www.todayonline.com/world/ten-more-cruise-ship-japan-test-positive-coronavirus,2020-06-02,Today Online,auto,2020-02-06
266,Taiwan restricts Hong Kong and Macau travellers amid coronavirus outbreak,https://www.todayonline.com/world/taiwan-restricts-hong-kong-and-macau-travellers-amid-coronavirus-outbreak,2020-06-02,Today Online,auto,2020-02-06
267,China weighs benefits of buffalo horn and other traditional remedies to treat novel coronavirus,https://www.todayonline.com/world/china-weighs-benefits-buffalo-horn-and-other-traditional-remedies-treat-novel-coronavirus,2020-06-02,Today Online,auto,2020-02-06
268,China clamps down on coronavirus coverage as cases surge,https://www.todayonline.com/world/china-clamps-down-coronavirus-coverage-cases-surge,2020-06-02,Today Online,auto,2020-02-06
269,"Novel coronavirus: 2 more cases in S’pore, including one with no travel history to China or apparent link with previous cases",https://www.todayonline.com/singapore/wuhan-novel-coronavirus-2-more-cases-singapore-no-travel-history-china-or-link,2020-06-02,Today Online,auto,2020-02-06
270,Novel coronavirus: What we know about the fatalities,https://www.todayonline.com/world/novel-coronavirus-what-we-know-about-fatalities,2020-06-02,Today Online,auto,2020-02-06
271,Novel coronavirus: Travel bans upend Chinese lives,https://www.todayonline.com/world/novel-coronavirus-travel-bans-upend-chinese-lives,2020-06-02,Today Online,auto,2020-02-06
272,"More than 100 people attended meeting at Grand Hyatt Singapore linked to Malaysia, South Korea cases",https://www.todayonline.com/singapore/more-100-people-attended-meeting-grand-hyatt-singapore-linked-malaysia-south-korea-cases,2020-06-02,Today Online,auto,2020-02-06
273,WHO investigates Singapore conference linked to foreign coronavirus spread,https://www.todayonline.com/singapore/who-investigates-singapore-conference-linked-foreign-wuhan-coronavirus-spread,2020-06-02,Today Online,auto,2020-02-06
274,Novel coronavirus: Several businesses visited by tour group linked to local transmissions still closed,https://www.todayonline.com/singapore/wuhan-novel-coronavirus-several-businesses-visited-tour-group-linked-local-transmissions-still,2020-06-02,Today Online,auto,2020-02-06
275,"Desperate scenes in Hong Kong as 10,000 queue for masks at industrial estate",https://www.todayonline.com/world/desperate-scenes-hong-kong-10000-queue-masks-industrial-estate,2020-06-02,Today Online,auto,2020-02-06
276,Private-hire drivers concerned about novel coronavirus outbreak but Grab cancellation policies unchanged,https://www.todayonline.com/singapore/private-hire-drivers-concerned-about-novel-wuhan-coronavirus-outbreak-grab-cancellation-policies,2020-06-02,Today Online,auto,2020-02-06
277,Govt steps up leave of absence regime for all workers returning to S’pore from China,https://www.todayonline.com/singapore/all-workers-returning-spore-china-serve-mandatory-14-day-leave-absence-lawrence-wong,2020-06-02,Today Online,auto,2020-02-06
278,Coronavirus crisis shows shortcomings of governance in China,https://www.todayonline.com/commentary/wuhan-coronavirus-crisis-shows-shortcomings-governance-china,2020-06-02,Today Online,auto,2020-02-06
279,Working with strangers past midnight: How various agencies got mask distribution website up and running,https://www.todayonline.com/singapore/working-strangers-past-midnight-how-various-agencies-got-maskgowheregovsg-and-running,2020-07-02,Today Online,auto,2020-02-07
280,"Novel coronavirus: Li Wenliang, doctor who alerted authorities to the outbreak, dies of the disease",https://www.todayonline.com/world/wuhan-novel-coronavirus-li-wenliang-doctor-who-alerted-authorities-outbreak-dies-disease,2020-07-02,Today Online,auto,2020-02-07
281,Coronavirus cases on cruise liner off Japan jump to 61,https://www.todayonline.com/world/another-41-cruise-liner-japan-test-positive-coronavirus,2020-07-02,Today Online,auto,2020-02-07
282,Employers must seek approval from MOM for work pass holders returning to Singapore after travel to China,https://www.todayonline.com/singapore/wuhan-coroanvirus-employers-must-seek-approval-mom-work-pass-holders-returning-singapore-travel-china,2020-07-02,Today Online,auto,2020-02-07
283,VJC to suspend activities after teacher has coronavirus infection; schools to take more precautionary measures,https://www.todayonline.com/singapore/vjc-suspend-activities-after-teacher-has-wuhan-coronavirus-infection-schools-take-more,2020-07-02,Today Online,auto,2020-02-07
284,Britain urges doctors to step up vigilance after third citizen infected with coronavirus,https://www.todayonline.com/world/britain-urges-doctors-step-vigilance-after-third-citizen-infected-coronavirus,2020-07-02,Today Online,auto,2020-02-07
285,"Novel coronavirus: S’pore moves to Dorscon Orange, as 3 new cases confirmed with no apparent link to previous cases or recent travel to China",https://www.todayonline.com/singapore/wuhan-novel-coronavirus-spore-moves-dorscon-orange-3-new-cases-confirmed-no-apparent-links-previous-cases,2020-07-02,Today Online,auto,2020-02-07
286,"Dorscon Orange: What it means for schools, workplaces and healthcare institutions",https://www.todayonline.com/singapore/wuhan-coronavirus-dorscon-orange-what-means-schools-workplaces-healthcare-institutions,2020-07-02,Today Online,auto,2020-02-07
287,Singapore planning second evacuation flight from Wuhan: MFA,https://www.todayonline.com/singapore/singapore-planning-second-evacuation-flight-wuhan-mfa,2020-07-02,Today Online,auto,2020-02-07
288,CNA debunks fake tweet announcing school closure due to coronavirus outbreak,https://www.todayonline.com/singapore/cna-debunks-fake-tweet-announcing-school-closure-due-coronavirus-outbreak,2020-07-02,Today Online,auto,2020-02-07
289,"WHO plays down dip in daily coronavirus infection rate, saying it might not mean outbreak has peaked",https://www.todayonline.com/world/who-plays-down-dip-daily-coronavirus-infection-rate-saying-it-might-not-mean-outbreak-has,2020-07-02,Today Online,auto,2020-02-07
290,"Mother-baby coronavirus transmission yet to be proven, doctor says",https://www.todayonline.com/world/mother-baby-coronavirus-transmission-yet-be-proven-doctor-says,2020-07-02,Today Online,auto,2020-02-07
291,Officials fired after disabled Chinese boy died when relatives put in coronavirus quarantine,https://www.todayonline.com/world/officials-fired-after-disabled-chinese-boy-died-when-relatives-put-coronavirus-quarantine,2020-07-02,Today Online,auto,2020-02-07
292,To die or to go broke? That’s the risk businesses in China are weighing amid novel coronavirus,https://www.todayonline.com/commentary/wuhan-coronavirus-its-not-business-usual-china,2020-07-02,Today Online,auto,2020-02-07
293,"Mainland China reports 73 new coronavirus deaths on Feb 6, toll rises to 636",https://www.todayonline.com/world/mainland-china-reports-73-new-coronavirus-deaths-feb-6-toll-rises-636,2020-07-02,Today Online,auto,2020-02-07
294,In sickness and in health: mass wedding defies virus fears,https://www.todayonline.com/world/sickness-and-health-mass-wedding-defies-virus-fears,2020-07-02,Today Online,auto,2020-02-07
295,"Chinese hospital pharmacist, 28, dies after 10 straight days helping fight coronavirus",https://www.todayonline.com/world/chinese-hospital-pharmacist-28-dies-after-10-straight-days-helping-fight-coronavirus,2020-07-02,Today Online,auto,2020-02-07
296,"China's Hubei province reports 69 new coronavirus deaths and 2,447 new cases",https://www.todayonline.com/world/chinas-hubei-province-reports-69-new-coronavirus-deaths-and-2447-new-cases,2020-07-02,Today Online,auto,2020-02-07
297,5 Singaporeans on board quarantined cruise ship off Japan ‘physically well’: MFA,https://www.todayonline.com/singapore/5-singaporeans-board-quarantined-wuhan-coronavirus-cruise-ship-japan-physically-well-mfa,2020-07-02,Today Online,auto,2020-02-07
298,Novel coronavirus: Why China is in the grips of a facial mask shortage as death toll grows,https://www.todayonline.com/world/novel-coronavirus-why-china-grips-facial-mask-shortage-death-toll-grows,2020-07-02,Today Online,auto,2020-02-07
299,"7 new coronavirus cases in S'pore, including taxi and private hire drivers; possible cluster at Paya Lebar church identified",https://www.todayonline.com/singapore/7-new-wuhan-coronavirus-cases-singapore-taxi-private-hire-drivers-paya-lebar-church-cluster,2020-08-02,Today Online,auto,2020-02-08
300,"Coronavirus recovery rates ‘promising’, infectious disease expert says",https://www.todayonline.com/world/coronavirus-recovery-rates-promising-infectious-disease-expert-says,2020-08-02,Today Online,auto,2020-02-08
301,"Novel coronavirus: Working from home a new, at times frustrating, experience for some",https://www.todayonline.com/world/novel-coronavirus-working-home-new-times-frustrating-experience-some,2020-08-02,Today Online,auto,2020-02-08
302,"Novel coronavirus: Thaipusam festival goes smoothly amid heightened alert, but other events get cancelled",https://www.todayonline.com/singapore/novel-coronavirus-thaipusam-festival-goes-smoothly-amid-heightened-alert-other-events-get,2020-08-02,Today Online,auto,2020-02-08
303,Nine members of Hong Kong family feared infected with coronavirus after hotpot meal,https://www.todayonline.com/world/nine-members-hong-kong-family-feared-infected-after-hotpot-meal,2020-09-02,Today Online,auto,2020-02-09
304,Novel coronavirus: MOM cancels work passes and employers' work pass privileges after leave of absence breached,https://www.todayonline.com/singapore/mom-cancels-work-passes-and-employers-work-pass-privileges-after-leave-absence-breached,2020-09-02,Today Online,auto,2020-02-09
305,Second flight carrying 174 Singaporeans from Wuhan lands; medical screening and quarantine for passengers,https://www.todayonline.com/singapore/second-flight-carrying-174-singaporeans-wuhan-lands-medical-screening-and-quarantine,2020-09-02,Today Online,auto,2020-02-09
306,"Novel coronavirus: 3 new cases confirmed, all have not recently travelled to China",https://www.todayonline.com/singapore/novel-coronavirus-3-new-cases-confirmed-all-have-not-recently-travelled-china,2020-09-02,Today Online,auto,2020-02-09
307,How not to get sick while travelling,https://www.todayonline.com/world/how-not-get-sick-while-travelling,2020-09-02,Today Online,auto,2020-02-09
308,'I'm not reckless': China courier braves coronavirus to keep city supplied,https://www.todayonline.com/world/not-reckless-china-courier-braves-coronavirus-keep-city-supplied,2020-09-02,Today Online,auto,2020-02-09
309,Spanish authorities confirm Briton is country's second coronavirus case,https://www.todayonline.com/world/spanish-authorities-confirm-briton-countrys-second-coronavirus-case-0,2020-09-02,Today Online,auto,2020-02-09
310,Malaysia expands China traveller ban as coronavirus spreads,https://www.todayonline.com/world/malaysia-expands-china-traveller-ban-coronavirus-spreads-1,2020-09-02,Today Online,auto,2020-02-09
311,"Dorscon Orange: NUS, NTU, SMU move large lectures online, suspend mass events",https://www.todayonline.com/singapore/wuhan-coronavirus-dorscon-orange-nus-ntu-smu-move-large-lectures-online-suspend-mass-events,2020-09-02,Today Online,auto,2020-02-09
312,"Novel coronavirus deaths in mainland China rise past 800, overtaking Sars toll",https://www.todayonline.com/world/novel-coronavirus-deaths-mainland-china-rise-past-800-overtaking-sars-toll,2020-09-02,Today Online,auto,2020-02-09
313,Novel coronavirus: One congregant of Paya Lebar church identified as possible cluster is ‘in critical condition’ in ICU,https://www.todayonline.com/singapore/novel-wuhan-coronavirus-paya-lebar-life-church-missions-possible-cluster-congregant-icu,2020-09-02,Today Online,auto,2020-02-09
314,"FairPrice limits purchase of items such as toilet paper, rice after panic buying following raising of coronavirus alert",https://www.todayonline.com/singapore/ntuc-fairprice-limits-purchase-toilet-paper-noodles-hoarding-wuhan-coronavirus-orange,2020-09-02,Today Online,auto,2020-02-09
315,Panic buying will undermine international confidence in Singapore: Chan Chun Sing,https://www.todayonline.com/singapore/panic-buying-will-undermine-international-confidence-singapore-chan-chun-sing,2020-09-02,Today Online,auto,2020-02-09
316,Thousands from cruise ship in Hong Kong released from quarantine after coronavirus tests,https://www.todayonline.com/world/thousands-cruise-ship-hong-kong-released-quarantine-after-coronavirus-tests,2020-09-02,Today Online,auto,2020-02-09
317,"Over 70 Singapore Airshow exhibitors have pulled out, public tickets limited",https://www.todayonline.com/singapore/over-70-singapore-airshow-exhibitors-have-pulled-out-public-tickets-limited,2020-09-02,Today Online,auto,2020-02-09
318,"Hit by novel coronavirus, Asian business group to truck three million Malaysian medical gloves to Wuhan",https://www.todayonline.com/world/hit-novel-coronavirus-asian-business-group-truck-three-million-malaysian-medical-gloves-wuhan,2020-10-02,Today Online,auto,2020-02-10
319,"Nurses in S’pore wary of being ostracised by public, even as work takes its toll during coronavirus outbreak",https://www.todayonline.com/singapore/nurses-wary-being-ostracised-public-as-work-takes-its-toll-during-wuhan-coronavirus-outbreak,2020-10-02,Today Online,auto,2020-02-10
320,"At least 65 more coronavirus cases confirmed on cruise ship in Japan, captain says",https://www.todayonline.com/world/sixty-more-people-confirmed-coronavirus-cruise-ship-japan-tbs-tv,2020-10-02,Today Online,auto,2020-02-10
321,"Malaysia confirms 17th case of coronavirus, woman related to Singapore conference attendee",https://www.todayonline.com/world/malaysia-confirms-17th-case-coronavirus-woman-related-singapore-conference-attendee,2020-10-02,Today Online,auto,2020-02-10
322,Malaysia confirms 18th coronavirus case as man with travel history to China tests positive,https://www.todayonline.com/world/malaysia-confirms-18th-coronavirus-case-man-travel-history-china-tests-positive,2020-10-02,Today Online,auto,2020-02-10
323,"Novel coronavirus: Singapore tourism sector to take a hit for at least 6 to 8 months, experts say",https://www.todayonline.com/singapore/wuhan-novel-coronavirus-singapore-tourism-sector-take-hit-least-six-eight-months,2020-10-02,Today Online,auto,2020-02-10
324,"China reports 97 new coronavirus deaths on mainland, death toll rises to 908",https://www.todayonline.com/world/china-reports-97-new-coronavirus-deaths-mainland-death-toll-rises-908,2020-10-02,Today Online,auto,2020-02-10
325,Sarawak to impose 14-day self-quarantine for travellers from Singapore,https://www.todayonline.com/world/sarawak-impose-14-day-self-quarantine-travellers-singapore,2020-10-02,Today Online,auto,2020-02-10
326,Up to 40 per cent fall in taxi and private hire driver earnings as novel coronavirus keeps passengers away,https://www.todayonline.com/singapore/40-cent-fall-taxi-and-private-hire-driver-earnings-novel-wuhan-coronavirus-keeps-passengers-away,2020-10-02,Today Online,auto,2020-02-10
327,"Two girls’ inspiring mission to deliver breakfast to tired doctors, nurses fighting novel coronavirus",https://www.todayonline.com/singapore/two-girls-inspiring-mission-deliver-breakfast-tired-doctors-nurses-fighting-wuhan-coronavirus,2020-10-02,Today Online,auto,2020-02-10
328,"Police seek information on video of youth taking a swig from supermarket drink, then placing it back on shelf",https://www.todayonline.com/singapore/police-seek-information-video-youth-taking-swig-supermarket-drink-then-placing-it-back,2020-10-02,Today Online,auto,2020-02-10
329,Time to turn off aircon but not to ditch pets: Singapore experts weigh in on coronavirus outbreak,https://www.todayonline.com/singapore/time-turn-aircon-not-abandon-pets-singapore-experts-answer-questions-wuhan-coronavirus,2020-10-02,Today Online,auto,2020-02-10
330,"No risk of running short of food from short-term disruptions, but climate change poses a greater challenge: Masagos",https://www.todayonline.com/singapore/no-risk-running-short-food-short-term-disruptions-climate-change-poses-greater-challenge,2020-10-02,Today Online,auto,2020-02-10
331,"Novel coronavirus: Singapore confirms 2 more cases, 1 of them a Certis Cisco officer who served quarantine orders on patients",https://www.todayonline.com/singapore/novel-coronavirus-singapore-confirms-2-more-cases-1-them-cisco-officer-who-served,2020-10-02,Today Online,auto,2020-02-10
332,"Singapore Airlines, SilkAir suspend some flights to China over coronavirus outbreak",https://www.todayonline.com/singapore/singapore-airlines-silkair-suspend-some-flights-china-over-coronavirus-outbreak,2020-10-02,Today Online,auto,2020-02-10
333,"Novel coronavirus: Kuwait, Qatar urge citizens to delay travel plans to Singapore",https://www.todayonline.com/singapore/novel-coronavirus-kuwait-urges-citizens-leave-singapore-delay-travel-plans,2020-10-02,Today Online,auto,2020-02-10
